,movie_comment,movie_id,movie_score,movie_time,user_id
218,看了日剧，就好想斗志昂扬地去工作呀！可工作只是虚幻。那就看韩剧，然而爱情也是虚幻；看泰剧，亲情同样虚幻；看美剧，人生都是虚幻；看英剧，整个人类史都是虚幻......＃我想，大概我们的人生就是实实在在操心忙碌这些虚幻的东西然后被充实的吧。哈哈＃,26853460,4,2017-01-13,wangranran
219,看这部剧，像遇到一个爱人，起先没觉得他多好，也就是普通人，比身边其他人特别那么一点点。然后，相处过程中却发现越来越合拍，总有天真的惊喜在前头，灵魂深刻，原来这个人看似平凡，却如此丰富。于是，渐入佳境。是的，看这部剧的感觉就是——渐入佳境。,26811832,5,2017-01-11,wangranran
220,,26862270,4,2017-01-10,wangranran
221,男主角可以用琴召唤折纸的技能，有点想拥有。,26287884,3,2017-01-10,wangranran
222,最丧的难道不是一个人的生死根本不掌握在自己手里，而是莫名攥在千里之外一堆不相干的人身上，莫名与另一堆甚至不知姓名的人放在一个天平上，莫名系在某一个命运的点上……#活着嘛就随便㓉一下，反正会死的#,10484117,3,2017-01-09,wangranran
223,豆瓣为什么不能打负分！为什么不能打负分！为什么不能打负分！#不要跟我讲什么不要想他是王家卫拍的就还行，就算导演是邓超它也是部烂片！不要跟我讲要不是觉得梁朝伟、金城武被糟蹋也没那么烂，屁！它还糟蹋了陈奕迅、贾玲、马苏……烂就一个字，罄竹难书！#,25911694,1,2017-01-07,wangranran
224,女主可爱到犯规，男主的平庸与自卑显然更让我有共鸣。脑洞大是大的，不过最终还是要落入恋爱结婚的套路，当然，最大的套路是结局的皆大欢喜。剧中有很多观点还是值得赞的，比如百合子对于单身女性的言论，最喜欢百合子了，觉得看上去就徒有其表的男二并不能配上她！,26816519,5,2017-01-06,wangranran
225,只有一集？！我还等着看正片呢，这不只是前传么？！事实证明，只有不努力的同志，没有掰不弯的直男！哈哈,26932873,4,2017-01-06,wangranran
226,好长的电影，看得太累了……,25894431,3,2017-01-05,wangranran
227,好在我是个怂人，不擅长冒险，只擅长认怂……明明是假的游戏，结果闹到真的要人命；而最终真的结束游戏，却是用了假死……这世界也是讽刺。#不能戴上面具，我们就都成了帮凶#,26313740,3,2017-01-03,wangranran
228,电影最伤感的一幕出现在艾米获格莱美奖时，在她人生最重要的时刻，她不能到场见证，最爱的人不在身边（在狱中）……当人们为她狂欢，她把好友拉去后台说：“没有毒品，这一切都毫无意义。”#我们眼见一个人拥有了我们终其一生追求的东西：财富、名望、爱情、才华……然而正是这些一点点毁了她。#,24532442,4,2016-12-26,wangranran
229,将小儿女的爱恨与大时局的动荡结合起来的文艺作品，远的如《红楼梦》，后来有张爱玲的《倾城之恋》……如今有新海城《你的名字。》这部电影的可怕之处在于，可能并非每个人都曾遭遇过灾难，然而每个人却都曾错过过那个心中留有你印记，然而可能叫不出你的名字的人……,26683290,4,2016-12-17,wangranran
230,《长城》这样的电影真是让观众犯难，不看iMax吧，精髓就是大场面啊！看iMax吧，还要多花钱……更心痛！#喜欢鹿晗的可以去看，喜欢彭于晏、黄轩的就别去看了，没什么戏份。喜欢王俊凯？看呀！反正你们也不是喜欢他演技。喜欢张艺谋……你说《英雄》前的？还是《英雄》后的？#,6982558,3,2016-12-15,wangranran
231,,26761935,4,2016-12-12,wangranran
232,生活就是这样啊，没有合而为一，两全其美的事情。活得潇洒的自然孤独，活得热闹的自然会有羁绊。贪恋妈妈那一口温暖合口味的餐饭，还希望妈妈不唠叨，哪有这么好的事呢。所以选择很重要，更重要是选择之后的认定，坚持，与修正。#方案A、方案B都不惨，说A惨的是不用选择，羡慕B的是没得选择#,26785286,4,2016-12-12,wangranran
233,太有负大家的期待，以及这些好演员，和好美术了，还有好音乐。很少看一部电影这么烦躁，一直就是不停开枪杀人，开枪杀人……也并没有好好讲故事，每个人都不懂到底在干什么。,24751763,3,2016-12-07,wangranran
234,愿意给它三颗星，是因为没想到居然是有剧本的，结果非职业演员们呈现出了很自然的表演。这种日常生活的展现，不是说不好，只是有点太长了。一种纪录片式的关于生与死的交流。#可能因为最近和妈妈在一起聊天就是这样的状态，所以很多琐碎的台词还是有共鸣——当你去了异乡，家乡也就成了另一个异乡#,10807880,3,2016-12-02,wangranran
235,这部纪录片拍的是人，是人在故宫的生活，鲜活的生活。#人修文物，文物修人#,26910059,5,2016-12-01,wangranran
236,熬过了开头那一点点吓人（当然，主要是因为我怂），后面就好看了。时间穿越以及拥有魔法这种事情总是迷人的，哪怕蒂姆·波顿不改恶趣味……#爱娃·格林的佩小姐当然美，但如果不分手，这个角色应该是海伦娜·卡特的吧！#,7051830,5,2016-12-01,wangranran
237,深情的男人必然不勇敢，责任是逃避的遮羞布，爱情是欲望另一个好听的名字。孔侑前面演得太纯情了，好得让人想逃，越发觉得这美好是不可能属于自己的。在列车那里，我以为全度妍会趁他睡着逃走，她没有，之后她就再也逃不走了。之后，就只能眼睁睁看着他逃走了。,25835285,3,2016-11-30,wangranran
238,这部剧剧组之穷，连个婚礼都拍不起。造型师之差，男主的每套衣服都丑，西装可以凑成七色花。化妆也敷衍，女主的黑眼圈都盖不住……但就是让我从头追到了尾，我想了想一定是因为人家细节做得好，男女主之间有火花，以及地主家的傻儿子人设……主要是地主家的傻儿子人设！#剧名和我的小说名还多配的#,26806792,5,2016-11-26,wangranran
239,有彩蛋哦！真的有彩蛋哦！#一个傻傻等到最后字幕都走光才怏怏离开的麻瓜就是忍不住想要骗骗大家！哈哈#,25726614,4,2016-11-23,wangranran
240,,26806061,3,2016-11-21,wangranran
241,电影前半部是李雪莲要告状，官员避之如瘟疫。到后半部，李雪莲告了十年了，不想告了，官员又不信了，防李雪莲如防川。这是讽刺世情，也是触及人性。#男演员们的演技都太好了，尤其于和伟，把范冰冰衬得有点弱。当然也可能现实里中年男就那样，而李雪莲却是没法参照的。#,26630781,4,2016-11-19,wangranran
242,更让我确定了电影是大众的艺术，而话剧才是文艺的狂欢。导演后面为了给观众解释清楚所谓的分身，来来回回折腾，结果反而让观众看不明白了。还显得冗长而煽情，不懂克制。彩蛋部分神反转又扳回一星。,26696879,3,2016-11-18,wangranran
243,十分有趣，这部电影名叫《爱情与友谊》，但哪里有爱情和友谊？有的只是自私的算计，步步为营的圈套，以及相互利用。当人人都工于心计，当本该纯粹的都不再纯粹，苏珊夫人这种人便有机可乘。物必自腐然后虫生。,25851799,4,2016-11-16,wangranran
244,人物也美，风景也美，音乐也美，故事也美。到最后君子报仇已经不是有没有实际意义的问题了，只是为了履行君子协定而已。有些人，双手沾满血，内心鄙琐，就是不该让他享有寿终正寝。#最后一幕导演不舍让我们看到老去女主角的脸，真好#,1301106,5,2016-11-11,wangranran
245,原本以为会看一部轻松喜悦，从一而终，浪漫深情，王子公主般的爱情故事，结果……相爱的人并没有能坚持着走到一起，而且，之后各自的生活都还过得很好。嗯，这样很好。很适合单身汪在双十一前愉快地观赏。,1301646,4,2016-11-10,wangranran
246,李安要说的一直以来都是选择！高伟同选择顺从父母，还是举行了喜宴；王佳芝选择还是放走了易先生；比利·林恩选择依旧回到伊拉克……其实李安一直想说的是人生的别无选择啊！我想，没有比天秤座更知道选择的重要，和选择的痛苦，以及选择的无奈了。#可能因为我不是技术控，120帧不影响我的观感。#,25983044,5,2016-11-08,wangranran
247,第一部男一为男二死哭，第二部男二为男一死哭，两人眼泪还来还去；男二遇到困难就喊男一的名字，男一遇到困难就记挂着保护男二；男一的日常就是各种调戏男二，男二的日常就是被调戏生气但就是忠犬不走；男二喜欢上一个女的，这个女的就必死，最后只能和男一在一起赏花喝酒，相亲相爱……#这剧有毒#,1308379,4,2016-11-04,wangranran
248,都这样了，你还跟我说安倍晴明和源博雅不是一对？你当我瞎吗！,1303917,4,2016-11-03,wangranran
249,人生到最后就都只剩下回忆，而爱情永远是回忆中的亮色，还有友谊，亲情，青春……他们终将逝去，但我们都曾拥有。,10484041,5,2016-10-29,wangranran
250,故事讲得乱七八糟，人设也是莫名其妙，情感线更是混乱不堪……但韩国小娃太可爱了！,26253737,3,2016-10-26,wangranran
251,虽然阿鲁克·汗一人分饰两角很厉害，但本片三观我还是接受无能……只想让明星看看，引以为戒，粉丝疯狂起来多吓人！,25824009,2,2016-10-26,wangranran
252,故事漏洞百出呀，虽然最后汽车爆破戏真的还蛮绝的。,26365631,3,2016-10-26,wangranran
253,你以为可以得到的一定得不到，你以为能够失去的一定不能够，你以为绝不会在一起的一定会在一起，你以为终将仳离的终将仳离……这就是伍迪•艾伦的电影，也是生活的样子。,1292764,4,2016-10-24,wangranran
254,看到最后真的好难过……话剧有电影无法做到的癫狂，电影也有话剧无法企及的抒情。事情是荒诞的，世界是荒诞的，人性最荒诞。#一曼老师最美！#,25921812,5,2016-10-20,wangranran
255,电影中有一幕奥勃洛莫夫在女主角家外候了一夜，晨曦渐起，阳光照向树林，地上是树木的影子，树上是金黄的光斑……真的好久没有在电影中看到这么美的自然光影了。#小时候都以为长大后我们会成为有用的人，然而长大之后我们都是多余人#,1298646,4,2016-10-17,wangranran
256,起先他想回家，后来他更想回到和他在一起的那段时光。他是他将要赴死时遇见的死人，却也是给他生之希望的人……他是来渡他的，之后他还要去渡别人了。,26437237,4,2016-10-11,wangranran
257,又是一个脑洞大开的故事，又是一个让人意料之外的结局。,25881888,3,2016-10-11,wangranran
258,为结尾，我愿意多加它一颗星。,1451911,4,2016-10-10,wangranran
259,我们都生而惆怅，死于心碎。既然选择了现实的冒险，那就要接受偿付不完美的代价，况且也不是无所得，至少终于下决心离开糟烂生活，还有段美好回忆！#还是让现实保持冰冷，然后用虚构完美抚慰#,1292994,,2016-10-09,wangranran
260,,26884522,5,2016-10-08,wangranran
261,虽然把福楼拜都抬出来了，但依旧是男性视角。夏尔医生变得有了男子气概，省略了莱昂的爱情基础，罗多尔夫彻底现实冰冷毫无魅力……于是包法利夫人就变成一个自作自受的可怜虫，而已。,1300319,2,2016-10-08,wangranran
262,文艺女青年一定要买房啊！！！！少女时代寄人篱下是林黛玉，势利之下总还有几分同情怜惜；青春不再，寄人篱下就是白兰芝，只剩下被侮辱与被损害……当然，就算有与文艺和美梦匹配的房子，也可能变成诺玛（《日落大道》），依然没有与房子相匹配的爱情与名望……这世界对女人太糟糕了！,1293590,5,2016-10-07,wangranran
263,生活真是完全的虚妄啊！欺骗自然是沙上建塔，一定会坍塌的，可是你看，就算面对一个人掏心掏肺，最终还是连对方电话号码都没有得到，约饭还不如约炮来得实在……#凯特自然是演得好的，妹妹演得也好，完全没有想起就是《指匠情挑》的小女仆。#,10576419,4,2016-10-07,wangranran
264,看完伍迪•艾伦总让我有想写小说的冲动，也总让我知道我绝不可能有他写得好。#这就是魅力#,1295452,4,2016-10-05,wangranran
265,也算是开创了一种电影类型，叫做“格言电影”……#那些矫情和自恋的话，真是让人毛骨悚然地尴尬#,26280528,1,2016-10-04,wangranran
266,看到电影最后一幕，居然还有一些感动,1298385,4,2016-10-03,wangranran
267,爱是恒久忍耐……女主和男主之间的，女主和丈夫之间的。#女主和男主之间居然除了一个意外之吻，连一次接吻都没有。#,3645150,4,2016-09-29,wangranran
268,男主角不是张涵予不是彭于晏，而是那只叫哮天的犬～～,25815034,3,2016-09-27,wangranran
269,爱情，开始总是分分钟都妙不可言，后来却一步步总走向了柴米油盐……#只要你情我愿，就是两不相欠#,1308808,4,2016-09-26,wangranran
270,妻夫木聪和瑛太是兄弟，难道这不就是真的吗？！,1773614,3,2016-09-21,wangranran
271,孔侑，没想到你还有两副面孔！韩基俊那一面真的是萌坏了！萌坏了！,4851900,4,2016-09-21,wangranran
272,终于选在中秋节把这部电影看完了……丧尸确实不吓人，因为有的人更吓人。#人性都是经不起考验的，所以那些好的品性更加值得珍惜#,25986180,4,2016-09-16,wangranran
273,和帅爸爸在一起玩耍的夏天～～是啊，十八岁之前才有童年阴影，成年之后，都叫作。,26820450,4,2016-09-14,wangranran
274,又是高开低走的剧，还是中山美穗颜崩坏得太厉害了，实在没有说服力让人相信一家人都爱她一个啊……而且啰嗦又是够啰嗦的，但该说清的却也没说清——我想知道她到底如何做到将小狼狗调教成小忠犬的呀！指导指导读书、开酒就可以了？！你不要忽悠我呀～～,26820448,3,2016-09-13,wangranran
275,曹保平出品果然都有品质保证。讲一个蠢“五星杀手”的故事，张译太不容易了，被整得好惨！,26284621,5,2016-09-11,wangranran
276,没有治愈系，只有治愈细，所谓治愈都是极细极细，极细极细……,26356789,5,2016-09-07,wangranran
277,虽然不是猫奴，虽然剧情简单粗暴，虽然有煽情之嫌……但，还是让人又笑又泪啊！,26314816,4,2016-09-07,wangranran
278,可能知道小说太难改编，所以期待值特别低，因此反而意料之外的还不错。可能导演是男生的缘故，所以洗白了些家明（没办法，不洗白家明也会觉得七月和安生不值），但也丰富了七月与安生的性格——当女人不谈爱情，性格就立刻可爱和有趣起来了呢。,25827935,4,2016-09-06,wangranran
279,小田切让太美了，美到让人觉得导演用他真的会喧宾夺主。电影中有很多令人心酸的镜头，也有很多让人感觉温暖的段落……和现实一样。,1482297,5,2016-09-05,wangranran
280,斋藤工，斋藤工，斋藤工！,24695953,4,2016-09-04,wangranran
281,自然的美景，淡淡的日常，琐碎的亲情……这就是生活。,25895901,5,2016-09-02,wangranran
282,音乐拯救世界！,22939161,4,2016-09-01,wangranran
283,斋藤工真是可直可弯，可攻可受啊,2173889,3,2016-08-30,wangranran
284,,26020796,5,2016-08-29,wangranran
285,“再也不去东京了……”每个在城里生活的孩子和家乡老人都有爱之疏离～～,5996409,4,2016-08-27,wangranran
286,水花中的夏天，傻白甜的少年，青春无敌的妻夫木聪！#结尾的花样游泳表演我也就看了十遍吧#,1301359,5,2016-08-24,wangranran
287,一星给电影名，一星给情色镜头。,10508874,2,2016-08-15,wangranran
288,这就是用来骗养宠物的人的电影呀……真正的宠物才没这么乖萌呢！哼～～,21817627,4,2016-08-13,wangranran
289,太好看了！每个成功的艺术家背后，都有一个伟大的编辑、经纪人、助理、销售、店员……看似十分普通的工作，其实也是梦想不可缺少的一环。,26602304,5,2016-08-11,wangranran
290,虽然朋友已有预警，但最后两集还是让我又哭又笑了。好喜欢结尾，特别害怕最后让他们成功了（我这什么心理），幸好没有……我们都在故事的途中。,26635329,5,2016-08-05,wangranran
291,不敢玩这个游戏的人，其实都是人生赢家啊……没有真正坦荡的人，只有苍白的人生。#结局细思恐极#,26614893,4,2016-08-04,wangranran
292,王思聪演王思聪……,26301582,3,2016-08-02,wangranran
293,BBC根据原著改编的版本果然更加荡气回肠啊……,1417051,4,2016-08-01,wangranran
294,很是朴赞郁啊！反转再反转的对《指匠情挑》的重新改编让后半部分剧情变得不再那么松散。不过因为结局太过圆满，也多少削弱了原著的那种厚重感。,25977027,4,2016-07-30,wangranran
295,第一次看一部电影这么生气，里面的人能有一点法律常识么！职场性骚扰报警啊！大庭广众下药迷奸报警啊！……什么鬼！#可以打负分吗？！#,25843976,1,2016-07-28,wangranran
296,K出来和P说，当年的你至少应该尝试和我，结果你连尝试都没有尝试，这就是你错。P承认了错误，然后决定在R身上改正错误……所以，我们都是前人栽树，后人乘凉。所以，逃跑的人都是懦弱的，而懦弱是害人害己的。#早就发现导演爱话唠，导演还爱胡子男，鉴定完毕。#,26354587,4,2016-07-27,wangranran
297,关于贝科夫的毒舌，简直想给他记一个语录！难得一季拍了六十集还都收放自如，没有像《饭店迷情》那样人设崩坏。,5152622,5,2016-07-20,wangranran
298,好像没有结束唉……以及，谁来翻译一下嘛～～,26838016,4,2016-07-19,wangranran
299,战斗民族真的是什么都好用力啊，夸张用力，YY用力，渣得用力，爱得用力……打巴掌也特别用力！,25922893,3,2016-07-11,wangranran
300,最近迷上了俄罗斯剧。,24847992,4,2016-07-08,wangranran
301,中间一段还行，几句诗还不错：“为了寻找你，我搬去鸟的眼睛，经常盯着路边的风……”,26337866,3,2016-07-06,wangranran
302,,26775543,5,2016-07-05,wangranran
303,第一个泪点在有妇之夫问大竹忍要他怎样？她说：“我也不知道。”爱情就是反复推开，又被反复握住的手。,1292340,4,2016-07-04,wangranran
304,又挥别了一个老朋友……最后把我老泪都弄出来了……555555555,26282681,5,2016-07-04,wangranran
305,,2257759,3,2016-07-02,wangranran
306,伍迪老爷爷真是无敌了！,1433577,5,2016-07-02,wangranran
307,,1299292,5,2016-07-02,wangranran
308,哪有什么真爱，有的只是真的错过，真的遗憾，真的过往，真的无奈，真的放弃……真的所得。,1922152,4,2016-07-02,wangranran
309,三观是什么？三观不就是确立，然后再被打破的吗？！,23769147,5,2016-07-01,wangranran
310,大半夜的看这么甜的电影我也是找虐……,26340302,4,2016-07-01,wangranran
311,,1787291,5,2016-06-30,wangranran
312,虽然被续集剧透了，依旧觉得好看，可见是真的好看……而且，惨的是，看了这部，更觉得续集傻了……,6517421,4,2016-06-30,wangranran
313,惊艳的魔术场景太少了，太多的balabalabalabala……,25662337,3,2016-06-30,wangranran
314,又送走了一对，不管我就要任性的打五星！,26700818,5,2016-06-29,wangranran
315,这真是一个纯粹的人，一个脱离了低级趣味的人，一个完全自由的人，一个真真正正的观察者……,4836985,4,2016-06-26,wangranran
316,看完电影忍不住把三大贼王的故事看了……电影在戏剧和真实之间的把控真的不错啊！,26265170,4,2016-06-26,wangranran
317,生老病死也不过日常。,26356321,4,2016-06-20,wangranran
318,小鲜肉是美丽的。,26331185,3,2016-06-19,wangranran
319,,6128003,4,2016-06-18,wangranran
320,居然如此忠实于原著！法斯宾德太适合麦克白了，那张脸看上去就是悲剧感。,24523680,4,2016-06-18,wangranran
321,把个杰克苏拍得这么有情调只有伍迪•艾伦了～～,1981242,4,2016-06-17,wangranran
322,伍迪•艾伦的电影总是相对轻盈的，不强迫自己装深沉做大师。只是，如果能把两个女演员的角色换一下可能说服力更强，哪个男人在得到了红玫瑰之后，还会再去找白玫瑰呀～～,26340522,4,2016-06-17,wangranran
323,“我对月起誓！”“可是月亮阴晴圆缺其身不正！”……但是月亮也是有魔力的！,24470523,4,2016-06-17,wangranran
324,维斯康蒂的男主角都带着一丝阴柔的忧郁，而他的女主角都有一张凶悍的男人脸……,1293146,4,2016-06-16,wangranran
325,每次都以为结束了，每次都还没有。导演其实很会拍结局，但就是太会拍结局了，于是结局了若干次。,1292206,3,2016-06-16,wangranran
326,,3071604,4,2016-06-15,wangranran
327,看完之后心情久久难以平复。＃坂本龙一和他的音乐都太美＃,1303535,5,2016-06-14,wangranran
328,小时候只看到恐怖，长大了只觉得情色,1293124,4,2016-06-14,wangranran
329,果然扮演英俊军官的法利·格兰杰现实中爱的是男人，电影中他哪里爱女主角，从头至尾爱的都是自己。维斯康蒂是真的爱（当然也不是情爱）女主角的，但也摆脱不了对男主的迷恋，于是，只能借她的手杀了他。,1303572,4,2016-06-12,wangranran
330,每次都觉得政治真是太肮脏了，好在，才华可以超越一切。,25751312,4,2016-06-11,wangranran
331,三谷幸喜真是太会改编经典了。,1840265,5,2016-06-06,wangranran
332,,4307476,4,2016-06-06,wangranran
333,第一夜是侦探剧，第二夜是探讨人性。其实可以只看第一夜，也可以只看第二夜，故事都通，但如果把两夜连起来看又是另一种感受。而且看完第二夜再看第一夜也会感觉不同。,25962053,4,2016-06-04,wangranran
334,看小说就发现没有解释那块石头到底是谁扔的？（或者根本就真的是意外？）电影还是没有解释……,1302100,4,2016-06-04,wangranran
335,我是为西德尼•吕美特导演来看的这部电影，想看看曾经导演过《十二怒汉》的人，之后又导演了十二个人私刑《东方快车谋杀案》。,1293182,4,2016-06-04,wangranran
336,没想到在有生之年还能看到英格丽•褒曼和劳伦•毕考尔这两个亨弗莱•鲍嘉在银幕内外最爱的女人同台……只可惜，鲍嘉自己在有生之年也没能看到。,1292699,4,2016-06-02,wangranran
337,你们看的“X战警”拯救地球，我看的“一美”“法鲨”比美！,25786060,4,2016-06-01,wangranran
338,特别适合在儿童节看！因为，回不去啦，少年！,26344688,4,2016-06-01,wangranran
339,桃心皇后小可怜！,21441132,4,2016-05-26,wangranran
340,,26795100,5,2016-05-22,wangranran
341,,26581134,4,2016-05-16,wangranran
342,,26430092,4,2016-05-15,wangranran
343,有一种看上世纪八十九年代电影的感觉，让它在现在故事都讲不好的国产电影中脱颖而出。但故事冲突还是不够强，那个时代的影人到底还是老了，太过平和……#看前半部分我以为会拍成《霸王别姬》呢……#,10831445,4,2016-05-10,wangranran
344,前半部是一期《奇葩说》：“这个世界到底需不需要超级英雄？”后半部是“复仇者联盟”内讧——超级英雄结盟的结果就是：这个世界已经找不到他们的对手了，只能让他们自己人打自己人。,25820460,3,2016-05-05,wangranran
345,“我知，爱情是很伟大的。不过，只有女人才会这样认为的。”,1304244,4,2016-04-22,wangranran
346,里面的男男、男女……都没有CP感……这不怪演员，因为实在不懂有什么好在一起的。,11625312,2,2016-04-19,wangranran
347,作为一个胆小的人，被IMAX的动物们吓死了。,25777636,3,2016-04-12,wangranran
348,一边害怕一边看一边百度还要一边流眼泪……现实永远比文艺作品更加残酷。,26310143,5,2016-04-05,wangranran
349,强烈呼唤电影分级制度！因为这部电影值得推荐，然而血腥暴力又不适合小朋友观看……强烈呼唤电影分级制度！只为不能因此错过一部好电影！,25662327,4,2016-03-24,wangranran
350,,25831874,5,2016-03-22,wangranran
351,宁泽涛让人流口水，而艾迪这样的运动员是让人流泪水的……,3072064,4,2016-03-17,wangranran
352,,25723903,5,2016-03-16,wangranran
353,神和人的身高差好萌。,26662345,3,2016-03-04,wangranran
354,好乖的电影，看完心情好好，散场之后还久久不舍得离开~~~~,25662329,4,2016-03-01,wangranran
355,我只好安慰自己说，我看的是未剪辑好的版本。,26426708,2,2016-03-01,wangranran
356,,26701276,3,2016-02-24,wangranran
357,,21327512,2,2016-02-22,wangranran
358,我有时，会想要看书看电影看看这个世界；有时，我只想刷刷豆瓣。,26728787,4,2016-02-17,wangranran
359,,26726098,4,2016-02-14,wangranran
