,movie_comment,movie_id,movie_score,movie_time,user_id
594,老天使本来还使我觉得这是个廉价神话剧的（他又没有白素贞那么美），可最后结局还是让我又笑又哭想跳起来。整个电影都是悲喜交替进行，这种老式煽情励志片剂量还真猛，抗拒不能啊。,1293749,5,2012-05-14,xiaojia86
595,三星半。雷佳音要红。可是为嘛后半段会让我睡着呢。,6080775,4,2012-05-12,xiaojia86
596,老葛与老周，一对老基友。老葛半夜把屎拉到床上起床揪手纸擦屁股卫生间一边洗床单一边痛哭那段我也湿了。老演员好可张杨一如既往的廉价。三星半。,6872244,4,2012-05-08,xiaojia86
597,我要重新打一次星，说它难看或者是因为不够用心仔细，或者是因为自己被戳中后的恼羞成怒,5360890,4,2012-05-07,xiaojia86
598,只对这老头眨眼扭唇的笑容印象深刻,6786002,4,2012-05-06,xiaojia86
599,其中一个变性人朋友长得好像孟庭苇。。。,10574471,4,2012-04-23,xiaojia86
600,不是一个人看的哦，嘿嘿嘿,5450891,4,2012-04-22,xiaojia86
601,腻死肉麻死。讨厌卡梅隆迪亚茨，裘德洛应该配凯特才对。,1498831,3,2012-04-20,xiaojia86
602,这部电视剧我竟然看了。。。。整整一年！,4707205,4,2012-04-15,xiaojia86
603,味同嚼蜡,5422105,2,2012-04-13,xiaojia86
604,挺好看，挺美，汤唯演得挺好，你们都瞎了。可是汤唯怎么老演苦命孤女啊，能换个戏路么。,4136036,4,2012-04-02,xiaojia86
605,没啥，就是好看，从头到尾笑与泪惊喜与俗套的每一刻。,6386345,4,2012-04-02,xiaojia86
606,“肉体，只有直接的肉体”“我们对社会又没什么贡献”“什么是社会？我们就是社会！”好一部奇奇怪怪的青春片。。。,1305364,4,2012-03-31,xiaojia86
607,人生呀谁不惜青春。天真小儿女患难之中恩爱深。,1307708,4,2012-03-30,xiaojia86
608,音乐很好听，俨然又一部菊次郎夏天。哥哥最后说：和家庭相比，我选择了世界。弟弟最后问爸爸：世界是什么意思？,4832288,4,2012-03-28,xiaojia86
609,在火车上让我睡过去了好多次,3321409,2,2012-03-21,xiaojia86
610,本来准备好要来2012第一哭的，许鞍华太讨厌了，开箱子那段就排好了队的泪水就是找不到出场机会。于是只好打五星了，如果哭片就是四星。,5977835,5,2012-03-09,xiaojia86
611,对这类题材仍然无感,3217169,3,2012-03-08,xiaojia86
612,怎么老有种看国产片的感觉呢，摘掉头巾，这就是个咱老百姓自己的故事啊。可咱拍出过这种片子么？,5964718,5,2012-03-02,xiaojia86
613,“你认为这是个游戏吗？可我们都是真枪实弹。”“你其实是个小孩，所以你他妈的才会这么害怕。”这部片好适合这个各独裁政权纷纷倒台的时候看啊。,1900848,4,2012-03-01,xiaojia86
614,醉里挑灯看剑，梦回吹角连营。我们什么时候才能过上太平的日子啊？离开这无情无义的地方吧。,1292287,4,2012-02-28,xiaojia86
615,前半部很精彩，后半有点疲，大概是因为让杜雅尔丹开始阴着脸。他一笑，黑白片就能变彩色。好多桥段都很有创意，让电影成为魔术而不是高科技。,6097775,4,2012-02-27,xiaojia86
616,完全看不到火花的爱情片，特别是赵薇赵又廷这对，从头到尾都分处两个世界，到最后还在说“你这种人”“我这种人”。钮承泽向舒淇求婚失败后打嗝是最大笑点。,6730004,3,2012-02-21,xiaojia86
617,太平淡了吧，不明白为什么入围那么多项。克鲁尼这个绿帽老直男的角色不讨喜，特别是还问出“你和我老婆在我房间里做过吗”这种烂问题。作为夏威夷旅游宣传片还是不错的。,3071509,3,2012-02-18,xiaojia86
618,我已经成了李冰冰的脑残粉了，这么稀烂的剧情这么不讨好的角色这么锉的男搭档，也还是能让我坐到字幕出完。,6782006,3,2012-02-16,xiaojia86
619,本来只是要看惠休的，然后发现凯文大叔真是帅死了。可是最后，他挡子弹后怎么会没死呢，搞得名曲一点都不催泪。作为爱情片真一般，纯粹为帅大叔加一星。,1299362,4,2012-02-14,xiaojia86
620,两天的激情在电影里也会显得慢热。印象最深的对话是关于同志要不要结为伴侣，以及Russell把Glen当成父亲出柜。,6024430,4,2012-02-13,xiaojia86
621,,3068206,3,2012-02-12,xiaojia86
622,情节有些生硬也不妨碍这部电影的可爱，这里有最真实可感的香港。轩尼诗道原来有家三联书店，我错过了。汤唯很好。郑伊健和邵美琪一起客串很惊悚。,3777800,4,2012-02-11,xiaojia86
623,情节人物都太满了吧，有关吃屎的情节能拿掉或简化吗。黑白两方的表演完全是两个路子，刚感受到黑人女演员身上的深沉伤痕，马上就被白人女演员弄成了浮夸轻喜剧。不过这么一对比，就更爱两位黑人女主了。,3792848,4,2012-02-09,xiaojia86
624,极度考验耐心。能用一篇文学评论写出来的东西干嘛要拍出个电影来啊？,3210534,3,2012-02-07,xiaojia86
625,,6894068,2,2012-02-07,xiaojia86
626,拍摄冷酷到极致，演员献身到极致，用得着这样吗大哥？中间那段25分钟的二人对话能不能剪短点？,3070921,4,2012-02-02,xiaojia86
627,在家断断续续看的。梅姑的戏份原来这么少。霍夫曼年轻时还可以这么可爱。,1300685,4,2012-01-27,xiaojia86
628,前有模特后台露点，后有矿工洗澡露点，就这两个地方醒了一下。,2230890,2,2012-01-18,xiaojia86
629,半部好戏，学让子弹飞学烂尾了，后面一团糟，香港导演还是不要轻易尝试亲近内地文化,4913200,3,2012-01-16,xiaojia86
630,你真的很幼稚耶,4920528,4,2012-01-11,xiaojia86
631,故事表演都不可信,1366853,3,2012-01-10,xiaojia86
632,三星半。八十年代的故事，用了八十年代的拍法。平淡无泪点。,5155169,3,2011-12-31,xiaojia86
633,结尾的交友宣言和“He never give up”让电影亮了。。喜欢那些旁白加碎镜拼接，可是其他部分也有必要那么碎么。。,4109909,3,2011-12-26,xiaojia86
634,囧瑟夫从头到尾苍白着脸偶尔一丝苦笑，根本没想到要“抗”癌。这片要讲的不是面对病痛坚强乐观，而是人如何活在边缘，正如主角开的这档讲火山的电台节目，不管有没有人听，都要一直做下去。,3263820,5,2011-12-22,xiaojia86
635,你纷纷的情欲。意大利咏叹调，曲高难和。,3195101,3,2011-12-22,xiaojia86
636,肉体画面看得人不舒服，不管是残酷的强奸还是香艳的肉体展示及交欢，都要么过分要么多余。玉墨拿腔拿调的样子太西化，完全不像中国人。佟大为是个神枪手，每一颗子弹打倒一根电线，太好莱坞。除此以外的部分都很好。哭了三次。,3649049,4,2011-12-19,xiaojia86
637,国内似乎还没有这种电影，不讲人生和故事，只讲生活。淡定姐的生活态度很讨喜，好奇妹的外型直接就有强烈喜感，不过更值得琢磨的也许是一直在找行李的正子，失而复得的行李、采了又扔的蘑菇、莫名其妙收养的猫。。。,1892578,4,2011-12-16,xiaojia86
638,好疼！好心疼！心好疼！,4164444,5,2011-12-13,xiaojia86
639,香港的煽情片总是煽不哭我，这才对嘛。看点全在张艾嘉，可与《观音山》比较观看。,1298269,4,2011-12-12,xiaojia86
640,中学时看过一遍，完全不懂，现在再看也只能半懂，只觉得一直都湿漉漉的，很多暧昧然后很多隐喻，大陆香港台湾什么的。关锦鹏的片子都好爱用流行歌曲啊，而且同一首歌主角配角原唱歌手反复唱来唱去。。。,1307404,4,2011-12-10,xiaojia86
641,丧子疗伤留白碎片拼贴生活化等等等，和年初看的≪爱你长久≫太像了吧,3641108,4,2011-12-09,xiaojia86
642,方言表演都好陌生，看到差不多一半才能完全进入到那个情境，然后就越来越欢乐了。。。二丫、四川姑娘、还有那个黄米，这些女角都很戏剧化，和老光棍们的原生态出镜完全两种感觉。。。最后那句台词怎么说的来着，爱走东来不走西，爱透屁股不日逼,4946963,4,2011-12-08,xiaojia86
643,这大概是我所看过的最讨厌的女人戏，集中展示了女人的各种疯傻贱吵痴，女猪毫无可爱之处，还长得像我初中班主任，凭什么可以叼走那么可爱的男猪！！,3880545,2,2011-12-07,xiaojia86
644,成人版岁月神偷。爱情和政治捏合得太刻意了，处处都显出怪异来，特别是生硬没节奏的普通话台词。差甜蜜蜜差得不是一点点。为什么这类片都喜欢找演技糟烂的黎明来演呢是因为他能代表大陆吗？结尾应了他后来那首歌﹣﹣两个人的烟火,1303590,3,2011-11-25,xiaojia86
645,两星半。老派、僵硬、沉闷，除了少数几个场景外几乎找不到亮点。,2028669,2,2011-11-22,xiaojia86
646,除了惊叹风景之外就是一直哭一直哭，今年电影院里的眼泪都被这部包圆了。好不容易停止最后又被小川的信弄抽了：他们都说我不要命，不，我热爱生命，正因为如此才要走出去。。。我承认我缺乏冒险的勇气，可是我又很认同没有磨炼的生命不值得度过。这可怎么办啊！,5318669,5,2011-11-16,xiaojia86
647,三星半。这片成功在可以统收普通文艺以及二逼的青年，题材对普青，旁白对文青，对白对二青。可是就电影本身来说，就太过拼凑，一点不连贯，就只有一阵“香香的气味儿”。,4873490,4,2011-11-15,xiaojia86
648,特别选在星空影城看的。。。真的美到了，徐娇竟然一点都不讨厌。。。最后我还以为陈柏霖会出现在桂纶镁面前。。。应该是几米改编电影里面味道最正的一部吧虽然我没看过原绘本。。。,5993185,4,2011-11-05,xiaojia86
649,四星半。看过的最让人热血沸腾的造反场面，比辛亥革命什么的牛逼太多了吧。。。可是革命之后要怎样呢，感觉故事只讲了一半。。。是不是要再去看一遍十年前那部《人猿星球》？,3274505,5,2011-11-01,xiaojia86
650,第一段四星，第二段一星，第三段三星，第四段三星，平均分是。。。2.75颗星！,4906427,3,2011-10-28,xiaojia86
651,三星半。算好看，借时尚的壳反时尚，暴露了时尚圈的种种傻逼之处。仔仔如果能在结尾脱掉华服改成平民装扮，效果该会更好吧。不过有点不懂这类片为什么能拍这么多部，时尚界人士不是都不看国产片的么，看的都是我这种土鳖吧。目标群体有点错位。。。,6101834,4,2011-10-25,xiaojia86
652,虽然梦见过他，但还是第一次看完伍迪艾伦电影，难道那个梦实际上就是我穿越到了美国？。。。星光灿烂高潮不断，穿越戏就该这么拍，就是太文青范儿了，看完更觉得把海明威和菲茨杰拉德晾在屋里两年都不碰，是犯罪。。。怀旧只是在逃避现在的困境，最好的时光只是幻影,4319218,5,2011-10-24,xiaojia86
653,每个角色都毫无存在感。。。,6225992,2,2011-10-20,xiaojia86
654,火车上看的,1867345,4,2011-10-14,xiaojia86
655,为胡歌的林觉民和陈冲的隆裕太后加一星，特别是陈冲最后那声咆哮而出的“退位！”，顿时我就凌乱了。。。对不起我哭了，为那些热血的死去的年轻人。年轻人不该只是在网上骂骂咧咧啊。。。,4896305,4,2011-09-29,xiaojia86
656,一个痒痒挠接着一个痒痒挠，就是不见咯吱窝，人在哪儿呢？,6858722,3,2011-09-26,xiaojia86
657,四星半。。。第一次在电影中认识“苗族”，竟然是个美国片。。。在安静平缓的社区生活中，慢慢展开种族、暴力、宗教、战争、秩序、死亡等各种问题。。。以及，老牛仔真酷！有点像二手狮王里的罗伯特杜瓦尔。。。,3026357,4,2011-09-22,xiaojia86
658,终于还是看了，分三个晚上。我更关心谁没有演，两部都没参加的大牌，有梁朝伟、巩俐、黄秋生、徐静蕾、李冰冰…鼓掌！,4073898,2,2011-09-21,xiaojia86
659,看得人特心烦特没劲就对了。。。从头到尾都没看见卡拉和老二的亲热戏啊。。。,1308573,4,2011-09-18,xiaojia86
660,讲911灾难创伤综合症的主旋律片。。。同寝室的老同学也能有这样的深情款款相扶相助啊。。。没人觉得桑德勒这个造型巨像鲍勃迪伦年轻时么。。。相比起来我对钱德尔的表演更感兴趣。。。,1861935,4,2011-09-13,xiaojia86
661,11块钱的早场。。。各种天然呆以及又丑又萌的家伙。。。姜文的解说很空洞可一出来就提神。。。,3443389,4,2011-09-07,xiaojia86
662,三星半。风景与基情，想去意大利。其实我对黄磊范伟姚晨的配音更感兴趣。,3036478,3,2011-09-04,xiaojia86
663,很久都没看过这么烂的片了。其实我只是为了看放牛班里的莫杭治长大后什么样。现在的他依旧美型，可惜基情对象是屎一样的邓超。,5366708,1,2011-08-30,xiaojia86
664,真成！,5948622,4,2011-08-25,xiaojia86
665,3D效果终于靠谱了一次，赏心悦目。。。最可爱的竟然是喜欢从雾气中现身的格格巫。。。结尾好多惊喜，能别那么着急走么。。。既然想找童年回忆，干嘛不看中文配音版的呢哎哟。。。,2159331,4,2011-08-14,xiaojia86
666,看过的gay movie里面最温暖的一部，即便是旁人的歧视也都来得那么俏皮，或者足以释然。也许最应该解决的问题并非歧视，而是自我的虚弱。如果一个孩子都能把你吓个半死，如果你自己都抗拒这样的生活，那就实在不关外界什么事。沟通很重要，学会与自己的伤疤相处也很重要。,3243344,5,2011-08-12,xiaojia86
667,三星半 结尾有点意思。什么都过去了，什么都没有发生。,1301098,3,2011-08-10,xiaojia86
668,少见哈，必须要看到字幕出完，黑屏还不能罢休。。。要孩子们学会反抗老大，是不是必须先得成为他们的老大？,1308620,4,2011-08-07,xiaojia86
669,很好，不过有漏洞：小明的爸爸是教育局长，班主任怎么可能到最后才知道？应该让小明一开始就当大队长才合理呀。,6759556,4,2011-08-05,xiaojia86
670,好想住进这个精神病院啊，真是太治愈了！今年看的最开心的电影，是真的开心，而不是苦笑。酷克雷格，我爱你的微笑。我不再想自杀了。,3269018,5,2011-08-04,xiaojia86
671,为什么我们只能隔岸观火？这么国家、这个民族，还有什么希望啊？国难当前，我们要勇敢。。。,1305803,3,2011-07-27,xiaojia86
672,老年阿彦演得真好，好怕老了以后成为这样的人啊。。。第二段最该表扬，老给老拉这种题材的本来就少见。一三段小清新也不错。,2375763,4,2011-07-25,xiaojia86
673,舞台剧化国际杂碎风混搭本土超现实黑色幽默、两场追逐戏大赞、KTV怀念战友泪崩、被遗弃的劳动者为自己唱的一曲欢乐挽歌。。。把破落工厂拍得这么美，真有你的。。。,4876722,5,2011-07-16,xiaojia86
674,三星半，再加半颗作为鼓励。技术上还是不到位，可是意识上甚至比好莱坞还要高级。台词好，有些地方很贴国情，比如抢钱募捐。结尾爸爸后悔给儿子灌输好战理念，可为何还是毅然踏上征途？,4812830,4,2011-07-11,xiaojia86
675,不知道是在讲什么，纯粹看颜看风景,4942776,3,2011-07-06,xiaojia86
676,剧本台词各种怪，李冰冰还是很舒服的。,4135434,3,2011-06-28,xiaojia86
677,三星半,4202302,3,2011-06-24,xiaojia86
678,比盗梦空间好看。单纯精致的小科幻。杰克最后扮成自己的朋友给父亲打电话那段，很动人。即便我已经死了，在另一个世界，我还是会好好的。,3075287,4,2011-06-17,xiaojia86
679,到底要讲什么啊，什么都有，就为了对得起人生二字么。,3718460,3,2011-06-16,xiaojia86
680,水泥地里萌出来，不自然。。断断续续看了一个礼拜才看完。。,5960606,3,2011-06-15,xiaojia86
681,三星半。。好古典的爱情片啊，仿罗马假日什么的吧。。片尾两人个性互换了有没有。。,3036464,3,2011-06-07,xiaojia86
682,"三星半.不萌装萌,不过画面确实很好.",3233635,3,2011-05-30,xiaojia86
683,老夫妇的庄园在一年里先后招待了同事、老友、儿子的女友、哥哥。可时而聒噪时而阴郁嘴角时时抽动的超级玛丽才是主角啊。表面和谐的生活下悲情暗流涌动。最后一幕就是在诠释什么叫“他人的生活”。,3718782,4,2011-05-25,xiaojia86
684,四星半。。。带我走。。。可是爱总是会消逝的吧。。。,1293929,5,2011-05-23,xiaojia86
685,放空，出现漂亮画面才会转回来,4286017,3,2011-05-20,xiaojia86
686,舒淇亮了。。。前三分之二很好，后三分之一是搞哪样啊。。。,4728584,4,2011-05-19,xiaojia86
687,美。。。鲍勃迪伦：“我一生都在逃离，逃离自己，每个人都是。”,3336237,4,2011-05-17,xiaojia86
688,真有够无聊,3652302,2,2011-05-17,xiaojia86
689,比《最爱》更动人。三位感染者都很立体，老夏的敏感消沉，刘丽萍的豁达温情，泽涛的几次哭还说要让歧视自己的人都感染。。。最后那位八十岁的老奶奶对街头索取拥抱的艾滋病人说：坚强一点，好好活下去。。。主题歌由彭丽媛演唱。。。,5382879,5,2011-05-11,xiaojia86
690,看的时候很虚弱。。。爱情渲染和社会观察有点顾此失彼两头都不够。。。如果再多一点欢乐高亢（类似骑猪），能和悲苦压抑平衡一下，就太好了。。。,4843637,4,2011-05-10,xiaojia86
691,最起码的态度都扔了,5954347,2,2011-05-07,xiaojia86
692,得补课,4821046,2,2011-04-26,xiaojia86
693,真无聊。。完全找不到亮点。。,3711760,2,2011-04-21,xiaojia86
694,因为王菲的推荐，终于看了完整版。。。小孩的世界没那么简单，大人的世界没这么复杂。。。还有，武汉。。。,1761172,5,2011-04-21,xiaojia86
695,最好的形象宣传片。。。喜欢母鹦鹉，连反面的猴子团都那么萌。。。主题就是：猛女救宅男。。。这么美的电影，却被3D给糟蹋了,3731581,4,2011-04-12,xiaojia86
696,除了演员，其他都不行,5294324,3,2011-04-12,xiaojia86
697,只见楼和车以及各种花招，不见爱情。。。太快了，真的太快了。。。古天乐你有必要这么坦白吗。。。高圆圆还是不行啊，演得一点说服力都没有。。。身在水泥森林，单身就是宿命,4724739,3,2011-03-31,xiaojia86
698,全程放空,3041264,1,2011-03-28,xiaojia86
699,我都忘了北京奥运会中国金牌是第几了。。体育有那么大作用么。。最后这场球足足打了半个小时啊。。不过开场那个加油的飞机还不错,2136824,4,2011-03-25,xiaojia86
700,酷老头，乖男孩，混球妈妈。。。北非那段很童话，可有些事情真假不重要，人们相信它们，是因为它们值得相信。,1308191,4,2011-03-23,xiaojia86
701,三星半。。。酷烈的拳击运动与温软的家庭关系结合起来。。。干嘛要把自己的梦想寄托在亲人身上，他最后找到自己了吗？,2056093,3,2011-03-18,xiaojia86
702,媒体反思：为什么好事不显眼，坏事却要大肆渲染。。。我想要个倒走的钟。。。中岛哲也又一花样，冷酷到底。。。,4268598,4,2011-03-12,xiaojia86
703,金世佳与陆展博,3926132,4,2011-03-10,xiaojia86
704,李玉阵势最大的一部，却也是最文艺的一部。。。文艺腔减分，剪掉太多内容减分。。。表演加分，音乐加分，山水风景的空镜尤其加分。。。台词一如既往地到位。。。我十分想看完整版。。。,4059245,5,2011-03-04,xiaojia86
705,平铺直叙，暴力叠加,4723096,3,2011-03-01,xiaojia86
706,我也跟着他不停地吞涎。。。,4023638,4,2011-02-25,xiaojia86
707,三星半 珍妮弗·加纳不错，以及艾什顿·库彻，还有安妮·海瑟薇的男伴，叫什么来着。。。,2368641,4,2011-02-18,xiaojia86
708,第一段一星，第二段三星，第三段两星，过渡访谈四星。,4896263,3,2011-02-15,xiaojia86
709,注意力都集中到演员上了，生活化的风格让我竟然忽视了关于年纪的感慨,1310174,4,2011-02-13,xiaojia86
710,没笑点，喜剧变悲剧。。。,3420455,2,2011-02-09,xiaojia86
711,就一普通古装搞笑片啊。。除了亲切点，和刘镇伟朱延平也没什么太大区别。。,4822848,3,2011-01-27,xiaojia86
712,这个简单的故事似乎有很多解读点。。。罪与罚、时间、家庭、还有李冰冰带来的温暖。。。李冰冰那时就很灵啊。。。,1303509,4,2011-01-25,xiaojia86
713,无语凝噎,2266113,4,2011-01-24,xiaojia86
714,原以为是悲情戏，没想到是励志片。。。这样的励志片才好看嘛。。。,1292950,4,2011-01-17,xiaojia86
715,没有纵横四海好看。。。枪和血也太多了点，晕得慌。。。对友情主题的刻画很工整。。。,1296519,4,2011-01-16,xiaojia86
716,含蓄留白的部分很多。。。没必要把悬念一直留到结尾吧，有点破坏情感的表达。。。关于不幸后的重生，关于爱与冷漠对人的影响。。。,2216966,4,2011-01-12,xiaojia86
717,好看。。。不过，格鲁拿月亮换孩子是不是也太爽快了点？他冷漠的老妈怎么会突然给孩子读故事？看孩子的演出有那么重要么？主题先行，还很陈旧。。。开头长城和坦克，后来的朝鲜科学家，我都想到了，不过把小黄人想成中国人，这玩笑可就开大了。。。,3287562,4,2011-01-06,xiaojia86
718,君如阿姨心忐忑，慧敏阿姨织毛衣，两个捐精男子，买卖不到爱情。。。兼具情感性和社会性，几乎所有的性别议题都涉及到了。。。有威猛的子弹，又有温暖的炒饭，今年华语片的收成还不差。。。,4145476,4,2010-12-31,xiaojia86
719,无感。。。噼里啪啦的。。。,3205624,3,2010-12-31,xiaojia86
720,有才华的人，就该什么都不怕。。。当十岁的他说出一串耸人听闻的话，他爸在一边又是惊讶又是微笑。。。而当十七岁的他说爸爸没有人性，他爸又该是副什么表情？,3394878,4,2010-12-28,xiaojia86
721,先来一个小品，再来一段旅游宣传片，接着又是个小品，之后是个话剧，孙红雷给王朔代言发表一段评书，中间加一段诗朗诵，最后是歌曲《最好不相见》。。。如果光保留孙红雷那部分，把葛优舒淇全给剪掉，应该还行。两位主角从头到尾打酱油，这还是头一回见到。,4271894,2,2010-12-23,xiaojia86
722,笑死、美呆、爽翻。 给力这个词就是为姜文量身打造的。,3742360,5,2010-12-16,xiaojia86
723,我想有个家+我爱我家。。。不管你的家庭是平静是汹涌，破碎或完整，是不是都会让你时不时想要挣脱？不管你是弯是直，爱自由或被剩，年轻叛逆还是中年危机，是不是最终还是想回归家庭？。。。故事表面很淡，却越看越妙。。。演员都好，不过安妮特贝宁似乎比朱利安摩尔更胜一筹,3569969,4,2010-12-15,xiaojia86
724,有些事不需要一晚上便要做完的，我们又不赶时间。。。最后一句“不是不想，而是不行”，至少为这部片加了半星啊。。。从没看过这么生活化的爱情片，与生活平起平坐，没有半点拔高，竟然也不猥琐，还挺美。。。,4305436,4,2010-12-14,xiaojia86
725,自闭症竟然是一直不停说话的，而且随便一讲都是格言警句。。。要让牛平静，要表现出对牛的尊重，对人当然更是如此。。。门是危险不确定的事物，但越过去，就是另一个世界。。。曾经的后现代朱丽叶变成这个样子，太神奇了,3236904,4,2010-12-13,xiaojia86
726,这算完美吗？小镇美景、帅正太、酷萝莉、家庭温情、成长点滴。。。双线结构，视角切换，细节丰富，过程明晰。。。爱就该是这样悠悠扬扬、婉婉转转、一阵冷、一阵热、一阵抽风、一阵颤抖的过程。。。睿智外公和脑残叔叔是惊喜。。。爱到最后拼的果然还是人格魅力啊。,3319755,5,2010-12-10,xiaojia86
727,从头软到尾 不知道故事是怎么成立的 画面糙 不严肃,3546019,3,2010-12-07,xiaojia86
728,前面还行，完全是岁月神偷的调调，后面打起架就成下三滥了。。。摄影一直很漂亮。。。李小龙竟然也不会骑自行车？ ,4915135,3,2010-12-02,xiaojia86
729,不造作的文艺腔 “哭爸原来是这么累得一件事情哦”，兄妹二人相视而笑。直到几个月后，才终于深深地哭出来。,4307349,4,2010-11-20,xiaojia86
730,没那么好也没那么差  挠到多数人的痒处 煽风点火，不红也难 可是一说梦想，干嘛老不是唱歌就是跳舞啊,5344178,3,2010-11-18,xiaojia86
731,走出来，才有希望  前现代和后现代夹击现代  老gay潘绥铭、坦然的秦士德老爷子，还有那位爱笑的拉拉，以及法律专家叫郭小飞对吧，都好可爱啊,3619027,4,2010-11-12,xiaojia86
732,看得好累 索性放空,4082544,2,2010-11-04,xiaojia86
733,陈冲威武，姚晨大银幕上没法看，刘烨一贯的憨傻。摄影音乐赞，情节白瞎。就是那种看片时觉得满足，但看完就忘的电影。不过还是有点开创性的。,4711195,3,2010-11-03,xiaojia86
734,真白瞎这堆演员了。。。张一白是怎么忽悠到那些女明星的。。。,3011906,3,2010-10-30,xiaojia86
735,,4271832,3,2010-10-26,xiaojia86
736,什么乱七八糟的,4312232,2,2010-10-24,xiaojia86
