,movie_comment,movie_id,movie_score,movie_time,user_id
368,好看！直白！没有爱呀爱的泪汪汪的煽情戏！一个丢了多次的马特再次被丢在了火星上，却机智而搞笑地活了下去！更没想到关键时刻还是靠咱中国宇航局才能把人给救回来，哈哈哈为祖国崛起感动！同是太空求生，我觉得比《地心引力》好太多了。以及谁再给我演宇航服喘不过来气的片段我就再也不看太空片了！,25864085,5,2015-10-05,yancm
369,有人说死循环总是令人着迷，确实如此。,5155222,5,2015-10-04,yancm
370,明明一点都不好看 而且到了第二季就被砍了 为什么爱情公寓还把这部片从头抄到尾 深深的困惑,10774787,3,2015-10-04,yancm
371,Dwight也太搞笑了吧！好可爱啊Holly真可爱,2171019,4,2015-10-03,yancm
372,伍迪艾伦的片子太有自己的风格，然而并不是我喜爱的。镜头切换和剪辑风格让我不太舒服，特别是多余的旁白，似乎走复古的风格但只让我感到迷惑。唯一的惊喜是看到了斯嘉丽亲吻女人。这部和《天使的性》可以并列为毁三观之大作了，谁看谁知道。,1981242,3,2015-10-02,yancm
373,完全不好看，韩国影视方面的优势明明这么明显，但除了《道熙啊》（裴斗娜快推倒我）以外根本没有拿的出手的女同片。而且这部片子把基佬都刻画成娘炮或者异装癖，编剧也是够不走心的。,6965615,3,2015-10-02,yancm
374,并不怎么好的片子，硬件软件都不高。但是无论是魔王还是Sally Hawkins都是我超爱的演员，Sally英国人硬改成美国音有点奇怪，凯特浑身都是戏，美得不像话。在看《卡罗尔》前先让我和魔王培养一下感情：）,10576419,4,2015-10-01,yancm
375,刘若英当年也是豁出去了,2244363,,2015-10-01,yancm
376,卧槽这么好看！！！你们好意思么！！！,2245679,4,2015-09-30,yancm
377,,1310179,5,2015-09-30,yancm
378,我奇葩地最喜欢Dwight！萌这对禁欲CP。 为啥好白菜都让猪给拱了！！混蛋Michael能不能放开Jan！让我来！,2163588,4,2015-09-30,yancm
379,哈哈~大家一起minecraft吧！~,4751270,,2015-09-29,yancm
380,【167】这部电影无论从商业性还是内涵上，基本都是无懈可击的。干脆利索的起承转折非常抓人，而在内涵上又一步步带着我们看到人性及政治丑恶的深渊。看了心情很沉重。 韩国自从推出电影分级制度来，用十几年的时间把成人电影发展到了这样的水平，我们真是望尘莫及。,21360417,5,2015-09-28,yancm
381,还算不错呢,1946066,,2015-09-28,yancm
382,刘慈欣在水木社区留言，说如果《三体》能拍成这样，死也瞑目了。影片很简单，却及其精致，创意极好，用一个映射的对比方式让人看到科技发展的差距带来的巨大无力感。再回想起三体文明也不过是宇宙中的较为中等文明，就更对茫茫宇宙的可能性充满了畏惧。,26613444,5,2015-09-28,yancm
383,稍微好起来了，莫名奇妙萌Angela和Dwight这一对奇葩。,2159568,4,2015-09-28,yancm
384,第一次大屏幕上看基片，影院里四散着抽泣的声音，坐在我旁边的大男孩也在抹眼泪。觉得男性能有这样长久的爱，难以想象。死亡真是最可怕的分离，现实世界永远只能生可以死，却死而不复生。,26013293,4,2015-09-28,yancm
385,大部分歌都是高中时候很爱听的，惹人怀想啊～,6957293,,2015-09-28,yancm
386,女主角简直美的不像话，又性感又温柔，连嫉妒的报复都显得甜蜜。这种电影应该是最容易掰弯女生的了，充分展现了女人之间爱情及性爱的细腻与温柔。虽然结局不太好，但我依然全程保持微笑（淫笑），以及被B站的弹幕逗坏了，哈哈。,3731598,4,2015-09-27,yancm
387,【168】画质太不清晰，在严重的脸盲和灰暗的画面中半蒙半猜地看了四个小时。这片子的沉闷还是超出了我的忍受能力。但是有几幕非常喜欢，张震和爸爸两次推车回去，Honey带着温柔地笑盘腿在夜晚中缓缓讲话……喜欢杨昌德电影中平淡而亲密的对话。在那个年代，他在录音和音轨剪辑上真是下了功夫。,1292329,,2015-09-26,yancm
388,一种慢悠悠的小小情愫的诞生。名字Lost in translation，翻了字典，特指在翻译过程中会失去的一些味道，很有意思。斯嘉丽的长相是欧美面孔里我最喜欢的，太美，还有一种克制的性感，每次看到都忍着不那啥。老李也喜欢斯嘉丽，她说如果我哪天出轨了，如果对象是斯嘉丽，那她可以原谅我，其他人都不行。,1291835,4,2015-09-26,yancm
389,这应该是我人生看的第一部“3D”电影吧 简直滑稽,1308585,,2015-09-24,yancm
390,为很多剧提到的电影，终于补了。挺好笑的。,1295278,3,2015-09-24,yancm
391,【169】明明标注过，不知为啥豆瓣又抽了。这是一个一般故事的高级讲法。,1304447,5,2015-09-24,yancm
392,为了抚平《废柴联盟》完结对我造成的伤害，我精心挑选了这部剧作为接棒。第一季果然如传闻中一样烂，但我十分期待后续的发展与突破。以及剧中的老板真的太欠抽了，遇到他真的太倒霉了。,10529476,3,2015-09-23,yancm
393,我的天呐，怎么能这么难看，从始至终都靠Mama T的颜值撑着。看了两部这位导演的作品了，果然不是个好导演。 2011-4-5~2015-9-20,1307136,2,2015-09-20,yancm
394,终于看了，还不错吧。汤唯和姚晨很有意思。但是并不喜欢胡巴，他太像人类幼虫了....,25723907,,2015-09-19,yancm
395,【170】 结尾哭的不行了，这学校简直太像我的初中！然而煽情的感动背后还有思考，追求艺术的姿态是内心理想还是一种对体制反叛的迷恋？在不合适的时间地点描绘了自由的画面，是激发还是一场谋杀？也许没有这样的刺激Neil还能在体制内好好活着，在未来找到机会追求自由。O captain my captain,1291548,4,2015-09-19,yancm
396,嘛……遥远地记得 初中的时候有个男生很喜欢这,2156945,,2015-09-15,yancm
397,第一次真正意义上追完一部美剧，陪伴了我整个大学。看到结尾已泪奔，这是史上最牛逼的剧没有之一，因其另类让它几经波折，却终于挺完了这六年。看到有人说，能生在有这样的剧的时代好幸福。是啊，一个怎样丰富的年代才能有这样纯风格化的电视剧呢？不想推荐给任何人，永远的私人珍藏。,25918302,5,2015-09-15,yancm
398,日本的家庭片总是很有味道。最近看的几部日本电影里都有香川照之，感觉他已经是质量的保障了，只要他出现，基本就不会失望。最近很喜欢这种慢悠悠的有点闷的片子，大概是心境变了吧，虽然也说不清为何...,2032143,4,2015-09-13,yancm
399,,3543690,,2015-09-12,yancm
400,,1461964,,2015-09-12,yancm
401,并不好看的片子,3130180,,2015-09-12,yancm
402,第一次觉得汤唯好美，王佳芝放走他的神情，革命者在死亡前的痛哭，让我深深地受到了震撼。好喜欢李安，喜宴，饮食男女，断背山....永远让我感动，让我发自心底一叹。,1828115,5,2015-09-11,yancm
403,,4892642,,2015-09-11,yancm
404,这个寓意很深啊 有点悲哀,4930406,4,2015-09-10,yancm
405,,4316668,,2015-09-10,yancm
406,【171】精彩绝伦！对宗教的打击充满力度！真是令人回味无穷,2300586,5,2015-09-09,yancm
407,终于把这部经典补了，觉得很好看，老妈演技抢镜，弹吉他酷炫。中国人无处不在，充满了神秘的魔力，哈哈。,1307955,4,2015-09-09,yancm
408,因为被剧透了 太影响观影体验了,1292223,4,2015-09-08,yancm
409,没有热辣的吻戏，差评。最出彩的就是那两个日料店的伙计了吧...,1902081,2,2015-09-08,yancm
410,太血腥了吧，看了有点难过,25884822,5,2015-09-08,yancm
411,七十年代法国根据老电影《唐手跆拳道》的画面，重新配音+做字幕，变成了一个截然不同的讲述阶级斗争的夸张故事。有点恶搞的性质在里面，有点像现如今粉丝配音的前身....,2286311,,2015-09-07,yancm
412,从盗版摊上淘了碟看的。真是怀念那段违法的日子。,1316572,4,2015-09-07,yancm
413,挺好笑的 哈哈,4237879,,2015-09-07,yancm
414,虽然反转了好几次，也没觉得有吹的那么牛。用形象的方式表达了比较高深的暗网状况，这个很亮。最近总是意外地看德国片呢,25932086,4,2015-09-06,yancm
415,好看啊 老喜欢这版了,1718150,4,2015-09-05,yancm
416,老友记衍生剧，能看到几个未来能独挑喜剧大梁的演员崭露苗头。还算可以，不好不坏。,1394180,3,2015-09-05,yancm
417,哎呀妈呀太热辣了，被女主高傲又深情的御姐脸迷倒。大晚上的刷了一部女同片，即幸福又寂寞啊= =......,25814628,3,2015-09-04,yancm
418,电影刚出的时候看了一遍，今天重新看了一遍就像完全没看过一样...根本没猜出结局== 人的记忆果然撑不过十年，现在看的书和电影三十多后还能记得多少？糟心。,1389986,,2015-09-04,yancm
419,唉呀妈呀老好看了 看了三四部呢,1997612,,2015-09-03,yancm
420,人生唯一一次看完一部一百多集韩剧的体验,2360714,,2015-09-03,yancm
421,我去 这部真的太好看了,2158699,4,2015-09-03,yancm
422,唉呀妈呀吓死个人,25972855,,2015-09-02,yancm
423,,1907464,4,2015-09-02,yancm
424,校园的阶级真可怕，真实残酷无法动摇，这么多年了，却一直没有消失。,1295728,4,2015-09-02,yancm
425,啊哈哈哈哈,2271621,,2015-09-01,yancm
426,,1300883,4,2015-09-01,yancm
427,,1422952,,2015-09-01,yancm
428,感觉日本这两年的校园片，没有哪部比这部更有味道了。漂亮的取景和构图，无比真实的校园阶级的刻画，营造的氛围久久不散，让人遥想起曾经的校园生活。看完也想像里面的前田一样，扛着8mm的胶片机去拍电影，只为和自己喜爱的老电影能有一点点的联系。所有天台上的戏份都好棒，为什么我们没有天台？,7152895,5,2015-09-01,yancm
429,学剪辑ing,10784892,,2015-08-29,yancm
430,学剪辑ing，演penny的演员现实中就这个样子么？还是为了搞笑一点所以采访的时候说这些话？,10600859,,2015-08-29,yancm
431,中国这样的小品式动画应该多些,1529187,4,2015-08-28,yancm
432,这部经典的纪录片记录了一个男的只吃麦当劳，吃一个月，结果各项指标全部异常身体快速衰竭的事儿。然而，美国有一个老师也做了同样的实验，每天只吃麦当劳，但严格按照成分表只摄入2000卡的热量，吃了三个月竟然更瘦更健康了。所以，真的不能片面地相信一个事实。大概没有垃圾食品，只有垃圾吃法吧。,1309128,3,2015-08-28,yancm
433,很好纪录片，展示了一个非常极端的反同反美的宗教团体。Louis是个好优秀的记者，即让我们充分了解这个团体，又表达出了大众的心声。之前看《无耻之徒》中军人的葬礼，有一堆人在外面举牌子咒他们活该下地狱之类，还不相信真有这样的群体存在。原来……当小姑娘笑着说“对，你会下地狱”时，头皮发麻。,4705725,4,2015-08-28,yancm
434,在那资源匮乏的年代，我还买盘看过这种片子呢。,1997681,,2015-08-28,yancm
435,,1441802,4,2015-08-27,yancm
436,被深深的震惊了，原来糖是一个这么恐怖的敌人。零食企业将所有的罪过都推到卡路里身上，却忽略的了糖分的危害。看到imdb上的评价是“This is THE one film to see before you die”. 笑，这种纪录片还有休叔的出演和Gaga的一闪而过：D 最近一直萌发着未来想去拍纪录片的心,26356457,4,2015-08-26,yancm
437,终于追完了。看完忍不住想骂编剧一句傻逼。这么好的剧，整整九季的优秀，在最后20分钟狠狠地扇了我们观众一个大耳光。整整九季的欢笑与阳光与浪漫，在最后一刻被证明不过是一场笑话。编剧绝对在报复社会，应该强制接受心理治疗。,20470240,2,2015-08-25,yancm
438,啊 情色片 镜头却都很美,1308451,,2015-08-23,yancm
439,老妈终于出场了吗，Ted别再念念不忘滚去结婚吧。气die，想到已被剧透的结局更加生气，说什么我爱你至死不渝，狗屁。,10563743,4,2015-08-23,yancm
440,一个评论更让人感动：“母亲是自由的，而女儿却要走过那么多路，才能感受到自由”。看故事有个跑偏的小体会，在荒野中有时候有人比没人更恐怖。 2015.8.21 cinafest电影节。,21345845,4,2015-08-21,yancm
441,可爱,1889907,4,2015-08-21,yancm
442,虽然没看懂，但我可能需要做一下剪辑的功课了,1963596,,2015-08-21,yancm
443,又是老师放的，本周的主题是娈童。在部分同学大呼变态的情况下，我依然觉得是部好片，漂亮的镜头，漂亮的叙事，漂亮的配乐，有些黑暗气息的浪漫环绕，以及无比沉重的主题。不管是选择遗忘，还是选择牢记，都永远走不出过去的囚笼。,1309210,4,2015-08-17,yancm
444,,6794391,,2015-08-15,yancm
445,很喜欢结尾的诗意，配乐恰到好处。只是一直没有多喜欢娄烨的风格，摇晃的镜头，灰暗的颜色让片子显得很沉重而晦涩。很遗憾王大夫最后的发飙和动情没有改进来。梅婷真的很美。,20020577,4,2015-08-15,yancm
446,彻底沉迷，在各种压力下活着的每一天里，一边磨磨蹭蹭吃饭一边看这部剧已经成为我每日最期待最快乐的时光了。好想老李啊。,5262275,5,2015-08-14,yancm
447,演Ted的演员气质好差，所以不管怎样都喜欢不起来。第100集变成了半个音乐剧，好喜欢，几位百老汇出身的演员能唱能跳。本剧和《废柴联盟》的编剧都好牛逼啊，总有意想不到的结构，充满惊喜。,3990479,5,2015-08-10,yancm
448,上审查课老师放的，看完不想吃饭了。大量的详细的色情描写和结尾血腥的画面，让电影首先弥漫着一股催吐的氛围。女主沉闷的，矫情的，没完没了的，车轱辘话来回转的独白又让本片弥漫着一股令人犯困的氛围。感恩，感恩本片在大部分地区被禁止上映，拯救世界人民于水火之中。,1299698,2,2015-08-10,yancm
449,本季第13集可能是我的整个看美剧史上哭的最热烈的一次，简直感动到天崩地裂。从此估计每听到一次《友谊地久天长》都会感动吧。上一次差不多的感动还是看《摩登家庭》母亲节（S2E21）那一集....说不下去了，我要跑去哭泣了Q.Q,3222657,5,2015-08-09,yancm
450,布兰妮竟然客串了好几集！可爱。有几集编剧简直神了，故事写的太精彩！后来听说都被某国产片照抄了过去。,2326226,5,2015-08-05,yancm
451,我觉得很一般...为了听配音才看的...,26328492,3,2015-08-05,yancm
452,比第一季好看！有笑到不行的地方，也有感动哭的地方。Marshell和Lily这对组合总让我想到老李，“已经粘在一起十年，却还是不能忍受一晚的分离” T.T,2296025,5,2015-08-03,yancm
453,当年的良心剧啊，好看！现在几乎没有好的职场剧,2333777,4,2015-08-02,yancm
454,开始继续看前些年荒废的寻妈记，Robin真美，就因为Robin，一直无法讨厌Agent Hill。一直不太喜欢Ted，也许是演员选的不好吧....,1427818,4,2015-07-31,yancm
455,,1291579,3,2015-07-28,yancm
456,除了震惊于女主在1933年就能美到崩溃潮到爆以外，没什么别的感触了。内涵空洞，转折苍白，也许在当年只是养眼大片吧。,1304744,3,2015-07-27,yancm
457,炸拖车处的那段故事最喜欢，牛逼！,24750126,4,2015-07-26,yancm
458,至此，影视宇宙第二阶段终结。文件箱内的打斗充满了科幻的诗意与幽默，结尾时坠落到极致的微观世界，令人恐惧又觉得浪漫。世界第三大荧屏的视觉效果震撼到无与伦比。主角是《老友记》中的Mike，亲切。,1866473,5,2015-07-26,yancm
459,虽然那么不现实，但偶尔做个百日梦，也觉得好开心啊。,1815638,4,2015-07-25,yancm
460,人设看着很丑，本来不愿意看，但是看的哭崩了。现实和想象交织，温馨又忧伤。另外，结尾的彩蛋让我们终于明白了猫这种神秘的生物，笑。,10533913,5,2015-07-24,yancm
461,我觉得很好看。很感动，很真实的青春，惹人怀想，令人伤感。陈妍希饰演的沈佳宜真美，何必去演姑姑,4920528,4,2015-07-23,yancm
462,看完了十季，非常感动。,3286552,5,2015-07-22,yancm
463,狗屁不通。海报上的米拉喷薄着一股gay气,5154799,2,2015-07-21,yancm
464,,1299643,4,2015-07-21,yancm
465,帅。失败者的失败如此动人。,25761178,5,2015-07-15,yancm
466,闷,4109909,3,2015-07-15,yancm
467,被大圣帅哭了！真的好精彩好好看，一点都不拖泥带水，国内有这么好的动画片真的让人很感动，实现了小时候的梦想一般。也许这不是一不完美的电影，但从剧情、人设、特效、镜头各方面来综合评价，我可以理直气壮地说，打一星得瑟的都是【哔——】，真的。,26277313,5,2015-07-11,yancm
468,,25746375,3,2015-07-08,yancm
469,很好看，非常喜欢。张震、范伟、王宝强的表演都很好，动作戏都打的充满诗意。演戏子的张震神情间都是戏子的痕迹，好用功，加上演员本身的文化气质，是挺迷人的。如果我能做演员，我也想做张震一样的演员。不太懂为什么大家能打出一星两星这种低分，可能大家都喜欢看《后会无期》或《有一个地方》这种片,24879839,4,2015-07-05,yancm
470,,1877596,,2015-07-02,yancm
471,明星很多 ,25908042,2,2015-06-28,yancm
472,在旅馆的人电视里随意看的,10831449,3,2015-06-23,yancm
473,星爵太帅，哥哥长得太像Justin Bieber。水下的恐龙最恐怖。在仙林的最后一场电影吧，UL影城，我都要走了你他妈才开。,10440138,4,2015-06-22,yancm
474,有的地方蛮逗的,19976810,4,2015-06-13,yancm
475,其实挺平淡而絮叨的，但是好温馨感动啊，对这样温馨的电影没有抵抗力。,26036657,4,2015-06-07,yancm
476,结尾还是很感人的，但整部电影都好吵好聒噪，而且镜头有时候摇的让人头晕,3094909,3,2015-06-04,yancm
477,又赚了我一筐眼泪,3286547,5,2015-06-03,yancm
478,不算科幻片吧，但是很温暖。科学和宗教能握手言和，很难得，本来就该互相理解吧。片子开头的宇宙全貌，和女主角进入浩瀚太空喜极而泣地说只有诗人能形容此时的场景，两个最喜欢的片段。,1295647,4,2015-05-29,yancm
479,非常喜欢！可爱又温馨，真切的善意。在男主角的心理慢慢痊愈起来的过程中，所有人也都跟着成长了。男主角的表演让人动容。,1855834,5,2015-05-27,yancm
480,似乎上半年季终的美剧都留下了空前绝户的悬疑氛围，连这种温馨喜剧都不放过，真是让心心焦啊。Phil已经从我最讨厌的角色变成我最喜欢的角色了，太暖了，羡慕Clair一家有这样的好爸爸，好丈夫，好朋友。,25879091,5,2015-05-27,yancm
481,追了这么久，已经是情怀了。剧情发展到难以控制了.....啊！Amy加油！,25845393,5,2015-05-24,yancm
482,这一季结尾看哭了，太温暖了。Chandler真是个好男人。不知不觉追到第6季了，不舍得看下去了。,3286543,5,2015-05-21,yancm
483,什么日了狗的玩意儿啊 跪了,20490940,3,2015-05-19,yancm
484,动画凑合，拼音简直渣,11443316,3,2015-05-17,yancm
485,今天看完了最后一集，这一季不好看了，而且坑的挖也太深了吧，而且要不要所有剧和电影都向星球大战的某梗致敬啊.....Ward和33的爱情真让人恶心的想吐，变态又畸形。跪求两个科学宝宝在一起吧。刺猬仔好升华啊，拥抱了自己的使命。,25851827,4,2015-05-17,yancm
486,这么这么这么长的镜头，不觉得迷离风骚，只觉得看得非常非常累。在我看来这个超长镜头远不如《复联2》开头的五分钟长镜头精彩。对，我就是超级英雄系列的忠实粉丝，我就是好莱坞的拥护者，怎样？开枪打我啊，艺术家。,20438962,3,2015-05-15,yancm
487,妈呀天哪好无聊的剧,25862355,2,2015-05-13,yancm
488,不喜欢王家卫，不喜欢一切沉闷而不流畅的影片。但是这片子看到好多年轻的容颜，刘德华那时候真是一个帅小伙。,1305690,3,2015-05-13,yancm
489,脑残粉只要看到大家在同一个画面里奔跑就已经觉得超！好！看！了好不好！这次没想到除了快银和绯红，幻视也登场了，看他和绯红的对视果断有火花（啧啧）。黑寡妇这次的形象塑造感觉气场破了，但这对CP还是莫名很有爱的。班纳最后的背影也太落寞了吧，还有凭啥Coulson没有登场呢？！摔！,10741834,5,2015-05-12,yancm
490,,1309103,3,2015-05-11,yancm
491,很好看啊，一开始还以为是悬疑片，看到最后竟然是喜剧。非常可爱的电影，也有些感动。,6880497,4,2015-05-11,yancm
492,好不喜欢Ross这种面面的蠢男人啊.....,3286536,,2015-05-11,yancm
493,真是一部日了狗了的低级的科幻片。虽然玩着经久不衰的“意识转移”的内容，但整部片子却拍得无趣而幼稚。狼叔一张正直脸居然演的反派。出影院女朋友就说，片儿咋叫《Chappie》呢？为啥不叫《差评》得了？,6846893,2,2015-05-09,yancm
494,这部玩的也太大了吧！一天看三部速激我真是太拼了！保罗的死让人有些受不了。唉。,23761370,4,2015-05-08,yancm
495,光头还是那么帅，又深情。Letty真的好帅！从《阿凡达》里面繁荣女飞行员开始就被她迷得不行，总是这样酷酷的。,6537500,4,2015-05-08,yancm
496,继续补课。很好看！,4286017,4,2015-05-08,yancm
497,,25831308,,2015-05-07,yancm
498,Chandler好瘦，好喜欢她和Pheebs,3286531,,2015-05-07,yancm
499,补补课,1304899,3,2015-05-06,yancm
500,好喜欢这部电影，结尾的时候太感动了。名字取的真好，《编舟记》，多少人用毕生的精力只为让你在汪洋上有一叶扁舟渡海。这可能是当时看过最喜欢的日本电影了。,11500954,5,2015-05-04,yancm
501,最近后知后觉地爱上了Rihanna，一直在听她的歌。为了她和Sheldon的配音首秀特意跑到市中心看原声....质量不如梦工厂之前的作品，但是配音太加分！配乐基本被Riri和客串配音的J.Lo承包了...某日还自黑了自己巴巴多斯劳模的身份哈哈哈，乐粉不要错过。,10827341,4,2015-05-02,yancm
502,最近在电影院看过最棒的国产片了。本身就很喜欢冯远征和秦海璐两个演员，老戏骨们都演的很到位，剧情也很好，耐人寻味。值得一提的是，本片对文革的思考，对同性恋儿子相对多的描述，在中国院线电影史上，实在应该大大地记一笔。,20514902,5,2015-05-02,yancm
503,不是特别喜欢，可能看的太晚了。也不喜欢嘟嘟囔囔的伦敦腔。有些幽默欣赏不来。但是Sting当年真是老鼻子帅了，太帅,1293350,4,2015-05-01,yancm
504,我脚的挺好看的,2978752,4,2015-05-01,yancm
505,意外看了这片儿，本来就不喜欢这书。一星有点夸张了，挺搞笑的。那英的歌儿不错。剧中居然出现了一样儿科幻物品，你猜是啥？～,26259634,2,2015-05-01,yancm
506,本以为只是一个普通的日本纯爱电影，没想到还带着一点点奇幻的色彩。很可爱。松本润一扫道明寺的形象，此次出演颜值爆表。上岛树理对着鱼缸给鱼起名+哼歌的那一段，萌的我喷了一屏的鼻血,20426995,3,2015-04-27,yancm
507,我觉得没有那么烂啊，至少比《有一个地方只有我们知道》要好……两个女主之间才是真爱吧！黎吧啦真是男友力爆表。 演李珥那位真是演太烂了妈蛋。,25745752,3,2015-04-26,yancm
508,越看越好看，超好看。女喷油陪着我看了第二遍，啊哈,19938222,5,2015-04-23,yancm
509,又追完一集。一直最喜欢Micky，现在也证明了他真是本剧中最有情义的一个。谁甩他谁傻逼。,25831924,5,2015-04-15,yancm
510,只有日本才能拍出这种纯爱到搞笑的电影吧哈哈。好多年没看山P的片子，忍不住看看，没想到长残成这样。女主简直女版松本润。在B站上看的，弹幕真能笑死人啊...,25853073,2,2015-04-14,yancm
511,我怎么觉得创意捉襟见肘，啧,3823425,3,2015-04-07,yancm
512,,1419297,4,2015-04-06,yancm
513,,2263259,,2015-04-06,yancm
514,,1300069,4,2015-04-03,yancm
515,什么玩意啊！期待了这么久！结果是一这么平庸的片子。而且看的有些稀里糊涂，这谁是谁啊！！脸盲已崩溃。倒是李炫雨嫩嫩的蛮可爱。,25819726,3,2015-04-03,yancm
516,,1441612,3,2015-04-02,yancm
517,好喜欢这部片！好喜欢好喜欢。看完也要去吃份韩式炸酱面了。加油！废柴们！,3586725,5,2015-04-01,yancm
518,全智贤太美！任达华好帅！好喜欢金秀贤！希望秀man多拍两部电影。片子一般般，人物又太多了，但是取景也好人物也好都好漂亮，看的好舒服。,5502697,4,2015-03-31,yancm
519,好可爱的电影，第一对和最后一对好感人。看似说性，实际上在说爱情中沟通的重要。但沟通总是最难的，叹气。,25947154,4,2015-03-29,yancm
