,movie_comment,movie_id,movie_score,movie_time,user_id
256,随手抓了部动漫看，还真的意外地很好看。日本动漫真是不容小觑的艺术形式啊，将比较深的社会学观点和政治隐喻藏在了精彩的剧情和悬念里，只是在世界观的设定上还不够严谨用心。不过随手抓来看的动漫里都有一对儿性感的姬佬，现在已经是百合的天下了么XD,10569144,4,2016-03-08,yancm
257,握手言和,26378147,4,2016-03-07,yancm
258,好喜欢！看到泪奔。男人间这样深厚的感情到底是兄弟情还是爱情呢？因为是俄罗斯的作品，忍不住感觉又有了层更深的寓意。,26042888,5,2016-03-07,yancm
259,有种奇妙的幽默感和温馨感。以及英音真的好难听懂哦T.T,25900249,4,2016-03-07,yancm
260,一个姬佬外婆的一天，有点温馨，又有点忧伤。无论如何，就是一个平常人不太平常的一天，不管你有怎样的性取向，都会同样地拥有幸福，与寂寞。,26279353,4,2016-03-05,yancm
261,优酷首页竟然推了国产姬片于是我就看了，震惊于还有那么多人对女同的印象停留在超短发/纹身/打篮球。编剧如此不了解大学生活和姬佬甚至是爱情么？赢一个女孩靠篮球？铁T妹妹演戏的时候嘴能不能不要歪到后脑勺，简直比某泰国电影的女主还过分。气。,26728689,1,2016-03-03,yancm
262,这可能是我第一次给电影打一分。我就是想看看百合而已，但原来是正室和小三的故事哦，宣传的“床戏”原来就是把两对儿异性恋滚床单蒙太奇成似乎是两个女在滚。既然不是搞姬为啥从海报到宣传微博/公众号都在炒是搞姬呢？！！消费我们少数群体好玩么？！气！高群书，我记住你了。,26637534,1,2016-03-03,yancm
263,美国春晚也是越来越难看了，美国的“政治正确”越来越让人恶心。鲁尼·玛拉不拿奖天理难容；说《卡罗尔》无聊难看活该的我也不想说啥了。多一星给Lady Gaga。,26635418,2,2016-03-01,yancm
264,虽然剧情散了很多，最爱的Nicky走了，还来了个JB脸，但是最后一集真的是温馨到让人想哭。温馨的同时又危机四伏，唉，人生，多么无奈。,25890358,4,2016-02-26,yancm
265,"虽然很逗，但是过度的血腥和色情让我在大屏幕前感到很不适，嘤，但看到pool还是挺开心的，记得最早用PSP玩《终极联盟：内战》的时候最喜欢用的角色就是Deadpool和Iceman了，反正都是钢铁侠那一队的就是了~【是的我就是钢铁侠的脑残粉【 Die, Captain! D·I·E!!",3718279,4,2016-02-24,yancm
266,CHC高清和我爸看的。并没有很烂啊，甚至还不错。虽然有些剧情有点牵强，但完全没有这么烂啊...大家是为何打一分呢？不懂,20266753,3,2016-02-17,yancm
267,为了最后一集也要打五星啊，一个半小时的内容完全不输给一部电影的精彩！好精彩的群像。,24859431,5,2016-02-17,yancm
268,不管广告多装，都会一直爱豆瓣。谢谢你，豆瓣。,26728787,,2016-02-16,yancm
269,好看呀好逗呀！很喜欢，立意什么的还是没有第二部好，但是大过年看这个片子真的超级舒心啊！中国风的运用非常的赏心悦目，朴素地讲述了盈满则溢的理念。另外，老虎和熊猫萝莉是不是可以组个CP？,11589036,4,2016-02-13,yancm
270,其实大鹏的屌丝男士还是挺逗挺原创的，作为网剧来说算是不错，但他没有驾驭长篇的能力，都是一些大鹏式的段子拼凑在一起，虽然有的地方很逗，但难称之为电影。唉，最近只有心情看喜剧啊~,25895276,,2016-02-11,yancm
271,人有时候会在一些竟想不到的情况下看电影 哈哈,1308784,,2016-02-10,yancm
272,这是一个月来我看的唯一一部电影，以为能很开心结果还是带着沉重的心情出来了。很多滑稽的地方其实好血腥看的我都觉得疼根本笑不出。对星爷没什么特殊的感情，但很喜欢邓超的颜。,19944106,3,2016-02-09,yancm
273,虽然剧情很俗套还是看哭了。弟妹真是个活宝啊。,5364952,,2016-01-23,yancm
274,安以轩还是长发美丽 大卷,2148843,3,2016-01-21,yancm
275,唯一看过的偶像剧吧，郭品超跟速水重道长得可真像,2148836,,2016-01-21,yancm
276,记得当年看完第一季之后翻回头去看X战警已经无法直视万磁王了。刚突然知道这剧被砍了，真是晴天霹雳。,24748854,5,2016-01-12,yancm
277,好黑色幽默又有点可爱。所以他们监狱（劳改所？）过得日子还挺舒服啊，能去图书馆能运动能看电影能按时吃饭还有小派对和节日会。好喜欢Nicky啊！也喜欢Alex的隐忍，戴眼镜这点莫名戳中我>//<,20506276,4,2016-01-09,yancm
278,大家是咋看出好看来的？,1292790,2,2016-01-07,yancm
279,很喜欢啊，甚至小细节都很喜欢，意外地觉得那个忘年之吻很动人。时间的洪流被贾樟柯拍得淡淡的，因为淡，又更深入骨髓。,25890005,4,2016-01-06,yancm
280,结束的时候我鼓掌了。六爷就是我大爷，是我四奶奶家的老九，是我大奶奶家的铁环子，是我的邻居六柱子，是我的表叔小六。我从来没喜欢过他们，也从来没懂过他们。,24751756,5,2016-01-04,yancm
281,被结尾字幕的数据震惊了，而我所生活的地方也赫然在列。最让我喜欢的就是几乎没有渲染他们被阻挠的过程或煽情对峙的场景，只是踏踏实实地做事、求证。而我向来喜爱一切揭露宗教制度丑恶的作品。,25954475,4,2016-01-03,yancm
282,虽然演技着急，口音搞笑，录音差劲，但是这种女学生爱上女老师的故事就是让人超兴奋啊XD，我也好像把我的故事拍成电影啊。真巧，初恋也曾送过我一本《无怨的青春》，今天我突然就读懂它了。,26235754,3,2016-01-03,yancm
283,哈哈哈笑死了，柯南和小兰请快点加入复仇者联盟豪华套餐吧。,25782633,,2015-12-30,yancm
284,我很好奇，这些优秀的毕业生们最后都去向何处了呢？,26581251,5,2015-12-30,yancm
285,喜欢，一看就是踏踏实实做的电影。结尾的字幕虽然有点泄气，仍然不能掩盖电影迸发出的希望之光。未来真希望能进入这样的团队【导演收了我吧！我能剪又能演啊！,25917973,5,2015-12-29,yancm
286,这脑洞哈哈哈！虽然剧情好散好扯单梗好多笑不过来！不过总觉得这片子涉嫌性别歧视==,3101548,,2015-12-29,yancm
287,博弈,1408100,,2015-12-28,yancm
288,好！陈建斌想探讨的内容就是我一直最感兴趣的内容，电影颇有点刘震云小说的味道。夫妻两个演技太好，敬业。中国的演员都应该这样，演什么地方的人，就学什么地方的话，穿什么地方的衣服，做什么地方的事。可惜，结尾的演员表连羊都有，却独独没有王学兵。,25926267,4,2015-12-28,yancm
289,《乌云背后幸福线》再聚首，《实习生》萌老头儿变成讨厌精。全片没啥点，还很冗长，看的屁股都酸了。大表姐的大脸盘儿也一直不是我的菜。,25901741,3,2015-12-28,yancm
290,BB8太可爱了吧萌哭了！哼，但我仍会站紧R2-3PO情侣党不放松！不是老粉的我看到那些旧日的人与物也差点流下感动的泪水，只是感觉剧情有些雷同没新意。女主好好好帅气，明年万圣节我是扮Therese还是Rei呢？？,20326665,4,2015-12-27,yancm
291,,1297151,,2015-12-27,yancm
292,,26438924,,2015-12-27,yancm
293,,3262918,4,2015-12-27,yancm
294,意义大于内容的电影，小雀斑一扫《木星上行》给我留下的丑陋印象。作为女人觉得穿起裙子擦上口红的时刻是无比幸福的，超级理解Lili在那一刻的心动，敢于坦言地接受自己多么难啊。男配长得好像普京啊，以及很污地好奇小雀斑的JJ算大的么？,3071604,3,2015-12-25,yancm
295,今年真是姬佬的大年，除了女警察爱上你（摩尔），女贵妇爱上你（布兰切特），现在还有女王爱上你。在一本巨大的书上爱爱真是意外地有情调呢~,3153991,3,2015-12-22,yancm
296,壮阔而阴森，寒气逼人啊。这个故事告诉我们恨比爱更能让人咬紧牙关活下去。小李没两句台词，还拿命在演戏，可今年依然胜负难料，想想也是心疼。,5327268,4,2015-12-21,yancm
297,超级喜欢，大学的时候还重温过，也是够,1870436,5,2015-12-19,yancm
298,本来想打三星但老头儿也太可爱了吧！海瑟薇穿衣服真好看。,10594965,4,2015-12-19,yancm
299,精彩的镜头，仙境般风景，配乐极好，台词也时不时迸发着智慧的光芒。但这一切都不能减轻我在观赏过程中感觉到的无聊与疲惫。,25766754,3,2015-12-18,yancm
300,那个年代的女人真美。生养儿女可真没劲啊。,1294433,,2015-12-16,yancm
301,,1296528,,2015-12-16,yancm
302,整个故事重点感觉不太明确，但是视觉效果看着还是爽翻，恐惧深海者千万不要去看IMAX啊。大锤这次帅出新境界，男人气太足，还有点基情的碰撞。想起《公园与游憩》里的Ron最喜欢的书就是Moby Dick，因为这是一个最简单的故事：A man who hates a f*cking stupid fish.,3582181,3,2015-12-16,yancm
303,为《原力觉醒》补！突然想起有个说法是荧屏第一对同性恋情侣时R2-D2和C-3PO，笑。俩人拿着破灯管子瞎挥那儿实在有点简陋得搞笑。,1293838,,2015-12-15,yancm
304,还真有这条目……本来对这种形式大于内容的片（？）没报什么希望，然而真正震惊到我的是布兰切特一人分饰12角的自如与传神。化妆也细致，甚至每个角色的牙齿都不太一样。十二个不同的角色在不同的屏幕上，又突然在同一时刻看住镜头唱（？）出了充满仪式感的“宣言”。出艺术中心时我已怀孕。,26414254,4,2015-12-12,yancm
305,又追完了一部，瞬间感觉生活都黯淡了……Gyle真的不是外星人么……,25923092,5,2015-12-10,yancm
306,我对香港的感情为0,25710912,2,2015-12-09,yancm
307,哈哈没想到Megan和Offerman夫妇也来献声！！声音出现的那一刻瞬间串台到Will & Grace和Park & Rec。感觉这也是个女王嫁屌丝的故事。,21327493,3,2015-12-09,yancm
308,3.5 对于不太了解和关心美国政治及新闻业的人，很多地方不太能get到点【如我。电影拍的挺紧凑的，看得很舒服。这个月在影院看了三部布兰切特的电影，Mary这个角色相较于Carol要逊色不少，但是布兰切特演女人崩溃的样子简直不能更真实，感觉哭戏比Carol发挥的好多了....,25925430,4,2015-12-07,yancm
309,某人因为期间跑去演星爵拯救宇宙，本季摇身一变成为了大帅哥。第一集和最后一集好戳心窝子，简直看的泪流满面了。,24697595,5,2015-12-05,yancm
310,还不错，因为在墨大取景，所以满眼都是每天我路过的风景，上过课的教室，坐过的电车，甚至逛过的菜市场.....格外亲切。当年给这本书打了一星还是两星？不喜欢书里的安东尼，但蛮喜欢电影里的安东尼，一个温柔的矫情逼。,26269510,3,2015-12-02,yancm
311,哈哈哈确实挺好笑的，东北口音和几张熟脸又有一股看春晚的喜庆感，不过整个剧情还是非常简陋。耳背的大爷特别像我高中门口送外卖的那个大爷：“你要宫爆什么？噢，你要什么鸡丁？”话说演那英的大姐没有拍那英板儿砖的大姐像那英，秋雅长得好像杨幂。,25964071,3,2015-12-02,yancm
312,到了这一季感觉质量有些下滑，没那么好笑了。这也是胖Andy存在的最后一季了，马上就要摇身一变成星爵拯救全宇宙了。,11637978,4,2015-12-01,yancm
313,感觉整个剧情发展有一点点奇怪，但是仍然觉得感动啊。即使被无辜陷害千夫所指，仍然能够靠着朋友和善良路人的帮助逃出生天，有些朋友甚至最后都没能见上一面。好善意的感情。,3660428,4,2015-12-01,yancm
314,事实的真相是刽子手们并没有一丝愧疚和不安，依然过着富庶舒适的生活，安然地等待寿终正寝，回到当年虐杀无辜人民的地方，也不忘比个剪刀手和大拇指照一张合影。制作人名单出来时，满屏全是“匿名”，印尼人至今都活在恐惧与不安的阴影中。,25824781,4,2015-11-30,yancm
315,比想象中的好看太多，不是平淡直白的传记电影，故事讲的也非常精彩。所有死亡后的追封都是无济于事的，我们应该对每一个活着的人都更加友善。一个孤单的人，唯一的爱，唯一的朋友都没了，那该是怎样的生活呢。看的我不禁悲从中来了。,10463953,5,2015-11-30,yancm
316,我真是什么鬼都看过呢,3718447,2,2015-11-29,yancm
317,当霍金说我们应该提防人工智能的时候，大家都应该严肃地好好听着。不管程序编的多好，人工智能有的永远不是感情，而是目的。以及连我的手机都是指纹解锁的，为什么片中的科技达人老板家的门还要刷卡才能进？这不是留下隐患么。,4160540,4,2015-11-28,yancm
318,有点刻意，有点浮夸，但是观影的过程还是很享受的，也被王大陆小小地戳了一下少女心，当然最戳少女心的还是女主终于见到刘德华的那一刻。中学时候的感情多单纯啊。王大陆打架的那段有点致敬《热血高校》的意思？,26366465,3,2015-11-26,yancm
319,我不管！我爱Ron！,5977984,4,2015-11-25,yancm
320,终于补了这部，虽然一直推魔王的咨询，当让我站队我站玛拉啊！玛拉可硬可软，可攻可受，可屌可萌，奥斯卡欠她一座小金人。不满意玛拉跟男主的船戏觉得好好好多余啊，能不能酷炫而利索地把案子办完了拍拍屁股骑上摩托去跟魔王滚床单呢？,4206357,4,2015-11-25,yancm
321,天呐这世界上怎么能有这么无聊的片子，布兰切特的出场和她让人怀孕的旁白也救不了它了。镜头运动令人作呕，音轨的进出与切换十分诡异。影院里有一半人走了，留下的人有几位也鼾声大作，我坚持到了最后，只因为票价太贵。,6966617,2,2015-11-23,yancm
322,片头那些经典原作画面的出现，让我着实感动了一大把。但之后却越来越失望，到最后达到了失望的巅峰。小王子可贵就在于他的纯真，他不需要赋予任何东西意义，然而电影却硬生生地塞给了他意义。小王子在我心中本来特别的完美，但电影毁了这一切，让我再看小王子时有了一丝瑕疵。真后悔看了电影。,20645098,3,2015-11-22,yancm
323,看完就后悔为啥没去看IMAX的电影。最不高兴的是炫酷而爽朗的老阿姨们都死的太随便，最高兴的是全片没有多余爱情的出现。看到塞隆阿姨真的是把裤子都脱到脚踝了。,3592854,4,2015-11-21,yancm
324,好好看啊！好喜欢女主角，像打鸡血一样努力但是又那么善良。虽然第一集就被弹幕剧透了Ron是【哔——】但还是抑制不住地好喜欢他。从此关掉弹幕看美剧。Ron生日那集我真是忍不住差点落泪啊Q.Q,5317248,5,2015-11-21,yancm
325,我去好好看！有种挖到宝的感觉。没想到星爵是常驻，他当年可真是太太太萌了，看完侏罗纪再翻回头来看他的情景喜剧又有反差萌加成。好喜欢Leslie和Ron，讨厌印度阿三哥。以及欺凌这种情况真的是在哪儿都有啊，这部分觉得心很塞。,4066190,5,2015-11-20,yancm
326,看着最后大家都幸福我也就满意了。一个受伤的人找到这么一点脆弱的幸福真的太不容易了，唉。,3302803,3,2015-11-19,yancm
327,从初中一直被安利到研究生，终于把它看完了。自以为已对日剧免疫的我，也着实被小武的告白感动了一把，小武人真好，好想和他作朋友。话说剧是08年的，那会儿以剧中瑠可的生活及人际环境来看，有个性别认知障碍需要这么这么这么纠结么？【《向阳处》后一直好喜欢树里，不过扮相这么帅还是有点接受无力,3011225,4,2015-11-19,yancm
328,哈哈好可爱的电影啊，虽然其实最后也没有讲什么，但是搞笑又有些温馨，别墅戏尤其有趣！感觉女孩子真是个孤独的人，非常理解她的心情。,24708493,4,2015-11-16,yancm
329,【165】太玄乎，一个人夜里看，有点儿承受不来。百合福利真是不错，只是黑毛儿的胸实在太假了。最让我难过的是，即使是在梦里黑毛也没有开口说爱她。,1292217,4,2015-11-15,yancm
330,开了一部新剧，女主简直就是女版Phil啊，从神情到长相都像啊！期待后续发展。我发现我格外喜欢伪纪录片的形式……,3419246,3,2015-11-15,yancm
331,三个多小时，眼睛酸胀。从头到尾都弥漫着一点心酸的幽默，结尾一收拢，又让人觉得沉重而难过。安藤樱的感觉一直让我非常非常喜欢，她是那种如果出现在真实生活里，我会不自觉地慢慢爱上的人。,21767183,4,2015-11-14,yancm
332,好就好在，讽刺得并不直接而强硬，反而有点精致。但是一共只有14个固定长镜头+全无背景音乐，让非文艺片爱好者的我看得很是疲惫，而且其实本片的内核还是比较浅层的，即使拍成40分钟，也不会有何损害。不过我看出了希望——看来小成本也不是什么问题嘛！,25812507,3,2015-11-13,yancm
333,不错，真不错，感受到导演小心翼翼地躲开了雷区。演得最好的还得说是老段，那眼神儿，纠缠着多少复杂的感情啊。作案动机也没说清楚，死的可真够冤的，不过死的最冤的还得说是那个协警阿松，只有个冷兵器您就别往前冲了，挥个斧子就死了，这也他妈太炮灰了吧，心疼。,24719063,4,2015-11-13,yancm
334,【166】我觉得一点都不好看，看似欢快乐观的态度，其实行为上早已经自我放弃，害怕孤单的人生，将意义依赖于他人的人生，看不出太多可怜，只觉得可悲，又可笑。（明日香君才是全片的亮点吧喂！）,1787291,3,2015-11-12,yancm
335,得了一种【一打开netflix就会自动点开无脑电影】的病,1309084,,2015-11-11,yancm
336,难产了，朱丹推荐我看这部找找灵感。聊着万叶集的场景确实很有诗意，这种细腻的小感情，有过相同经历的人大概会很有共鸣吧【比如我。画面音乐很美，只是空空旷旷的。,20470074,,2015-11-11,yancm
337,哈哈哈哈哈哈哈哈哈操！,26661104,5,2015-11-10,yancm
338,终于闲下来看了部电影，喜欢这种浅浅的，慢悠悠的温暖和感动。有个小疑惑，最后福山雅治一家驱车回乡下的那一部分，为什么用的上下抖动的镜头？不知道有什么深意。,10571509,4,2015-11-10,yancm
339,精美，精致，盛赞配乐。里面的小男孩实在是惹人喜爱。看完了觉得好温暖，一个不破案的福尔摩斯变成了温柔的老人。只是看着Ian的老态，想到我活着的时候就要见证他的离去，就觉得好难过。希望基老伴能拍到第五季。,25727048,4,2015-11-09,yancm
340,节奏不好，不够精彩，维权成功时也没觉得特别激动。摩尔XPage的组合看的不是很舒服，但是是因为本身依托的真实事件也是忘年恋。看完The Office又见Steve Carell还是挺开心的。Ellen Page讲话那里我还是没绷住，最后她抱着小盒子独自坐在海边哪里，好想去抱抱她。,4881217,3,2015-11-09,yancm
341,白百何惊艳，从此对她另眼相看。与剧情无关的场景及特效太多了，缺乏对电影的严肃感，以及向日葵那段我严重怀疑抄袭了TLW。但问银行卡密码那里，我还是哭瞎了（下辈子做亲人那句多余了），看的开心又难过，还算喜欢，可送去申奥，依然觉得脸上无光。,26289144,4,2015-11-09,yancm
342,在Netflix上随便戳开的姬片，没想到主演是《废柴联盟》的Britta！惊喜。然而为什么最后讲的是一个直女和一个姬佬纯洁而亲密的友谊呢？（姬佬和直女这种程度的纯友谊真的存在么？！）我收到了深深的伤害。,24523811,3,2015-11-08,yancm
343,最终季也太好看了吧，好笑又温馨，最后一集看的我哭的都不行了T.T。好喜欢Dwight和Jim别扭的友情，他终于当上经理的那一刻我也在屏幕前为他鼓掌了。平凡的工作里也有好多美好啊，看完这部剧对工作都没那么恐惧了。,11232690,5,2015-11-07,yancm
344,没想到Micheal走了也很好看啊，好喜欢Dwight啊！！所以他才是本剧的灵魂对吧。,6810257,5,2015-11-02,yancm
345,我还以为是个有关时尚的喜剧，没想到是个充满黑色幽默的沉重复仇剧。温斯莱特这回真是美了一把，就是肉实在是不老少...结尾的复仇女神形象相当惊艳。但大姐你真的没被诅咒么？...葬礼那里明明心塞塞的还是被异装癖警察给逗笑了。以及又看了一遍《卡罗尔》预告ヽ(〃∀〃)ﾉ,25697098,4,2015-11-02,yancm
346,#AdlFF2015 阿德本地年轻导演的作品。很有感情，中规中矩。,26654452,3,2015-10-30,yancm
347,结尾的时候我窒息了。凯特的表演令我略有失望，可鲁尼·玛拉...凡是深深暗恋过一次的人，都能在她的表演中得到共鸣。克制，复古，充满感情。我被感动和幸福久久地包围。,10757577,5,2015-10-27,yancm
348,好看！黑色幽默的极致，好笑的同时又相当有冲击力。无论是独裁者还是革命者，都是没有余地可商的扑克脸，哈哈。不过最幸福的还是又在大屏幕上看了一遍《卡罗尔》的预告。,20514947,4,2015-10-26,yancm
349,妈妈的脑内！！哈哈哈,26592232,,2015-10-25,yancm
350,明明之前最讨厌Micheal的，看到他走的那一刻我也各种泪目了。 喜欢Holly，绝配，让人相信真爱，相信那个命中注定啊。,5279668,5,2015-10-24,yancm
351,,4173583,1,2015-10-21,yancm
352,当年觉得好好看啊！,2282511,,2015-10-21,yancm
353,,25758898,5,2015-10-21,yancm
354,又来世界第三大屏体验的，恐高症如我吓的尿了好几次。但这恐惧中又夹杂着快感，每根肌肉都蹦的紧紧的。最后在双子塔间配着钢琴曲行走、行礼、感受、致意的时候，我感动的哭了。又是人类渺小和伟大的反差带给人的震撼。为IMAX而生的电影。YOU DO HAVE THE GUTS！啥也不说了，洗裤子去了。,25819229,4,2015-10-20,yancm
355,,1307862,,2015-10-19,yancm
356,看这片对自尊产生了严重的打击——从前20分钟开始就基本听不懂了，只好连蒙带猜地看完了。即使这样的情况下结束的那一刻也感受到了绝望与窒息。镜头漂亮，剪辑精彩，主题灰暗，界线模糊，夜视戏尤其出色，非常抓人。片子很挑战人对道德法律及暴力的认识。Emily的美杂糅着硬气和脆弱啊。,25881247,4,2015-10-19,yancm
357,喜欢，看的很享受！只是所有人的颜值加起来还没有后妈高（后妈笑的太魔性了，倒回去听了好几遍哈哈哈哈）。想说这两年迪斯尼的童话剧都是靠着各位后妈在苦苦支撑啊（茱莉+凯特）。啥也不说了，凯特女王请快来推倒我，对，就现在，立刻，马上。←吃药,6875263,4,2015-10-19,yancm
358,,4040275,4,2015-10-14,yancm
359,喜欢结尾的巧克力牛奶。看他们开心又自信地走出厕所时很感动，爱情本来就应该是这样的嘛！喜欢同性又怎样呢？ 有评论说是斯嘉丽+娜塔丽·波特曼谈了场恋爱，逗笑我了，还真挺像的。,1293372,4,2015-10-13,yancm
360,本以为温馨而治愈，结果看的我泪崩了。医院那场戏，视觉和听觉上的直观震撼，瞬间将我击晕在座位上了。高潮真的很精彩，而且从头到尾都充满一种搞笑的氛围，看的人又开心又难过，只好偷偷抹眼泪了。,24325923,4,2015-10-12,yancm
361,看完了心中一个大大的操字。小卖部的高潮一榔头把我捶晕在了地上，让我受到了无比之深的震撼，这样的震撼从来只有韩国电影能带给我，把我拖向社会黑暗的无底深渊。真是泪都流不出来，只有一阵阵的毛骨悚然和失望透顶。,3006309,5,2015-10-12,yancm
362,,3100868,4,2015-10-11,yancm
363,看的我老泪纵横。本以为只是两个女人深厚的超越友谊的依赖，却不想最后打破了那层朦胧变为了坚贞不渝的爱情。刘嘉玲，杨采妮，归亚蕾，都没有让人失望，眼里全是深深的感情。充满了遗憾的一生，终于迎来一个相逢。感恩我不用经历动荡。（想起前阵子传刘嘉玲是同性恋的消息，让片子更多了一点微妙。）,1304648,5,2015-10-10,yancm
364,继续补全一下李安的电影。对这部的感觉还算一般，大概从经历上讲，无法产生感情上的共鸣吧。喜欢那个读《白痴》和《神奇四侠》的少年。,1300930,,2015-10-10,yancm
365,大部分演员念文言文，就像大部分中国人讲英语一样，缺乏一种“语感”，不知道正确表达情绪时轻重缓急应该放在哪里。最近很累，看这电影睡着了两次，没觉得喜欢，况且我一向讨厌朱氏姐妹。去了戛纳的人说今年只有《聂隐娘》和《卡罗尔》让人喜爱，看来我只能继续苦苦等待《卡罗尔》了。,2303845,3,2015-10-10,yancm
366,初中时候看的我哇哇哭啊，还把结业式的台词都抄下来了。,3685959,,2015-10-07,yancm
367,所谓的玩脱线了，就是这个意思,3696535,3,2015-10-07,yancm
