,movie_comment,movie_id,movie_score,movie_time,user_id
242,也是最早的偶像电影之一了吧，换衣入浴镜头虽然都是噱头但是都有。木之内在写真里有着各种表情，但是在这部电影里则总是挂着嘴角上扬的微笑，这种跳出语境的表情对于偶像电影来说十分迷人。,26427695,,2017-06-29,johnvivi
243,第一部互换身体，第二部穿越时空，第三部恋人轮回，大林也算是把科幻+青春玩了个遍了。侧脸梗不错，母控必看,1307230,4,2017-06-28,johnvivi
244,美如画美如画。绀野美沙子最好看，浅野温子最美,1306291,4,2017-06-28,johnvivi
245,变回来之后那段真棒啊,1548765,,2017-06-28,johnvivi
246,舞台剧版的演技还蛮喜欢的，衬这种古装武侠故事，兄妹情那段的镜头和走位尤其好。冈田奈奈好美,1421780,4,2017-06-26,johnvivi
247,质量还是很高，人物特别典型，就是那种商业片所需要的伟光正的感觉。,26772013,5,2017-06-25,johnvivi
248,要放在偶像电影和新浪潮的双重系谱下面来看。,1300999,4,2017-06-23,johnvivi
249,角川传奇的开始。故事本身非常具有隐喻性，剪辑和手法上的一些先锋的moment也非常有意思。,1729037,,2017-06-23,johnvivi
250,莫名分数比第一季高？？？制作挺微妙的，不时作画崩，尤其OPED（最后一集才是真ED）。后期微妙白学走向，但搭配轻喜剧部分还ok。惠开始不路人（有个性）之后感觉微妙，反而觉得学姐败犬配不错，但是把伸出的手收回去那段还是100分的。（对了预告是正片）,26381231,4,2017-06-23,johnvivi
251,大林宣彦就是大林宣彦，没的说。眼镜哥怎么有点像洼冢……,2241118,5,2017-06-20,johnvivi
252,要好过杀死比尔，而且后者模仿的地方居然这么多。视觉上十分inspiring。干脆到底甚至不惜杀死作家的性格格外令人喜欢。最后的鹿鸣馆暗道在空间上很有意思。,1440347,5,2017-06-20,johnvivi
253,小松是广告片拍多了么，感觉还是大根演技。设定本来有点期待，结果不就是时间旅行者的妻子么,26707472,3,2017-06-17,johnvivi
254,木乃伊这个IP没形成自己的类型隐喻和世界观，穿越两河伦敦唯独不在埃及正是本片碎片杂糅的象征。先是丧尸片和恐怖片，女主像港产僵尸一样吸阳气回春，像白素贞一样砂漫伦敦，又像狼孩一样被捕捉、怜悯，每次亮相都充满异域性暗示。最后男主来点虚实交错和钟楼怪人结局。博士验指纹还是化身博士的梗。,20451290,1,2017-06-10,johnvivi
255,用力过猛的装腔作势，到最后像是电影里的那个游乐场一样失败。少女暴力团显然受到园子温影响（下楼梯），但同样更像是摆艺术姿态而政治意义天真（最后少女暴力团里混进了主妇和大妈，稍微好点）。两个主角也像是纯粹为导演的个人趣味而百合（美好世界），两者的经历并无什么关联。镜头和细节倒是不错。,26644833,3,2017-06-07,johnvivi
256,你的名字、在这世界的角落、声之形代表了动画的哪三种面向很有意思。而京阿尼的就算再精致再有艺术感，也还是属于宅的。这种艺术感不同于新海诚对大众友好的CG唯美，也不同于在这世界的角落的那种艺术片感觉，而始终带有亚（宅）文化的味道（比如说场景和细节再写实，也还是有一种深层次的fetish味道）,26264454,4,2017-05-17,johnvivi
257,,11611021,4,2017-05-17,johnvivi
258,最后樱井幸子也离开了娱乐圈，逃到遥远的海外去了,1753181,4,2017-05-16,johnvivi
259,几乎是套用春娇与志明的套路，但彭浩翔还是很鸡贼的，知道比如说不能把杨幂拍成“骚浪贱”引发中港矛盾，所以就变成了无伤大雅的陆对台之嘲讽。,4881607,,2017-05-05,johnvivi
260,杨幂和徐峥分别是男女对于理想对象的符号性幻想，正如片中北京一样的抽象，只不过是梦一般的异境的象征。最后的结局……还真是都市爱情喜剧呢,6386345,,2017-05-05,johnvivi
261,还蛮喜欢误解搞砸的情节的，而且这也不仅限于推理剧。最后，为了包庇别人的罪，而让想要包庇别人的罪的人不要包庇自己（不存在）的罪的设定还蛮有意思的。（从外面锁里面的公寓到底是什么鬼）,25960944,,2017-05-02,johnvivi
262,又来0话不算话,27013174,4,2017-05-02,johnvivi
263,,26020796,3,2017-05-01,johnvivi
264,所以说哪里滚烫了,26421442,3,2017-05-01,johnvivi
265,我到底是看了一个什么……,3011225,3,2017-04-30,johnvivi
266,,26636841,5,2017-04-26,johnvivi
267,,26276498,4,2017-04-25,johnvivi
268,大部分谜题都是通过补足信息来解决的，不过最后两集的都市追逐战真是惊艳。城市高架、天桥，购物中心、安全通道和地下车库，废弃工厂、烂尾楼，楼道、小区、小巷，环状高速，郊区民房、河岸、铁轨，以及最后岔路的广场和各自的路途（高铁、机场电梯、家庭内部）。唯一有缺陷的是感情线基本都有点强行。,26603847,5,2017-04-24,johnvivi
269,有一些女性导演的特色,26611076,3,2017-04-23,johnvivi
270,看着看着感觉挺套路的了……就是下乡瞎逛，找民间书画艺术家，跟小朋友闹几大法宝。蹭饭的脸皮厚了倒是真的，画不错。只有绿皮车上的交流好。,3843354,4,2017-04-21,johnvivi
271,安宁落寞的表情有点像上野树里。,6894818,4,2017-04-21,johnvivi
272,经典意象大堆积。ED拍得不错。山岳据点和浅间山庄的指涉。但是电视台导演说了：“什么也不会改变的。”,1966951,4,2017-04-21,johnvivi
273,本片受捧表现出人民群众对国产“烧脑悬疑”类型的热烈渴望；前半城乡杀马特的风格我还蛮喜欢的；赵宁的乡非造型和dv风念白也颇有魔力。,4888230,4,2017-04-18,johnvivi
274,石井隆是有多喜欢这种等人不来的故事,1949869,4,2017-04-17,johnvivi
275,情色版的都市爱情小品……,3744888,4,2017-04-17,johnvivi
276,媒体与二次强奸；记者被受害者反强奸，自己成为报道连载的最后一期受害者；风格化，渲染trauma,1949890,4,2017-04-17,johnvivi
277,故事和手法都不错；原来Love Hotel也是石井隆编剧；镜子和水波中扭曲的面孔和身影；老彩色片里的红色都很鲜艳,1761021,4,2017-04-16,johnvivi
278,看过的人意外的多啊；暴走族青年的忧郁,1449783,3,2017-04-16,johnvivi
279,是岛与台湾,1306885,,2017-04-16,johnvivi
280,妈呀好纯情和好现代啊,1459820,4,2017-04-16,johnvivi
281,。,1292790,5,2017-04-14,johnvivi
282,是不是很多人会希望没有下集？,5288887,3,2017-04-14,johnvivi
283,唉一贯的味道，80年代到世纪末，相米慎二从偶像拍到老偶像,1394535,,2017-04-13,johnvivi
284,幸好不是婆婆上门……不然就真拍不成了吧,1477917,4,2017-04-12,johnvivi
285,最后的废墟庭院shot,1306481,,2017-04-12,johnvivi
286,美，先是祭的火，然后又是水上燃烧的龙舟。心理治愈片。,1401240,5,2017-04-12,johnvivi
287,最有魅力的部分还是来自《堤》的,1298744,4,2017-04-11,johnvivi
288,98年炒黑客帝国和楚门的冷饭，实在是没啥意思。最后大战尤其凸显出好莱坞的俗烂趣味。,1292332,3,2017-04-10,johnvivi
289,押井守生于大田区，东京的港湾地带，自称“东京原住民”，他心目中的东京是水上的城市，是渔民屋与小作坊，因此他饱含深情地描绘旧河道与湾岸的工厂。拓殖与南云约在高架下阴暗河道的小船上见面，正是因为他拒绝陆地上的东京，他要炸毁桥梁。对他来说，作为大都市的东京是外来人的东京，是“虚幻”的。,1449328,5,2017-04-10,johnvivi
290,有点能够感受男主那种没有爱的空虚感，不过总体还是不怎么太感冒是枝式美学。为啥孩子要成为救赎的纽带？,26581774,4,2017-04-10,johnvivi
291,纯正的大林风味,1645518,4,2017-04-10,johnvivi
292,1959年的前作所描绘的是冷酷杀手的形象，而这一版则有一种朋克式的虚无和疯狂，也算是那个时代的声音吧。80年前后的角川总喜欢在片头片尾用大俯拍，看起来有一种时代感。,1959218,4,2017-04-10,johnvivi
293,反思别人反思过的还能叫反思？就像电视本身，其实每天都在播一样的东西，但还是要装成每天都在播非常新鲜的东西一样。,26303060,3,2017-04-10,johnvivi
294,其实并不狂热，反而像是一场青春期的高烧（fever）。各种成长（还是移民家庭）的残酷与烦恼（意大利家庭真是和中国一样传统啊）。迪斯科本来是一种表现成熟感的舞蹈吧，因此片中才多次出现主角19岁的身份和迪斯科之间的冲突，而爱上成熟女人、车震、堕胎、死亡都是开始进入成人世界的标志性事件。,1293726,5,2017-04-09,johnvivi
295,与攻壳的香港风幻想曲不同，这是献给老东京最真挚的挽歌。89年正是湾岸被指定为第二代副都心后，泡沫景气建设开始之时。同年的这部作品，大半都在追索超高层商业开发、填海造地下消失的河道系统、街区和老房子。在80年代讨论个人电脑、操作系统、木马程序可谓超前，大量援引圣经隐喻也早出EVA不少。,1467778,5,2017-04-09,johnvivi
296,5分钟扫完……,3206838,,2017-04-09,johnvivi
297,,1306626,5,2017-04-09,johnvivi
298,经典的情节但是有味道,1296266,,2017-04-08,johnvivi
299,真好,2971778,4,2017-04-07,johnvivi
300,,5951244,,2017-04-07,johnvivi
301,感觉很好,1401282,4,2017-04-07,johnvivi
302,日版《天注定》。,26279289,3,2017-04-06,johnvivi
303,木村大飙演技。富士拍得非常有时代感，变成了团块一代的社会背景之下的毛姆，以至于难以想象60年代的这个故事究竟是什么样。,3670481,4,2017-04-04,johnvivi
304,,1292327,5,2017-03-31,johnvivi
305,youtube评论下面一群网右……,10569154,5,2017-03-31,johnvivi
306,别问我为什么看……,26426019,2,2017-03-31,johnvivi
307,挺努力的啊,26865947,4,2017-03-31,johnvivi
308,,26864121,4,2017-03-29,johnvivi
309,陈坤讲重庆话还是令人耳目一新的，不过为什么其他几个人都要学成都话？？？,25662327,3,2017-03-26,johnvivi
310,想树立的（虚幻的）东西太多了，看管虎还是不那么舒服,24751756,3,2017-03-26,johnvivi
311,wide show今天叫做“报道番祖”，这种节目体裁显示出日本一贯对低俗性的承认，即承认新闻和娱乐是无法分家的。最后让观众们动动手指给予希望的设置有点问题，好在滨田并没有信它：“电视都是垃圾！”“但你还是喜欢的对吧？”“消磨时间罢了！”电视仍然是终极的犬儒媒体。大搜查线和“现场”的梗加分,26607046,5,2017-03-25,johnvivi
312,还对机械制造抱有幻想和感情的动画已经不多见了，像90年前后的宅作。直到最后都在期待所有线索合起来，有点失望。作者的想法很多，四国老工业区的老“硬件”产业如何面对“软件”工程的冲击，以及大众动画该如何从宫崎骏式的蒸汽朋克进化到vr、sns、自动驾驶的新语境。高畑充希的声音真是不错。,26773938,4,2017-03-19,johnvivi
313,整个80年代以来，在外国拍的片子讲的还是日本的事，就像开头提醒的一样。其实我想看北野武和宫泽理惠的那一条线。内田这条线挺扯淡的。,1438638,,2017-03-18,johnvivi
314,我还以为最后会扭一下呢，挺残忍的,1302680,3,2017-03-18,johnvivi
315,沿用的是机器猫式的时间模型，即改变过去正是过去的一部分。片中与日本小镇学校不搭的大钟正是对《回到未来》的致敬，而实验室助手的苦心解说像机器猫一样丁宁。要未来帮忙和直接活到现在，同样的设定凉宫也有。这种电影的成功点就是在设定严密的基础之上搞得有趣，再加一点爱情的佐料，这些都做得很好,1807495,5,2017-03-17,johnvivi
316,配乐挺棒的呀！,1305224,,2017-03-17,johnvivi
317,很美，有一种古典的味道,1845647,4,2017-03-16,johnvivi
318,初看以为大林宣彦了，其实还是相米式的死亡恋爱,1547092,,2017-03-15,johnvivi
319,粉红电影真是有钱啊，还能跑到意大利古镇去思考生存和死亡,3195917,,2017-03-15,johnvivi
320,角川为什么总在拍少女配大叔的故事？药师丸独立后，原田终于撑起了角川的大旗，而且借此早一步登上红白，泽井也带来了完成度更高的侦探物语。为不成熟而焦虑，恋大叔，希望拥有自己的身份，都是少女心的全面展现。最后听说殉情的一幕就像《大开眼戒》结尾一样。而结局更是直白道出恋爱不过是成长的过程,2222933,5,2017-03-15,johnvivi
321,失去了战争之后人的暴力欲望往何处发泄的问题。塚本还是一个非常先锋性的导演的，把电影当成作品（作业）来拍,1296357,4,2017-03-15,johnvivi
322,"""我心中离天堂最近的岛，和所有的岛屿都不一样。""——小小柏拉图。全片的管弦配乐啊，让我感觉在看什么美国默片或革命老片。原田知世的笑容倒真的挺适合当什么联合国慈善大使的。""这里就是在我心中离天堂最近的岛屿。""""我也找到了我的日本。我的日本就是你。""天堂回归尘世，完全打破了异域与殖民的解读",1548768,4,2017-03-15,johnvivi
323,和水手服一样的少女大叔恋，我认为是女性视角的爱情故事。水手服里是少女+机关枪的异色组合以及结尾的梦露指涉，这部片里则是多次面对成人与做爱这件事。药师丸博子的电影总是奇妙地打开了某种精神上的维度。数次不同的宾馆场景也别有意味，根岸吉太郎不愧是和相米慎二一样从粉红电影历练过来的导演。,1308671,4,2017-03-15,johnvivi
324,这就是朋克与赛博朋克交叉的地方。与邪恶地产商的暴力抗争是日后日本赛博朋克的主线。与美国程序员geek式的赛博朋克不同，日本的反抗主角总是和音乐工业绑在了一起lol,1460914,4,2017-03-14,johnvivi
325,粉红正剧,2054293,3,2017-03-14,johnvivi
326,我也是x到了追80年代肥皂剧的地步……可怜的原田，连续跟在药师丸博子的电影后面演电视剧版，你看就一直没有出头吧。电视剧版没有相米版的那种青春与忧郁，不过这种闹闹的轻喜剧风格或许其实更接近原作的感觉吧？来生也为电视剧版写了歌曲，虽然没有像药师丸那首梦的途中一样火起来，不过感觉同样婉转,26995758,3,2017-03-14,johnvivi
327,,26995754,,2017-03-14,johnvivi
328,妈呀看这种实验电影跟看水墨动画似的,3044936,,2017-03-14,johnvivi
329,挺好的，美,1401519,4,2017-03-14,johnvivi
330,。,1769418,,2017-03-14,johnvivi
331,中森明菜在舞台上熠熠生辉，但是沉稳的嗓音和少女角色还是有点违和。记录了竹笋族的影像，还有动物园、摩托车兜风等当时的流行消遣。那段时间可能导演们都对影像合成感到特别新鲜，很喜欢加半透明叠加的小鬼、鬼怪这样的设定。著名的合唱那段色彩不错，但是合唱还是有些莫名其妙……,26575065,4,2017-03-13,johnvivi
332,马场康夫泡沫三部曲第二弹。前作《带我去滑雪》的名字是改编美国歌曲《带我去看棒球》，这个《当她换上泳衣》则是恶趣味地改编自美国恐怖电影《当她被蜥蜴吃掉》（日本译名）……原田知世学男人那一段还是好！可！爱！,10793539,,2017-03-12,johnvivi
333,原田完全从水手服和机关枪和穿越时空的少女中的形象进化成都市女性了啊，美到不行。这也是原田独立事务所的第一部作品，无论从哪个方面来看都是出色的女性啊。偶像，代表泡沫时代的制作ホイチョイ・プロダクションズ、泡沫导演马场康夫，还有和器材、汽车、通讯、西洋化新音乐的联系之间有着各种意义,1295841,4,2017-03-12,johnvivi
334,在我国体制仿佛可以为集体主义背锅，但事实是规训与惩罚是所有现代化国家的必经之路，何况叙述这些故事的都是大院里的受益者。要拍儿童的世界不如看纪录片，要影射成人世界的政治又有点幼稚，段子分散又经常强行讽刺。恐怖片拍法+故宫满满的意识形态符号实在让人难受。一部调动情绪大过观察的片子。,1469441,3,2017-03-09,johnvivi
335,唉北京的都市感。时装片果然要换装片段是吧。跟葛优还挺有共鸣的，好奇他后来怎么样了。,1309235,5,2017-03-09,johnvivi
336,导演的性变态不是体现在强奸和禁室培欲上，而是体现在那种表面克制实际已经快要糊到你脸上的故作压抑（配音能离话筒再近一点么，章子怡喘气那段我觉得我的耳朵已经贴在车窗玻璃里面了）。从政治到神态到服装到方言，片中的一切都是fetish的对象，看着会想象这整个国家的电影院里的观众是不是都在发情。,24751763,2,2017-03-05,johnvivi
337,除了结局纯粹意淫之外是一部极佳的商业片。Lea Thompson好美,1300555,4,2017-03-03,johnvivi
338,青春、变化和忧郁，百无聊赖的尴尬笑点都完美。说下雨就下雨，说飞机就飞机。团地在当时还是先进的现代生活的代表，但小区闭路电视已经与广场和喇叭开始争夺媒体的优越性。从午夜到清晨，从堀切走到吾妻桥（经过还不是一坨金黄色的屎的朝日啤酒总部）再穿过隅田川，到浅草和破旧的雷门真是美极了。,1845757,5,2017-03-02,johnvivi
339,前半段很感动，我也是类似团地的地方长大的孩子，那种心理我全部都懂，并且感觉很怀念。这部电影虽然没有像一般的怀旧片一样沉浸在对过去的美化当中，但还是一味渲染失落和忧伤了。虽然片中有许多对团地变迁的事实交代和富有时代感的模拟，但情节上还是十分私人的，是爱的人而不是团地推动了男主的变化,10540077,4,2017-02-25,johnvivi
340,感觉这套路还蛮经典的……原版是芝加哥的意大利移民，今版是迈阿密的古巴移民，下一版是洛杉矶的墨西哥移民，你够了,1292065,4,2017-02-21,johnvivi
341,片子的叙述很清楚了，因为过去没能拍下吵架和流泪的场面，被由美香说是监督失格，所以拍发现死体的场面，拍最后的哭泣，我都倾向于理解为是对她的补偿。她比监督更加执着于记录自己的真实（特别是以AV这种尤为虚幻的影像为业）。同样也无需纠结平野最后的哭泣是真是演，哭泣本身就是一种需要人看的表演,6084465,5,2017-02-19,johnvivi
342,拍得挺好玩的，但意思还是太简单了，泄愤用的,6759556,3,2017-02-19,johnvivi
343,原版和原创动画是很不同的两个东西啊！原版小说，特别是这个电影，在将科幻推广到（非宅）一般读者/观众上有着无可比拟的意义，而且不光衍生了动画版，凉宫、你的名字都明显受到了影响。虽然一直为吾郎心怀怨念，不过也许喜欢梦中的帅哥本身就是少女心吧，片中的原田知世真是青春到了偶像电影的极致啊,1548767,5,2017-02-18,johnvivi
344,比Akira还早了一年，风格非常成熟。仍然无法理解女体化机器人的吸引力所在，不过无所谓吧。配音很出彩。最后一集的Nene很可爱,4827529,4,2017-02-18,johnvivi
345,机战+偶像，完全符合宅男口味，这个是不是就是那个年代的lovelive……听女神女神地叫了很久，却发现只不过是男人眼中梦中情人一般天真浪漫的小女孩，虽然美，但喜欢不来。停止斗争恢复秩序或许是那个年代的呼声吧，但是让一个放弃了女性身份的上司回到婚姻、回到“爱”，实在是太主流太反动的价值观了,1427266,4,2017-02-17,johnvivi
346,随着铁道公司作为地产公司进行郊区开发而入手的日本郊区梦，从根基里就埋藏着腐败与疯狂，因此注定要倒塌。疯完闹完打完终究要坐下来吃饭，似乎是对后学运年代的一个注脚。最后的露天居住很有诗意，这是一个积极的结尾吗,1416846,5,2017-02-16,johnvivi
347,苏联人在古巴发现了美国（高度资本主义社会），并被现代主义大楼、泳池、肉体、爵士乐深深吸引。将古巴的伤痛暴露在67年加拿大的世博会上引起了国内反感，但诗歌、摄影结合的表达方式符合古巴馆多媒体革命的精神。苟延残喘的俄罗斯先锋派形式主义果然还是被苏联摒弃了，然后在90年代被美国人捡了起来。,1432669,5,2017-02-15,johnvivi
348,挺喜欢这种狡黠的底层人，他也算是安保一代无政府主义者了，过着这种生活，除了多笑笑，还能怎么办呢,3672803,4,2017-02-14,johnvivi
349,很奇妙，并不是典型的地下反叛军推翻极权统治的故事，而是媒体的极权与野心的军队之外绝望的个人。虚拟偶像超前到结合人工智能自动创作hit词曲还会深度学习，全面象征了“文化工业”的概念。需要注意的是片中出现的麦当劳、IBM等品牌以及对涩谷驿、涩谷交叉路口的描绘都是真实的，这在赛博朋克中很少见,2160334,5,2017-02-10,johnvivi
350,小时候看过《大灰狼画报》改编版，少了最后的人生重来。影片提到了面对自己所恐惧的主题，但是除了猎人并没有对应在其他人物上，相反，整个“野生”的符号体系（动物、植被、水、流沙）对城市本身，特别是经过城镇衰落之后的小镇的重新侵入却意味深长。而猴子看电视，猴子抢电脑，猴子学骑车又极富隐喻,1294990,4,2017-02-04,johnvivi
351,还是熟悉的味道，细节和设定上也可圈可点，虽然革命的能量有点不足，但还是起鸡皮疙瘩了,11598831,4,2017-02-04,johnvivi
352,少女的精神世界？好微妙，感觉学到了很多东西，像机器人学习人类的爱一样。最后的爱是互相伤害，然后面对自己也面对对方，但愿当时学到了这一点。,2222981,4,2017-02-03,johnvivi
353,我觉得电影拍得比剧情好……当然看到有人说是改编的锅，好吧我信。,21324900,4,2017-02-02,johnvivi
354,幼教的身份，同时对已婚男性和成熟女性的憧憬，庆祝20岁成年，开房和初夜的话题，都透露出一个社会对于成熟的渴望。60年代的青年暴动被变装派对取代，人们心不在焉地娱乐。汽车联系起了大阪和冲绳，开辟了兜风和午夜兜风文化，沙滩、爵士、公路、汽车旅馆、度假酒店、city pop，80年代完美而空虚的梦。,1905849,3,2017-02-02,johnvivi
355,为了拯救濒临解散的黑帮，少女决定成为……真的很难解释这部作品为何会大卖，相米慎二的文艺风格与游戏性的实验性或许看来新鲜，但少女偶像与暴力、邪教、性倒错、性暗示等的组合，竟然能够征服大众，是该说当时的日本社会的确弥漫着一股截然不同的氛围呢，还是该说这部作品有一种无法复制的东西在呢。,1547089,5,2017-01-31,johnvivi
356,Ｂｅｇｉｎｎｉｎｇ　ｏｆ　ａｎ　Ａｅｓｔｈｅｔｉｃ。美学风格的原创性和对后世的深远影响令人咋舌。以为它经典是因为商业元素和设定而一直没看，结果是关于对人性与情感而非科技和未来的拷问，包含着浓重的情绪。严格来说我甚至不能认为这是一部科幻片，或者说，真正的科幻片本来就是关于人自己的。,1291839,5,2017-01-31,johnvivi
357,我真的不是来看《挪威的森林》的，是来看水原希子的mv的……但是人物全都拍得比预期以上还智障，受不了了。越南人为何那么爱大自然天人交感，直子为什么要卖萌，翠翠为什么时刻都像有相机在拍她一样面带职业微笑。挪威的森林本来就是个双关语冷笑话（真·ダジャレ），为什么真的搞出森林来,3168086,2,2017-01-30,johnvivi
358,《真实魔鬼游戏》里练手的MV拍摄技巧终于派上用场了。情色还是反的，但并非命题作文，只是借题发挥而已。背景是反安保，筒井是为了最后那一段台词才决意出演的：“这个国家的女人……品尝着屎一样的自由，你们是娼妇吗？”这么老了还在拍心里的愤怒和彷徨，还在找出口，骂国家，真正的朋克就是这样的。,26856907,4,2017-01-30,johnvivi
359,……我来投射一下自己的情感吧，从宫下公园到Tower，再到神南的小酒吧，穿过涩谷驿的立体交通桥，到稻荷桥的里巷，再返回繁华的涩谷交叉路口搞个大新闻（然后这就没了？）不过真的是感觉前几年的秋叶原boom已过，文化中心又回到涩谷了,26942592,,2017-01-28,johnvivi
360,给岩井拍过的摄影师啊……镜头好美，音乐也好美，故事也还挺美的。不知怎的，好久没有感觉到“美”过了（故事本身呢则是关于想象的投射与凝视的）,3068252,5,2017-01-28,johnvivi
361,这个片子里有很多种话语啊，商业的、工程师的、民间知识分子的、百姓的、青年学生的、官老爷的，武汉话、武汉话改口的普通话、标准普通话……我要鄙视一下那个满口“建构”“阉割恐惧”的女学生，这种就是学一种话忘一种的典型，特别是那个“陈词滥调”，妈呀。李文身上官僚气和艺术气的融合还是很妙的,26306897,4,2017-01-27,johnvivi
