,movie_comment,movie_id,movie_score,movie_time,user_id
894,呕!Dunst居然靠这片儿在戛纳称后？色和光被玩到极限，摄影跟后制美得冒泡。就是这情节气氛……姐好不容易被春天缓解的忧郁症几乎复发了！求治愈！求浪漫轻松真善美的喜剧片！奇幻跳跃真善美的动画片！啊啊啊啊啊！！！！,4086853,3,2012-03-30,petitespot
895,资料有误，手法一般，立场么……认同以暴制暴的青年世界警察。本片的社会意义大。阿拉伯之春，占领华尔街，多少改变历史的活动都是在脸书上接头的！网络时代交换信息，还有价值观。当世人的信息观念同步时，世界要朝哪个方向倾倒，再不是几个“伟人”决定的。本片的情报失真自有wiki指点google监督,10543699,3,2012-03-29,petitespot
896,,1306566,3,2012-03-29,petitespot
897,这部基片最大的优点是直接把男主角之一设定为太监，于是攻受这个基片里永恒的争议就立刻不存在了。其次这个太监角色找陈键锋出演，如此一来，尽管徐子珊依然丑得惊天动地，江若琳貌似路人，本片好歹也有马三保这张如花似玉(?)的脸给观众压压惊提提神。郑和下西洋其实目的是要用美男计掀倒众番邦,4751123,3,2012-03-28,petitespot
898,基本上，我不大在乎改编啊不忠于原著啊神马的。但是这部不行！！！,2978773,2,2012-03-28,petitespot
899,那个时候的Meg好美，HJ好帅。帅哥美女纯爱啊神马的，这种片最好了，你看过了，开心。然后不出一年就忘了，再看，还是开心。然后很快又忘了……心情差不想看新片的时候就拎出来开心一下。,1304485,5,2012-03-28,petitespot
900,TB后期作品里的很多执着都出现，只不过后来不拍B级片，就玩得没这么欢乐了。模型房子，绒布蛇，条纹西装，哥特少女，蒙床单吓人的鬼，僵尸新人，人鬼婚礼，阴间公务员，穿戴整齐的大人吃饭间突然集体跳怪舞。童年的幻想都在电影里实现了吧，TB！他们说不觉鬼可怕的人很可能曾在童年失去过爱人……,1293639,5,2012-03-27,petitespot
901,巨型火枪，能喷火的肌肉车，车名还叫medusa（头发是蛇，软趴趴的条状物，你懂的）。猛灌whisky，明显英语四级没过的对白，滤镜失焦脏镜头，露点爆头。自编自导自演的这位显然还处在荷尔蒙的火山口上。想反主流，用力过猛变成了为反对而反对的非主流。其实你是被女喷友劈腿之后拍了这片吧，亲,3213293,3,2012-03-26,petitespot
902,,3592853,4,2012-03-25,petitespot
903,看到Emmanuelle跟一个身壮如象，门牙缝里可以塞一打薯条，大板牙上都是烟渍的大婶搂在一起啃来啃去太特么挑战视网膜极限了！故事整个蛋疼得不行，主打就是两主角以各种方式啃。姐为女主角的少女时代，尤其是Clara Ponsot，还加了一星感情分。另，OST不错，但是跟情节配得太生硬好！ ,5281569,2,2012-03-23,petitespot
904,蒸汽朋克+OZ历险记神马的简直让人无法抗拒啊。,2136651,4,2012-03-22,petitespot
905,这片要是倒叙就好了。现在这结构前半部介绍人物出场就显得拖沓。这种类型的片儿不怕风格奇诡，越有型越有趣。后半部才出彩，其实故事还蛮别致的，可惜了。惊见Casey Affleck,2133293,3,2012-03-21,petitespot
906,看多几次之后，姐居然有点喜欢Max这个人物——嗯，人渣。在企鹅人意图绑架他儿子的时候，这个人渣果断要求以身相替（明知此去有死无生），且全无死不活哭哭啼啼的作派，极镇静（and邪恶地）说服了企鹅人，后者详述杀他的细节时也不惊不乍，还挺有魅力的（姐的M属性哥特魂暴发了灭？）,1294929,4,2012-03-19,petitespot
907,对于里面的演员都用古埃及语这点实在太PF了。CG和棚景都很精致。第四集那叫一个扑朔迷离峰回路转。体现了BBC严谨的娱乐精神（or娱乐的严谨态度？）,5232851,5,2012-03-17,petitespot
908,剧情的编排上存在灰常大的问题。流水账还编年体这是闹哪样啦！没有一个段子是讲到通透清楚的。不过那首comme d'habitude太挠神经末梢。Jérémie Renier和化妆师傅V5，可惜撞到这么个本子上……PS：JR的身条儿真素漂亮，瘦而不柴。特别是那个小翘臀！更难得他戴辣末粗的金链子居然也不显俗气,6877511,4,2012-03-15,petitespot
909,怀旧追念青春回忆初恋，年少的轻狂纯真懵懂神马的，本身是很萌很讨好的。但是电影么，也就是还好吧。最奇怪的是，居然都没有引发姐给加点感情分的冲动。不来电啊这是肿么了？姐已经太老了啊是不是。,4920528,3,2012-03-14,petitespot
910,,3065350,5,2012-03-13,petitespot
911,TB对C.Lee的感情大概跟Ed对Lugosi的执着是一样的，所以资料馆把这片排在《断头谷》下面。但是CL这只Dracula实在僵硬，最后那场戏简直笑死人了这么狼狈的吸血鬼！本片强在情色意味十足，在当年算擦边球打到尽了吧。情节的走位十分飘乎，任何一个阶段都可以做180度大回转毫无障碍啊！,1306163,3,2012-03-11,petitespot
912,,6731985,4,2012-03-10,petitespot
913,男女主角之间没火花啊。故事还算有趣——以十几年前的标准来说。放现在就得把女主角换个性别拍成基片才够意思了,1293554,3,2012-03-09,petitespot
914,,6041200,2,2012-03-06,petitespot
915,这么萌的题材居然被拍成这样不可原谅啊泥妹的！姐一毛时代气息都没闻到吖。你以为扛把吉它穿上租衣店搞来的旧衣服就能cosplay七零年代的glamour了！倒是暮光的面瘫妹倒饬倒饬没想到还挺有娘T范儿的。这才是你的戏路啊！,3072822,2,2012-03-06,petitespot
916,姐居然被这种套路温情狗血励志片感动得洒了两滴眼泪姐会随便说么。剧本非常吃力。表演太过用力。整体缺少一种化戾气为感悟的灵动，渐渐就透出说教的样子，面目可憎起来。OST大好,3078514,3,2012-03-06,petitespot
917,摄影美翻了。EO姑娘美惨了！修长的腿，丰实的身材，光滑的皮肤，湖绿的眸子，饱满的嘴唇，还有那一股不安定惊惶失措的气质……唉哟，姐觉得自己好像色老头。姑娘，答应我，永远永远永远不要去搅和那种“中产阶级生活多美好”的电影！,3750088,4,2012-03-06,petitespot
918,明线写马，暗线写人。英国的父子，德国的兄弟，法国的祖父女，都是一样的亲情，战壕两边的人都一样流血有泪害怕受伤。两匹马共度最艰难的时刻，从未离弃伙伴。人类却互相残杀。战火停歇后，我们只知道失去了什么，而最初刀兵相向的原因却早失落不见。PS：年度人兽基情大片！JW的配乐这次抢戏过头了,4206436,4,2012-03-06,petitespot
919,呃，虽然是冲着汤唯和北村大叔去看的。但是多出来的那一星是为韩宰锡加的。远钧哥好久不见，你肿么老在中国拍烂片。我朝比韩国好赚哈。姐的少女心被你给伤得一片片的嘹……啥都不说了唉。马导的人缘不错么，这片也就是明星脸好看,5256418,2,2012-03-05,petitespot
920,姐表示自己接不上地气。看不出个所以然来……,4873490,2,2012-03-05,petitespot
921,大喜剧片。还好跟EN那部关系不大。刘青云的角色是在向〈大军阀〉致敬么。小宝，电影到底是有多难拍啊，杀导演那出戏拍得解恨伐？中间再加多点民俗技项目会更有趣。有夺秘籍的桥段还有武术技，蛮适合出口的嘛,4913200,4,2012-03-04,petitespot
922,这部电影撩死了姐久违的厌世情绪（从值得褒奖的角度说的）。萝莉大叔之间的救赎之爱又很治愈，搞得姐要死不活（仍然是in good way）。个人风格非常强烈，影像形式非常自由，但信息传递得十分清晰。这很难得。姐真心觉得AB很帅的（好吧，我是马脸大叔爱好者），就是这长相注定演不了让人开心的电影,5322596,5,2012-03-03,petitespot
923,谁敢把一部肉香四溢结婚出轨的短片集式基情暗涌的电影最后实打实的拍成基片！法国人敢！哪个影帝会在一部无厘头下三滥喜剧里耍贱装呆露屁股蛋（and菊花）还一副乐此不疲的样子！花园叔会！你们真是够了你们！卖萌也要讲廉耻的吖！最后结局那一出姐旁边的姑娘生生笑破音了有木有……有彩蛋,6878468,5,2012-03-03,petitespot
924,这其实是部基片。RR的演技比JB（这缩写……）好，好很多。但JB长得比较可爱。还有姐生理上无法抗拒13这一型的，现实生活中遇到一个这样的就弯定了！-->本片的对姐的娱乐生活也就这点贡献了！你妹居然敢叫自己喜剧片？！,3927750,2,2012-02-29,petitespot
925,这个世界上的winner都是一样的win法，loser却各有各的lose法。姐不是女主角同一道上的loser。而且下意识抗拒女人——尤其是女卢瑟——被模式化。跟〈败犬女王〉的结局对比下，倒是台湾偶像剧的女主角要硬气。美国姐们儿一直用气声和假音讲话我头好痛。,3880545,3,2012-02-28,petitespot
926,一直攒着说到大荧幕上看。终于看到了！民俗武侠神马的太有爱了（姐以后要专门开一篇）。对白和人物的互动有趣。配乐对胡导你是多重要啊，动作都要踩鼓点是把这当成戏剧在拍么？没有满口仁义道德，也没闹什么儿女情长，清清爽爽潇潇洒洒打打杀杀，真江湖儿女,1459054,5,2012-02-26,petitespot
927,终于在大屏幕上看到这片了，还是粤语的！学友叔果然雪白粉嫩！许冠杰的令狐冲太潇洒，都已经跟原著木关系了。同风清扬遇袭，迎敌之前捏了一下叶童的脸，太泥妹有爱了，嗷嗷嗷。一叶孤舟，《沧海笑》响起的时候，姐那个眼泪婆娑，感慨万千啊。在座的老外，你们不会懂的,1297304,4,2012-02-26,petitespot
928,推荐这片儿的童鞋太有sense了，姐特么的好喜欢女主角！模仿达人啊！那个小表情小动作小口气都太传神了！这才是模仿的最高境界啊！男主妆太厚了看不清本来长神马样子，但是比嫩牛五方萌。台词各种吐槽,4901335,4,2012-02-20,petitespot
929,15年各种不要命地打拼，等到神马都有了，就失忆了，然后回头追着老公跑，当好妈妈，幸福的家庭失而复得。这有没有点太便当了？虽然“作”是法语片的特色，但这种作得都不在调上啊。两位主角好演技是没话说,6030610,3,2012-02-20,petitespot
930,故事倒是不错看，尤其父女之间的互动很有趣。问题就是——这种中产阶级价值观过于泛滥几乎要让人淹没的气味非常不投我的缘。对乔叔向来无感的，终于有个角色看得顺眼了。其实他蛮适合这种的型的。姐小金人预测的天平向乔叔倾斜了,3071509,4,2012-02-20,petitespot
931,叙事时间线太跳跃了。而且戏份控制得不是很好。感觉腐国男星凑一桌帮好基友Oldman拍贺岁片似的——人人出来露一脸，又都露得可有可无。最后我都在想这好像《同窗之爱》的续集哟西！因为戏份太散，奥叔的小金人悬。OST和打光倒是非常不错的,3338851,3,2012-02-20,petitespot
932,各种网络小说的烂梗大集合。目标市场明确——单身熟女。价值观清晰——穷鬼斗不过钞票，爱情友情都比不过奸情。所有男性角色都具有同一主要功能——卖肉。豆导自肥的附加效用——也给叔控一点甜头。这打分是看在众多明星脸情人节档和片尾曲的份上……,6730004,3,2012-02-16,petitespot
933,拿伊朗特殊的社会环境做噱头的三无小烂片。其实那个哥哥才充满了基味好不好。不过伊朗妹纸太正点了，那头发睫毛嘴唇饱满滴身材，看得姐春心荡漾——船戏你妹的不给力啊！！！外加给milk配音那段神来之笔，给多一星。,5385554,3,2012-02-13,petitespot
934,画面效果很特别。剧情直接搬《基督山伯爵》，除了把我最喜欢的角色变成一根筋的笨蛋受之外也没啥好说的。姐现在已经分不清究竟是片子本身就走断背路线，还是因为我属性腐所以看啥情都是基情……,1483203,5,2012-02-13,petitespot
935,虽然反对以意识形态为主导去评价一部电影，但是沙文主义+反人类+民族主义，实在是没法说了。张国师的偶像其实是戈培尔吧。拿这个比《辛德勒的名单》……这部电影的主要目的是煽动仇恨，根本两条道上的啊。本片的三观到底哪里“跟国际接轨”了，明明还停留在《地道战》时期，只是包装与世俱进了而已,3649049,2,2012-02-12,petitespot
936,看有些电影，效果简直跟心理治疗一样（而且要便宜得多）。每个人物的位置，情绪，反应都太spot on了。除了女主——演得太用力（长得好像closer的老甜甜）。扭曲的幽默感，姐特么每一声都是从胆里带着汁笑出来的。中间一度想哭来着，结局反而放下了。米勒同学特别适合这种黑色风格，小心戏路受限,5385556,5,2012-02-12,petitespot
937,全片都是一股手术室的味道。“逃离这个自己”应该是很多人都有过的想法，试图钻进某一种标准里去。美指和OST大加分,1432779,5,2012-02-10,petitespot
938,这个梗不是抄阿郎的么？！仔仔蓄须真的很像梁朝伟啊，OMG！（在地上翻滚，特么的我怎么能讲出这种话！！！）脸的轮廓真是越来越清楚，黄金年龄到了有木有。这只其实有好演员的潜质，可惜没有遇到国片的黄金年代。还有，他还欠个嘉玲阿姨……,6759229,3,2012-02-07,petitespot
939,莎氏对白念成这样我也服了你们了！加上那个布景，人和名字和事件都极诡异地对不上号。闹腾。也就是看看明星脸的趣味了,1296894,3,2012-02-07,petitespot
940,本片要说成功，主要是源自于漫画原作的力量。保存原作风貌自是好的，但电影导演的作为太少，让它更像是漫画集联展。完全抛弃动画技术的特色与优势不是明智的，甚至不能说是正确的选择。毕竟，电影如果不能吸引漫画读者以外的观众，其存在的意义过于微渺。,5919108,3,2012-02-06,petitespot
941,题材特别。没朴导那种神经质，更女性视角。光用得很特别。金基德是好老师。,4826419,5,2012-01-30,petitespot
942,姐只能说……我醒着看完了全片！！！,3285632,3,2012-01-30,petitespot
943,这个世界是基友的，也是腐女的，但是归根结底是钙导的！基情满塞，欢乐度破表。画面调度一流。福华法德瑞三国蜜月枪战套餐游附送姆斯特朗回旋加速喷气式阿姆斯特朗炮一百发，原装龙纹身女孩一枚，还有王尔德波西重逢破廉耻惊喜小纪念品可依口味自行领取。PS：OST拇指。don giovanni神搭配！,4051753,5,2012-01-27,petitespot
944,这片儿的idea不是抄希胖子的灭？抄希胖子还能抄成这样！！！杀必死得太你妹低俗了，没法看啊！而且那个ost是神马东西哟！！！,1307852,1,2012-01-26,petitespot
945,这片儿就像姐远行的背包——想说的东西乱七八糟的塞太满又欠条理。不过总体上有种奇特的幽默感。这种不经意间说出来的冷笑话最可爱了。老头子布道那一场戏用长镜一镜到底才叫妙呢。Smith还是缺点guts,3010394,4,2012-01-24,petitespot
946,,4206357,3,2012-01-23,petitespot
947,,5262338,5,2012-01-22,petitespot
948,卖萌卖腐到这种破廉耻的程度，终于引起姐的逆反心理了……你再怎么的同人OOC，还cosplay馒头叔的冷读术，姓福还是姓腐那根底线要守牢啊——你的身份是侦探啊，亲！！！第一季尤自可，第二季BBC开始不淡定了。这闹得比隔壁小萝卜版都离谱了。姐虽腐女，好歹幼读福尔摩斯正传，泥玛现在满脸是血啊！,6522269,3,2012-01-19,petitespot
949,献给所有爱无能的人们。再怎么被内战所苦，再怎么辛苦工作，她们仍然大笑，祈祷，充满活力，热爱生活。心理亚健康患者羡慕不已。Fabrice是法国电影里浪漫婚外恋的大叔首选，因他长着一张无攻击性的脸。,5937920,4,2012-01-18,petitespot
950,一个失智上父的意外引发的人性真实与宗教伦理间的诀别，而未来的选择，仍然是未知数。这片也只有伊朗拍才给力，在晃动的古兰经下，在森严的教条中，为了生活，为了生存，为了求全，一个个谎言以誓言的方式说出。从中调解的Simin反而像是异客。再是不舍也只得离开,5964718,5,2012-01-17,petitespot
951,Molly是挣扎在成人游戏中的最后一点纯真。政治游戏的最大筹码往往是政客的一点小错误，无关政见无，何其讽刺。GC拍出来的片总有很强的造作感，放在这片里还挺合适的。Stev和Morris的谈判故意做出西部片的感嚼，私人大爱，看完这段姐都有点迷上高司令了,3089571,4,2012-01-16,petitespot
952,SDF的日常生活。虽然生活重压虽然前无希望，还是死撑。不乞怜不自贱。见前夫前还要打扮清爽说“我很好”。喝醉了坐在街边哭，哭完了抹抹眼泪还有明天。年届五十的女主在山顶跳舞的场景有种气魄在。,6843223,4,2012-01-16,petitespot
953,这说片不腐的都去切腹啊！明明就是年度最佳基片之选啊！颠覆了姐“受受不亲”的人生观啊！影院里时不时发出淫笑啊！真正的“执子之手与子偕老”啊！好浪漫的好不好！情人节档有木有！腐佛的同人一定满天飞啊！东木爷爷GJ！正经观感过两天po,4709671,5,2012-01-16,petitespot
954,之前三次看这片，都在第一个镜头没结束前放弃了。这次情绪稳定+百无聊赖总算看完了。这种电影与其说是在看故事，乐趣其实全在琢磨导演下一记要怎么安排视角机位才能既把故事说清又不使用剪辑。如果当摄影集看也不错，光雾影都算计得门儿精。这种摆拍型电影考验导演的全局观和技术也考验观众的耐性,1917205,4,2012-01-15,petitespot
955,,3097445,5,2012-01-14,petitespot
956,温柔，感性，精致，幽默。首映结束后几乎全场观众都坐到字幕滚尽，鼓掌三次，才纷纷散去。本年度法语片的票房定注有一个鼓舞的开始。,7054838,5,2012-01-11,petitespot
957,情节展开太慢，镜头太逼仄，但是忍过前二十分钟便渐入佳境。也只有法国人会把这种涉及抢劫杀人政治阴谋的重口味拍成自然主义风格和现实主义色彩的社会家庭片。好莱坞下一个remake的好选择。Yvan Attal本人亦充满了颓气，果然是各种神经病和醉鬼的最佳选择,6006575,4,2012-01-10,petitespot
958,故事流畅，人物鲜活，色彩明丽，还有一段不为外人道的历史（至少我不知道）。那个巧克力蛋糕的故事太……恶心了！！！,3792848,5,2012-01-09,petitespot
959,乡下的暑假。水塘里的生物。带放大镜的男孩和穿红裙的女孩的错过。小动物和配乐都很有趣，画面也美，逝去的情怀也有。但既然不是《点虫虫》这种纪录片而插入了外来者——人——与自然的互动，节奏还是要控制。连我都忍不住睡着了十分钟……让观众犯睏总归不好,10679471,3,2012-01-09,petitespot
960,《出埃及记》和这片儿都是《火车怪客》的“合作杀人”展开版，前者蛋疼文艺片，后者惊险火爆片。剧本很流畅。最后一个包袱抖得甚给力。NC叔终于接了个正常的片（怎么背景又是在新奥尔良？）不过近几年NC叔的气质败坏得紧，怎么演也不像教英文的老师……PS：头发是植的？,3033030,4,2012-01-09,petitespot
961,典型的法国喜剧片。其实设定挺有趣的，但剧本不给力。女儿和爸爸二号缺少互动，最后婚礼的煽情点就起不来，高潮没有了……女主角太弱。男主角的美式法语我就没怎么听明白（幸好他台词不多）两位老戏骨还是很给力的。PS：出片头前在英国的那几场戏倒是极漂亮,6973391,3,2012-01-09,petitespot
962,把各位“最接近上帝”的人物放到一个封闭的环境下，以医生这个“圈外人”的POV和准教皇这个出逃的“圈内人”的POV，两个角度形成更立体更真实的形象。其实圈内和圈外的人并没有什么大不同。“侍奉上帝”毕竟也只是一门职业而已。最深的恐惧仍然源于自身。NM的节奏惯有先紧后松的问题，画面倒一直漂亮,3804683,4,2012-01-06,petitespot
963,脑残武侠粉好不容易看到部返古武侠片泪流满面。陈坤的化妆犀利，大眼皮子不见了。只这国语台词不是中国人写的吧，“当场处决”不就等于“就地正法”灭，还repeat一下，orz！武打上欠了点，元师傅不来塞啊。另外CG看得人头晕。老怪，安心的好好炒冷饭，你也轻松观众也乐胃，就别瞎折腾了,4896304,4,2012-01-06,petitespot
964,姐分了三次才看完的动画片。故事倒挺美，还有基情在燃烧。问题是这猫设，节奏和色调真是没法说了。就非得这么着才能显出自个儿文艺么！童趣一点会死是不是！估计如果看穹幕美感度还能加一两星。,1947288,3,2012-01-06,petitespot
965,bienvenue chez la merde.投资需小心，泡妞需谨慎。Guillaume Carnet演一银链汉子还是掩不住文弱感。蒙特利尔人的法语实在令人崩溃——圣诞集市姐跟两魁北克妹子买枫糖和枫叶茶，整个感觉鸡同鸭讲……客串的东亚妹子倒是没这恐怖口音。住男主隔壁的黑姐本尊身材好到炸，黑得发亮，好看。,6753118,4,2012-01-04,petitespot
966,,2010972,4,2012-01-03,petitespot
967,"I thought The Skin I Live In was freaky, but I really liked it. I also saw a very interesting film called Shame. That one was freaky too!（这话不是我说的）But这部电影是开年freaky之选——前提是咱对freaky的定义相同。长篇在路上……",3731626,5,2012-01-02,petitespot
968,,3727603,4,2012-01-01,petitespot
969,,6097776,3,2011-12-31,petitespot
970,神作不解释。acfun上的弹幕看得人笑倒……话说这是11区人民在nico上看到之后觉得有必要和天朝来的同龄人分享下所以才召唤姐去看的。哪个不要脸的搬去nico的！11区人民且表示“天朝这种同人动画拍得不少，也挺好的，乐趣很多，还怀旧，可以保持下去哟”。保持你妹！幸亏姐特么不是看这种动画长大的！,4236844,1,2011-12-30,petitespot
971,超高智商反派处处先机，世界灭亡核爆危机，世界第一高楼观光攀爬，克林姆林宫爆炸奇景，新奇高尖科技搞怪应用，首创沙尘暴里追车，当然少不和帅哥美女，香车party，肉搏械斗，团队精神，千钧一发，最后一秒，Happy Ending。对一部谍战片，我们还能有什么多余的要求吗？,3068206,4,2011-12-30,petitespot
972,Brokeback Mouton。最后的西部。从剪羊毛，给羊接生喂奶这些琐事，到领着几千只羊跨越山脉。牛仔的纪录片。在山上那段狂飙脏话和打电话向妈妈哭诉“我的狗也不肯走，我的膝盖又痛，我还要看着老头”的场景是神来之笔啊。,4231738,4,2011-12-30,petitespot
973,,4221515,4,2011-12-30,petitespot
974,,2028677,4,2011-12-29,petitespot
975,巴黎上映修复版ing。杨导的电影好，在于他不爱人类，杀便杀了。主红绿色调一样是冷。本片的台词……充满了译文小说的气味，格格不入。在大屏幕上看到金士杰和李立群未秃的时代也蛮值的。当时的台湾演员都瘦到没有肩膀，唯独小飞女骨肉丰停。蔡琴姐的歌声才最伤感啊。PS：果然美女有胡子当时是潮流！,1305261,4,2011-12-27,petitespot
976,人性中的自私、冲动，难以承担的负罪感，把此一主题放在极地的背景下是很有趣的设定。剧情顺畅，可惜人物心理刻画不足，最后问题的解决就一拳击不上劲道。纽因特人的生活环境和文化风俗倒是更有吸引力的卖点。,5151324,3,2011-12-26,petitespot
977,在午间吃饭的时候看这段纪录片泥玛真是惊天地泣鬼神的经历！！！开篇虽说是“中世纪”但主要在13s后，中国正是元-明的市民文化高度兴盛状态，同时期的英国人民基本上生活在粪堆里！难怪黑死病泛滥！这个城市规划是怎么形成的吖！怪道欧洲出了这么些关于个人及城市卫生的历史资料。实在不能忍！,6222445,5,2011-12-26,petitespot
978,曾经把春花那个位置留给我的同学们，抱歉让你们失望了。不过到现在为止，还可以算是自己人生的主角吧。韩剧的恶俗桥段与两女主角的重逢接踵，少女斗殴与学生冲突同时，成年的娜美与刚失恋的自己相遇。剪辑很有小巧思。用女性的角度回顾韩国的敏感时代也别有趣味。姜索拉很有范儿。,4917726,4,2011-12-16,petitespot
979,咳，片子的idea不错，拍得一蹋拉糊涂。理论上是“很差”，但是作为资深外协会员，有义务有责任以加星鼓励男女明星们练肉+卖肉。其实小狼底迪你再多脱几件或者多脱几次或者脱了之后多湿身多抹油之类的，姐可以给你加到三星的（灰常认真的脸）！多好的身材啊！本片最大的看点！,4308001,2,2011-12-15,petitespot
