,movie_comment,movie_id,movie_score,movie_time,user_id
0,对，我为伟叔看的，我伟叔又演烂片伤大家眼了。完全忘了上部什么剧情。私以为甩开上部男女主，另开故事线为好。不然动机和人物关系完全受制约，故事压根没法讲。全程四川话的春哥算是惊喜吧。就是造型做得不大能认出她来。,26575103,1,2018-04-15,petitespot
1,一人穆斯林拍的以虔诚印度教徒（演员还是穆斯林）为男主的片子。除了对“节奏”这个词没有概念的印度电影人通病（最后走过边境线那段升格画面简直没完没了！），其他无论是讲故事立人物还是拔主题都没话说。歌舞插入得一点都不尬，场面和手法都可以甩开好莱坞了。,26393561,4,2018-04-15,petitespot
2,热衷蓐钱的王胖子只要认真，就能拍高规格的商业片。他对观众和自己都有很清楚的认知，手段和技法都是用老的，略花点心思雕琢即可。瘦死的骆驼比马大，所以就更显得这人可恨，华语电影可怜。,26425068,4,2018-04-15,petitespot
3,,27663984,5,2018-04-12,petitespot
4,《头号玩家》观光团。艾德·伍德的脑洞长在了一个执行力高的导演身上＝本片。既羞耻又好笑，既好笑又羞耻。女主好腿！,1301795,4,2018-04-05,petitespot
5,看！得！太！开！心！！了！！！,4920389,5,2018-04-03,petitespot
6,与其说电影，更像军事记录+军教科普+征兵广告。把蛟龙的所有业务项目拍了个透彻，全程啪啪啪高能。情节紧凑，场面更是没得话说。可惜剪辑有很大的问题。械斗之外的戏剧冲突差，女记者这条线假，海清演技也没上线过。沙尘暴处就该ending，黄饼应该扣下悬念拍续集的嘛。,26861685,5,2018-04-01,petitespot
7,歌舞插入最无违和感的正经电影，喊麦最好听的大龄中二男。老毛子骨子里还是很浪漫的，又浪又漫。剧情像是一部20集肥皂剧的压缩精华版。跟花滑的关系不是很大，主要是爱情。但是爱情来去得也都很突然。说故事的能力不来塞。然，最后的大合唱太加分了。女主好甜。,27196380,3,2018-04-01,petitespot
8,波顿中年危机之后，我体内的中二生就靠陀螺续命了。针不针砭时弊的，小人鱼+美女与野兽的童话原来我还是很受落的。居然给看哭了这么丢脸我会到处乱说么。霍金斯真的纵向穿越年龄横向穿越次壁，美得很诡异了。跟鱼人天生一对。,26752852,5,2018-03-29,petitespot
9,结尾两人车上对话处，大家一齐拍手“这才应该是最佳剧本”。每个人物都立起来了，还都有合情顺理的发展曲线。这个世上大多数的人都既不算圣也不大坏，却总有冲突，大家都活得很愤怒，有起由有揭示有解决……吧。我特别喜欢这种把小人物小事情小琐碎拍到妥帖的。,26611804,5,2018-03-27,petitespot
10,这世上最大也最破解不开的悬疑，是人与人的关系及亲密者之间的谎言。道理我都懂，但这个剧情是什！么！鬼！警察挖出[-哔-]的时候我笑场了三分钟。这个锅也不知道要谁来背，反正岛田庄司应该不背的。原著不可能是这种分明弱智却自视高明的情节吧。,26677981,2,2018-03-27,petitespot
11,对比我于第一部的观后，三件事情切实搞上去了：动机合理，场面砸钱，格局提高。片子就变好看了嘛。朋友一直拿它跟《红海行动》比，我说自己看这片儿是抱着看《杀破狼》一路的心情。虽然中间偶尔笑场“这个真的科学？”，但啪啪啪的打片拍到这个份上还有什么好说的？哦，塘主这个角色有点尬。,26363254,4,2018-03-27,petitespot
12,晚上的戏都暗成一团，白天的场面也是画质感人。但不知不觉就看完了。一忽感慨沈从文果真能活写出少女心态，一忽聊起湘西这个地方很神奇了。结尾处大家都很惆怅。小伙伴一语总结“撸完这片儿，心情十分潮湿”,1305978,4,2018-03-27,petitespot
13,夕阳那幕想到《狮子王》的请晃动你们的双手。抱着“看超能力”的中二心情入场，所以打架的戏就……即使出动犀牛了，场面也不算很壮观。非洲的美景、文化与音乐跟漫威世界观的“高科技”还是结合得过于生硬了。朋友两个疑问：1.有了他钢铁侠是不是不用混了？2.全片最厉害的难道的不是男主的妹妹？,6390825,3,2018-03-27,petitespot
14,冗杂，造作。小朋友翻起白眼来，很适合去演恐怖片。,26654146,1,2018-03-19,petitespot
15,,27185291,2,2018-03-18,petitespot
16,最近在补这个片子。友曰“湖南台最后的良心剧”。全程输出真人弹幕。,2210001,5,2018-03-17,petitespot
17,没有主线剧情。没有主要冲突。就是烂梗的反刍。小伙伴看到三头六臂的红孩儿几乎笑昏。纷纷表示不能接受这个片子是老怪跟星爷出品。各位导演们最近债务都很重吧，应该。“我是蜘蛛啊”“你确实是只猪啊”,25801066,1,2018-03-17,petitespot
18,看演员阵容就知道不会是个正经剧情，情节什么的我一开始就是放弃的。做好了看动作喜剧片的准备。何润东一整部电影就没落着几次穿囫囵衣服。说是卖肉的担当吧也太甩卖了，我都吃不动了。动作戏很多，但是动作戏的剪辑都很乱来。小伙伴最后表示“别关！让我看清楚字幕，以后要避开这些人”。,26745334,2,2018-03-09,petitespot
19,说是科幻，主要的内容是聊天。又是看到一半猜到结局系列。但是男主设定是码农，所以最后做这种选择实在太生硬了，反正我是理解不了。文艺作者们对搞科技的人迷思太大了。小伙伴一旁想不通“为什么有人造AI不用机器人三定律”。我也只有翻翻白眼。而且机器人还遮什么性征，造型设计也低俗趣味了些。,4160540,3,2018-03-09,petitespot
20,我一直说这个世界上最可怕的是人。一个恐怖片能把人拍得恐怖才是真的恐怖。这个片儿就是人恐怖……还好笑。每句话看着都没什么，但听起来哪儿哪儿膈应。顺带讽刺了一把“住在黑人身体里的白人”。那些有白人女朋友的黑人的观后感很值得采访一下。,26688480,4,2018-03-09,petitespot
21,这片子正经拍90分钟就解决战斗了。看的一路在吐槽“剧情完全没有发展”，“内景搭得也太随便了”，“表演可真够脸谱化的”，“这个动机不能自圆其说什么鬼”，“虽然按戏剧发展应该这样，但这真的符合人性？”，“阿米尔汗应该就是想赚点快钱吧”,26942674,2,2018-03-08,petitespot
22,补档。从国王演讲到敦刻尔克然后丘吉尔也来了，这个题材总算是没得再拍了。演的真好，没话说。但是剧本太中规中矩的命题作文了，特别是最后从地铁到国会的一节，可以说是编排得十分刻意和造作了。镜头也是有点疲。,26761416,4,2018-03-07,petitespot
23,剧情只能说“非常阔怕”了。那种我就算再年轻二十岁也会觉得非常非常非常阔怕的情节OMG。土屋太凤的颜get无能。不是很懂现在的霓虹人民。然而，我居！然！看！完！了！最近荷尔蒙失调吧，大概。,26989728,3,2018-03-06,petitespot
24,母上那辈人有别的感触。但我来看，那些泳装，那些舞蹈场面，是导演中年危机的外放表现。“可惜自己”与“可惜别人”，在处理一些细节上的取舍就完全两样了。,26862829,3,2018-03-05,petitespot
25,,26827040,1,2018-03-05,petitespot
26,,27199901,4,2018-02-26,petitespot
27,昨天看完2回头想到把1也补了。看完1觉得我给2三星实在对国产片太过宽容了。大概在国内住久了自然会生出这样的毛病。以剧情的顺畅度推理的流畅性反转的合理性，各方面来说，2是退步了一大截的。自己跟自己比，退步了扣星没毛病。,26311973,3,2018-02-21,petitespot
28,春节档没太大的选择。母上要看喜剧，于是就看了这部。母上结论：1.刘昊然女装比男装好看。2.都是燥事体。3.全是燥笑话。笑点庸俗，人物神经，细节不能推敲，故事整体没大意思。但作为国产商业喜剧片，这个完成度感人。彩蛋导演与夫人出来尬秀是扣分项。,26698897,2,2018-02-20,petitespot
29,早对霸道总裁玛丽苏这一套免疫了。幼稚的职场，老梗的豪门也是意料中的。第一集的剪辑白眼翻上天。但这剧的服饰道良心，本土偶像剧终于不止“土”而且“豪”了。专注职场性骚扰100年的男主各种错误示范，让人分分钟想pia死在墙上。然而……谜之好笑。假期里当喜剧片快进着看还是不错的。,26727942,1,2018-02-19,petitespot
30,后浪打折那阵捞了本《看不见的剪辑》，于是近期老片回顾ING。这部是属于“很有名但我看不出大好”来的那种。特别是年轻时候，连笑料也没get到过。要过了主人公那个年纪，编导剪对那种空虚烦躁急欲找个目标——哪怕盲目，去寄托这一股无聊的心理捕捉得太准了。,1292271,4,2018-02-17,petitespot
31,跟着剪辑书把这片重新撸了一遍。虽然是室内戏，但是镜头真讲究。陪审团担当了检控和律师的角色将案情重组。因他们是程序正义的最后一关，在对证物与证言的诘问中引出良心与道义，偏见与公正，个人与社会的辩论。观众也是一步步地被说服，剧情编置得极为出色。,1293182,5,2018-02-16,petitespot
32,前两天看了太多小学生作文式的“悬疑犯罪”，撸到这部真是精神为之一振。反转不稀奇，难得是每个反转都掐在点上。在一个没有好人的世界里，只剩恶的方式不同罢了。最后的冷笑话老梗神来，配上剪辑，让人后颈子嗖嗖发凉。庄凯勋这外形这演技大屏幕很可以啊。,11600078,5,2018-02-14,petitespot
33,会有那么几刻以为自己在看银河的片子，然后在下一刻省悟过来“还是邱礼涛啊”。女主角的戏可以删，吴卓羲的戏可以删。姜武在政府楼前放炸弹的动机不明也不足，生硬了。小警察父子铺垫了那么久警察的身份然并卵。一大巴的游客也并没有利用起来。结局要大场面是肯定的，但居然真的没有半秒反转……,26748673,3,2018-02-13,petitespot
34,故事和景都相当好。就是剪辑有些失败，红霞回忆身世的片段把节奏拖下来，导致观众的注意力在两个主角感情正积累待发的当口懈怠了。郎月婷跟周围环境有点格格不入，就不晓得是否故意为之。但是韩冲比她更有戏，特别后段她成了韩冲人物成长的陪衬，从道理上讲这是不应该的。,26106958,4,2018-02-13,petitespot
35,又一个误会自己是日本推理小说家的编剧。从张家辉和任达华在街上一起看新闻开始，我就把后面的剧情全猜中了（在此向被我剧透的说对不起，我也没料到能全中）。都不是靠推理功夫猜中的，只不过烂小说曾读过不少，这种套路没看过一百也有八十。这种套路绝对不能在开头放王敏德的戏啊，我去！,6738735,2,2018-02-13,petitespot
36,朋友：这个电影怎么能过审的？我：过审不难啊，广ｘ局又不审查“蠢”，神奇的是它居然能找到人投资！还能找到明星来演！！从第一分钟开始就令人不禁吐槽“什么鬼”，一直吐到二十分钟开始快进，一边快进一边暴笑一边叨叨“这都是什么鬼”。真是一部神奇的电影。,25849599,1,2018-02-13,petitespot
37,这种低龄化实在接受无能。觉得自己看了一部假的多啦A梦。精神受到了摧残。,26839466,2,2018-02-09,petitespot
38,最新一期找来两个教导官假装牢友，把几个明星吓得……一个个反应都太真实了，笑到抽筋。给设计的都是普通人日常因无知甚至善良而触犯到的法律，模拟庭程序完整，证据链细节完美，都是很好的普法教育。因为本身设定太有意思，参加的明星反倒是越没综艺感越单纯老实的越好玩。,27602100,5,2018-02-07,petitespot
39,一部每个转折都被我猜中的“悬疑片”。一部破案全靠男主记忆重现的“犯罪片”。换则言之，推理的存在感为零。布景颜色和打光都十分奇怪，又是为了自以为的漂亮而牺牲真实感与细节性。嗯，我说了“又”么？,25884801,2,2018-02-05,petitespot
40,片子走到一半，我同朋友还是不解“周迅和隋棠为什么要抢黄晓明？”这人既不上进也不有趣吃着碗里想着锅里。周迅事业有为隋棠貌美长腿，都是有哪里想不开？最后总结：男人也可以有公主梦也应该有他们的玛丽苏电影。彭浩翔的幽默感每看一部就觉得更低级一点。最后，是真的只有男导演才会这样拍晓明……,4881607,2,2018-02-05,petitespot
41,,6874741,3,2018-01-28,petitespot
42,撸了一集。除了文案臭长，“竞演”这种撕逼潜台词割舍不去，赞助商logo又大又丑挡字幕不能忍之外，声控们还是有福可享的。就是说好的部分不多，但好在了点子上——人挑得好，声音好，演技好，态度也好。我可以期待王志文老师参加（然后当场发飙）吗？可以吗？可以吗吗吗吗？,27617683,3,2018-01-09,petitespot
43,没有什么是一场光剑决斗解决不了的。不行就来两场。还不行就来场全息投影的。反转各种“孤胆英雄读秒拯救”的桥段算是好玩的部分。本索罗俨然编剧发言人“快忘掉前面六部吧！你们这些固执的老影迷怎么不去死一死！！”加一星因我在斗CP的赌局上全面胜出。PS：本和蕾伊真的不是我教授和Lily的星际同人？,22265634,4,2018-01-08,petitespot
44,前段时间宣传做很大，小伙伴表示想看，我说一闻这介绍就不行啊。后来他看了半集，反馈“拍得瓜”。我无聊时16x快进了20多集，确实瓜。细跟冗是两回事。多线长线对电视剧的每集一高潮剧末留悬念本是好的，但镜头和音乐用不到，那就成了琐碎和唠叨。牧云笙这个人物太失败了。,26322999,2,2018-01-01,petitespot
45,选角和表演扣分。造景跟服饰算是有苦劳，很努力看得出来。摄影可以加上点分，还是被剧情扣回去了。探案解谜在自身体系内是可圆的，情节重头放在这部分为佳。可惜前半部沉迷卖弄建筑装饰，懒于人物与细节，动机不足，致使谜底揭开时非但毫不感人，还透出一股浓郁的玛丽苏网文气息。同事称古装《小时代》,5350027,3,2017-12-27,petitespot
46,,25837262,4,2017-12-26,petitespot
47,挑的例子够典型，可见花了巨大的时间和精力取原始素材。剪辑的手法也好，把孕产医护拍出了故事性。全程不置入观点（片尾什么情况？）不进行评述，冷静而克制。李主任小天使。PS：前几天才听了一个女方拒生二胎而离婚的故事。同事言“何苦在垃圾堆里找老公”。我问“你指给我周遭哪里不是垃圾堆？”,26836588,5,2017-12-25,petitespot
48,,26698000,1,2017-12-24,petitespot
49,大家都想要那个锦鲤背包（真的没有周边吧）。动画还是2D的好啊，线条色块想象力，才是动画片独到的优势嘛。所有人之间都是有联系的，但这种联系是微妙的错落的需要努力才能落实的，不然一切都只是“真巧”。拼酒，书市，校园祭，感冒，最终男女主联系到了一起。,26935251,5,2017-12-18,petitespot
50,各种拍的细节还是讲究的，小伙伴的话就是“导演真的学过”。但剧情太拖。最后的大作弊各种掉链子起矛盾过于drama失去了“真事改编”的可信性。前期的铺垫，身为一个从小帮人作弊从未被抓包的小能手，又觉得大而无当，并显不出厉害来。主角们近素颜上阵值得表扬，但是女主这身架子出戏。,27024903,3,2017-12-08,petitespot
51,前面查案的部分还行，剧情走到沈炼又（？）为了一个不爱他（！）的女人作死的部分就蹋了。所有人的动机全莫名其妙。结局大乱斗没有高潮感。编剧和卡司导演对张震的恶意重，对女性的恶意更甚，不然没法解释第一部用蜡像第二部用充气娃娃出演对剧情的唯一作用总是“添乱”的女主角。,26270502,3,2017-12-06,petitespot
52,跳过任意一段剧情都对后续毫无影响。有些中二是燃有些只是杀马特，有些爱情是浪漫有些只是鸡皮疙瘩。收回之前对彭于晏的所有表扬，这场周星驰的模仿秀我给零分。余文乐是占了面瘫人设的便宜。天尊的颜既是正义。特效做得不错可惜审美硬伤没得救。,26035290,1,2017-12-05,petitespot
53,一小孩一老头在奇异的世界携手并行最终成为家人，熟悉的配方，就是置景，想像力和欢乐性都比《飞屋环游记》差了一个皮克斯。音乐和歌舞场面则差了一个迪斯尼。在万圣节和感恩节之间恰到好处地消费了一把墨西哥亡灵节和弗里达。对，我就是那个全程一毛都没感动到的没血没泪的家伙。,20495023,3,2017-12-04,petitespot
54,你们都知道多一颗星是归谁的就行了。马修回收一个便当之后……任性发了一卡车加鸡腿的。动作部分还是好看的。其他的什么boss的审美什么肯德基或者啃塔基什么总统的三观，都是浮云。,26378579,4,2017-11-29,petitespot
55,低级，但是好笑。好笑，但是低级。上世纪港产贺岁片的即视感。那个时候的港产贺岁片还是比较良心的喜剧片，然而从上世纪到现在仍旧这个套路学下来用起来都没半毛钱进步和创新，都高级不起来的话，就有点尴尬了……更尴尬的是，丫居然在同档期的国产片中还算最好看的那个！,27038183,3,2017-11-29,petitespot
56,本来是要去看《追捕》的，被打分吓跑了。结果也就是逃出半条命吧。前半部寻找小伙伴的过程无聊到睡一觉都毫无影响。水里的打戏只有极短的一点，所以鱼人除了露肌肉之外唯一的存在感就是逗逼。超人复活干翻一切，全程无悬念不吃鸡。想卖点基都没有火花。PS：这个剧组的盒饭是什么牌的饲料？,2158490,2,2017-11-29,petitespot
57,停电那场戏想得妙拍得好。张超挺来塞的，节奏卡得好，小伙有前途。文本里有些地方没交待清楚，人物也夹塞得多了些，失了小而精的轻盈讽刺，但以人物分三篇结构分明，靠剧情把人设都立起来了，荒诞的滑稽也拾点得恰到好处，完成度美好。,26657126,4,2017-11-24,petitespot
58,,27039382,2,2017-11-24,petitespot
59,谁都不得罪，谁也没讨好。该脸谱化的照样脸谱化。说荒诞吧，也没做到绝。就饭吃都嫌无聊。要没二胎那出，我还敬李雪莲是条天生沷货有性格。最后那场戏把她的告状往人情上一找补就特别没劲，还怂，还鸡贼。可是在华语片里一令，冯导还真不能往差等生里划拉。于是就更叫人讨厌了。,26630781,3,2017-10-23,petitespot
60,彭于晏和崔始源的身材说是运动员还说得过去，另外两位的大腿一看就不是骑车的。还是恋爱疼痛成长那一套，此类型的抓马都跟快餐店的汉堡似的，热热能上。不至于难看，但活生生拍出126分钟就惨无人道了。而且显得单车运动既危险又没意思。也就前半个钟头的赛车戏好看，后面全都是没事找事。,25853727,2,2017-10-23,petitespot
61,看了半个钟头还在想“刘德华在哪儿呢”。我小时肯定爱看这片儿。现在不行了。女人的拿出不值钱，小弟的命不值钱，只有佬大要紧。佬大都是有躁狂症。里面中枪都是截瘫也是神。最有彩的角色是友情出演的黎明。开头和结尾都是他。至于他切自己那一刀究竟是切在哪儿，韦家辉自己都不知道罢。,1304124,2,2017-10-09,petitespot
62,爱尔兰人是恐怖份子。英国佬是合法的恐怖份子。关玉明则是恐怖份子的祖宗。他女儿要病死的他得炸医院，要交通意外死的他不炸得肇事司机上天不会甘休。一群恐怖份子鬼打鬼导致我最后十分同情汉尼斯。全片翻译腔滑稽。刘涛客串的全部意义就是让大哥最后吃个豆腐。,25723583,2,2017-10-08,petitespot
63,各种网络梗挺low的。有些人物多余。一口台湾腔的土八路是最大笑点。片中日本人的智商加起来也不到100，对于炸桥的必要性又只是一笔带过，看到后来就有点主角开金指组队霸凌智力残障人士的感觉。duang大哥为了儿子是够拼的。,26389069,2,2017-10-06,petitespot
64,,26322774,1,2017-10-03,petitespot
65,前20集还好看，人物有趣，情节发展快，也讲点做生意的道理。之后就陷入到玛丽苏用金手指大杀自方，是个雄性动物都要爱上女主角，坏人集体智商下线的网文套路里去了。我赵克己的人设眼看也要崩……累了。这个故事线其实拍30集差不多。,26801052,3,2017-10-03,petitespot
66,整场电影我心如止水，一毛也不关心主角的死活联军的去留。小伙伴也纷纷表示情绪稳定。能把人看到一脸冷漠的战争片说不来是创举。前半程的时间乱炖没有意义，后半程的情节进展没有高潮。没群像没个性没冲突。无聊。,26607693,3,2017-09-16,petitespot
67,,26717828,5,2017-08-27,petitespot
68,初中就一个人去玩，习惯独断专行。曾被控诉“为什么不肯做一次白痴的角色”，立刻顶回去“跟不守时没体力外语不好还不会算账的人一起旅行，为了自己的安全我是不得不操心啊”。旅行节目撸不少，第一次遇到“跟他出门可以放心当白痴”的担当。看到无论做攻略还是耍机灵都比我强的人带队，真心气顺畅。,26752096,5,2017-08-10,petitespot
69,一集就召唤童年杀欢喜冤家壁咚和车祸。这个节奏可以的。各种手术场景附加名词标注和徒手捏动脉之类的重口也是可以的。吻戏拍成那个样子（韩剧最会亲的男女演员锁定）一度让我怀疑“该不是个披着医疗剧的爱情推拉戏”。是看情节走向应该不是。那后续情节还可以期待一下。PS：现在的告白都这么生猛！,26836806,4,2017-08-07,petitespot
70,收拾东西边上就放这个。一开始就听聊天的部分，料理part完全忽视做自己的事（字典式的买椟还珠）收拾冰箱好玩。学到了不少独炊的小窍门。渐渐也就看一点做菜对决。居然起了挽救我厨艺的念头。崔贤锡虚势爆炸，可我老觉得他喜欢下厨希望给品尝的人带去幸福的心是真的，一边嘴炮一边还帮对手翻菠菜。,26275711,4,2017-07-18,petitespot
71,不太深的爱情不大伤的别离不算狠的反派不救世的最后一战。一个穿紧身衣的少年关急让了不起的成年人看到自己认可自己。够屌丝够少年够轻松。让基顿演鸟人也是够有梗。然而因为事情都不大，看的人也就不大激动。而且这个蜘蛛真的丑。女友也丑基友也丑。又没有那句责任名言，于是扣一星。,24753477,3,2017-07-16,petitespot
72,以90年港产喜剧片来说，把小人物，巧合，神棍，低俗（按摩那一段笑死）和温情结合得恰到好处。最后还有鸡汤一发子。黎明演这种小痞子好玩，因为他气质完全不像，所以再是耍坏耍贱都只觉孩子气。话说我小时候看四大天王认为郭天王最帅，母上痛惜我没审美。回头再看，母上的眼光是比较毒。,1451895,4,2017-07-13,petitespot
73,居然还捞出这片儿……中途几次笑得停不下来。太中二了！漫改没错，但可以改得不要那么羞耻的吖。男主的用场就是色诱女妖兽（误！）把人迷倒之后始乱终弃。虽然剧情一塌糊涂，主题却很宏大。又是反毒又是世界和平。以前跟人八卦过为毛黎明和李嘉欣cp都没好下场。,1293452,3,2017-07-08,petitespot
74,以前港剧的节奏，男主到第四集才正式现身。小时候印象比较深的是摩托车能下台阶！还有同学热火朝天地讨论刘青云是不是垃圾堆里捡来的，怎么长得跟其他人都不一样！！以及大家跟老师吵架说表兄妹明明可以结婚的吖！！！黎明那个时候真心帅，不愧是我妈的男神。我一直喜欢罗慧娟明媚，可惜伊人已逝。,2287762,4,2017-07-06,petitespot
75,拼命偷到世界最大的钻石只为了拿回一份公务员的工作。小女儿用糖果拐了一只野生山羊回家当宠物。这两个设定才是整个系列里最渣的。三条线索彼此没什么关系。大boss是个废物令主线毫无吸引力。没有小黄人就真没什么好看的了。哦，还有80年代怀旧。情怀清仓大甩卖，呵呵。,25812712,2,2017-07-06,petitespot
76,pixar时期的短片里最喜欢的一部。一群神经病。,1756584,5,2017-07-05,petitespot
77,清电脑。把存着没看的片儿都撸了。SB之后就出来秦汉，我知道事情不好。上来就叫秦叔脱裤子，real耿直。后面的剧情就……你们也懂的。但是基友和踢蛋那两段戏实在太羞耻了，中学生写的小黄文么喂！我一面要笑一面尴尬得需要急救。不知道演员是在用什么心情撑下来的。,1967440,3,2017-07-05,petitespot
