,movie_comment,movie_id,movie_score,movie_time,user_id
279,又是一部不IMAX就没看头的片儿。最后一役拍出了众神之战的气派，Hans叔配乐也是拼了。然而前100分钟是在搞毛？人类因恐惧而互相对立这么in时势的主题硬是拍成了直男领袖蝙蝠侠得了老年痴呆变霸凌的戏码。DC也要玩集七龙珠了。所以要先做掉配置超神的。PS：最后那个怪物真的不是以绿胖为原型的么？,24750534,3,2016-03-27,petitespot
280,两位教头很帅。老吴跟年轻时一样。小谢比年轻时帅出一个次元。以上就是全部优点。舞美都是上世纪乡非。说好的少女呢？看来看去一个有少女感的都毛。环节设计无聊。淘汰进程慢。评审无论话术还是综艺感都差。什么推蜜保蜜之类的词真是够了，如果你是蜜蜂你还笑得出来么？,26644306,1,2016-03-24,petitespot
281,侯导这逼装得我给满分。要的就是这个死憋着不吭气，念两段经放个屁的自我陶醉感。摄影和配乐师傅也满分。但是一半演员字正腔圆，一半舌头都撸不直，大家一起讲半文白，吃不消。边上的法国佬表示没懂人物间啥关系。连我都琢磨了半天呢，你们这些姑父娘舅不分的就回去查资料吧。满座，中途两人离场。,2303845,4,2016-03-11,petitespot
282,用耶稣和共产党，电影和现实互相照进的想法挺有意思的。几段致敬拍得掏心挖肺。吐槽也妙。然而，完整性差，节奏不对，明星酱油消费得太厉害，砌段子砌得过于来劲。,2058751,3,2016-03-11,petitespot
283,真实事件改编。苏军这片里的形象比纳粹都差出一个西伯利亚。女医生和Maria坐在床上，先是脸各朝一边，然后转成面视同个方向，这些细节的部分都很有意思。面对生死罪罚信仰，不同的选择，都不施指责温柔以待。最后的最后，居然另到看的人生出面对困境的勇气。唯一的缺点是女主的演技。,26326696,4,2016-03-02,petitespot
284,故事流程对小盆友来说不艰深对大盆友也不无聊。树懒那段，跟法国公务员打过交道的都会心一笑。兔子的微表情做得很棒。然而对所有的群体标签统一嘲讽的结果就是下意识也贴了标签（比如狐狸必然聪明却捞偏门，兔子一定是繁殖癌，猛兽全是雄性，etc）。最后，可惜世界不是一部迪斯尼出品的动画片。,25662329,4,2016-03-02,petitespot
285,主角的苦逼复仇史加入了宗教主题和次数过多的脑补老婆之后，就不如Kill Bill那种刺刀见血的痛快，让看的人也颇觉苦逼。本片应该找贝爷演，他能不用替身不用CG把小李子的活全干了，演技说不定还更好些呢。不过为了小李子的生命安全着想，奥斯卡还是成全了他吧。给摄影和汤老师点赞。,5327268,4,2016-02-25,petitespot
286,雅克·贝汉出品，画面配乐和节奏都有保障。但是主线铺得有些cliche，最后的环保主题真是点得不要不要的。道理我们都懂，但是看人讲大道理就不是那么愉快了,26290455,4,2016-02-25,petitespot
287,如果你想推一个长得路人丑演技路人风但是身材超一流老婆超级红的二流男星要肿末办？答：给他穿紧身衣间歇露肉但是脸要罩起来。文戏全用不需台词功力的屎尿屁，爱情也主要以动作来推。完全量身啊，RR这是真是榜上了大树。不过这种超能力设定得太无解太稳赢了，没意思。以及大boss太帅，于是我立场反转,3718279,4,2016-02-15,petitespot
288,,26363251,5,2016-02-04,petitespot
289,居然把金京浩请来真是吓开死宝宝了！《我是歌手》和《隐藏的歌手》结合版。请来的歌手跟我歌的重合度太高，而且大多是知名前辈，猜起来毫无难度，蒙面的效果达不到。场外评委是大败笔。既不搞笑也不诚恳，感觉其中一群是来表演《说话的艺术》，另一群是来给自己搏人气的。决赛段的打分制差评。,26410674,3,2016-01-31,petitespot
290,巴黎观众看完了还鼓掌，我真给你们跪了。对于不曾去过意呆的人，这是集历史背景介绍，建筑和画作讲解的游前小笔记。对于去过佛罗伦萨的人，这是旧地重温依然无限美。分明可以拍150分钟不要停。,26671329,5,2016-01-29,petitespot
291,本质上就是个玛丽苏遇到白富帅（美）的小言大俗套。用鲁妹是想致敬《双姝怨》么？但无论是外向社会性上还是内向人物性上都差太远。连船戏都不来电。最大的优点是完成度，各项技术指标十分高。女王过于气派和强势，把鲁妹压制得更像是女儿多于情侣。小辣椒的那种气质应该是更适合这个角色吧。,10757577,4,2016-01-28,petitespot
292,如果要好看的电影，这部是了。如果要昆汀的电影，味道就差点。前二章太过正经，以至于旁白和Moriconne的配乐都显得有点尴尬。没有闲碎嘴扯皮的乐趣，三个小时就实在是太太太长了。可以砍掉一个钟头完全不心疼。力气反正都用在最后两章了。痞子到底也是上年纪了。,25787888,4,2016-01-27,petitespot
293,,25954475,5,2016-01-26,petitespot
294,,26609475,4,2016-01-24,petitespot
295,小雀斑肢体管理棒，表情略over，不如女二号。本老湿这是从此不演直男的节奏。卡司和题材赚的分，被浮夸的美指和剧本拉后腿。脱离社会大环境来讲这么个划时代的事件不是不行，那就得入木三分去塑造人物去挖伤痕去掘灵魂。这种肥皂剧情节算什么啊！感觉导演对服装秀的兴趣远远大于主人公。,3071604,3,2016-01-22,petitespot
296,看多了死爹丧妈打黑拳揭发业界黑幕的，偶尔来一发这种纯体育片真是挺不错。男主身材好手速快脚法也不错，专业练过，各种摆动作拍出来的效果都赏心悦目。最后一场比赛的调度稍微差了点，总觉得镜头角度有限，加点主观视角应该更好看呃。爱情戏的部分比较无聊走过场。癌症真是好用烂梗top1,24875409,4,2016-01-18,petitespot
297,有吉恩·凯利和辛纳特拉就该跪了。音乐排舞表演和笑点都是后世致敬的经典没啥说的。有趣的是，只有Ivy符合此类电影传统的女性设定，另两个女主分别是人类学博士和出租车司机，且都在与男伴的互动中占主导地位。倒是能从一部歌舞片里看出二战时大量女性进入职场对美国社会的影响。,1298349,5,2016-01-12,petitespot
298,前半部在监狱里的戏有意思。小幽默，漫画感和时代气息。到了法国之后的戏完全就是流水账走过场了。导演的父母都是传奇啊。但想把这样传奇的人生有点有线有面地浓缩进100分钟，各方面水平都还不够。,26631660,3,2016-01-07,petitespot
299,""" to do anything coolly is to do it genteelly""。弄一部主题高大上的电影远不如搞一部各种有意思有创意有风格，而且把各种坏品味和烂桥段组合倒饬形成一种奇异审美体验的恶趣味小电影。帕尔玛真是很神奇的导演。永远不走寻常路。于是时不时掉沟里，但偶尔不掉的时候，就出神作。",1754975,5,2015-12-30,petitespot
300,看这排片率就摆明是扑街的还是硬生生挤出时间去看，我自问是对得起“脑残粉”的名号了。这打分也就是脑残粉良心的极限了。这片最好看的也就是海报了。小皮，皮哥，皮叔！好歹我的少女心也跟你走了20年，咱还能不能有始有终了？！我要去撸两遍燃情岁月缓缓。,25915947,2,2015-12-27,petitespot
301,把这个故事拍成儿童动作片有意思么？有意思么？！硬把秘密七人团拍成007是我最讨厌的。也就是无敌风景和阿尔卑斯山农民的日常有看点了。还有我看在野火戏诚意满满的份上。但是儿童小说这么拍法简直作孳啊……这熊孩子我能拎起来好好敲一顿足底板么？,26636044,3,2015-12-27,petitespot
302,跟inside job比，这就是一群明星，抖着新东方的段子，在coursera上开了一节“2007年美国经济危机导引”的课。就是当单纯的喜悲剧来看，cynical的范儿也很足哒。就是某些处理上水了些，不够精致。,26303622,4,2015-12-27,petitespot
303,”我是你爹”x7。杜蕾斯果然是最适合的赞助商。3D Imax视觉效果还是很赞哒。不过用repeat了n次的plot交大制作行货的话，找卖拷贝老湿来拍场面节奏感肯定要好很多。反派和女主互相读心那段好像年轻的Snape教授在练习摄魂取念。本系列的脑残粉确实只要看莱娅和汉就够了。,20326665,3,2015-12-26,petitespot
304,传世的配乐，梅姨的演技，罗叔的美貌，草原风光，一般电影占其一就够了。原作是我的第三本原文小说。非常女性化的生命力量。所以波拉克是要有多爱这本书，才能把完好地保留这个风味和时代，并用镜头将女作家回忆中的浪漫极大化。PS：不知有多少人去肯尼亚时会去拜访Denys的墓。他大概不会喜欢这样,1291840,5,2015-12-25,petitespot
305,几个月前才撸过剧场。又把剧本也顺了一遍。这才回出历史大背景与人物小命运之间的关系。两男主是交错时光的镜像。片中出现的中式主题音乐，会哼却喊不出名，倒是与老人与车站那一场的莫名悲伤十分呼应。Audiard爱把悲剧写成喜剧。两男主都是真戏剧演员。然而放烟火的戏，电影毕竟碾压了剧场。,2969480,4,2015-12-17,petitespot
306,这片放现在看就老套了，笑点也无聊得很。不过放回时代背景下，是个很有创意也有娱乐效果的喜剧片。在电话亭里被鲨鱼吃掉真是个好梗……,1470234,3,2015-12-16,petitespot
307,戈达尔挑战“集齐七种艺术就能召唤神龙”，随便黑了一把爱国主义。Marianne是法兰西共和国的象征。失散之后再会，女主Marianne就一身国旗色，而男主Pierrot就没有白色（王室色）。最后还是国家背叛了爱国青年，后者只能把脸刷脸了捆着红炸弹去死。,1292533,5,2015-12-16,petitespot
308,贝萌哥捂着后腰的枪眼，扭大秧歌似地往前跑，嘴里的烟还哧哧往上喷，然后pia叽一下倒在巷口。看着心酸的同时又想笑。小时候不懂。现在看出戈达尔任性得多么别无分店。他跟贝萌哥是天生一对。也只有那种彼得潘气质的，才能一直一直对女生说“我想睡你”啪啪啪挨着耳光却一点不招人厌。,1353745,5,2015-12-14,petitespot
309,除了Moby Dick打酱油的那十来分钟，剩下就是流水账的青年PI漂流记。让小本演Melville走过场完全没有意义。试图炖鸡汤，可惜只有鸡胸肉。就连画面也没啥，都是用旧的老招。IMAX看着效果还行。各位男神的粉们掂量着办吧。,3582181,3,2015-12-13,petitespot
310,莫里哀式的台本和当时算得大制作的场面，把戏剧和电影的趣味都提点出来。时代和所有人物都陷入到男女主角的节奏里，不讲道理不问缘由不顾后果，孩童般的滑稽而无畏。于是大革命也好，恐怖时期也好，都像是一场游戏。亲王侯爵是暴民平众的玩伴。荒谬，于是也就真诚及欢乐。,1427356,5,2015-12-12,petitespot
311,听《冷血》的后半部，作者对Perry的感情很明显，特别是跟Dick的描写两下对比。矮小有力，遗弃的童年，孤独在热闹的人群，憎恨被轻视却始终以为社会未给予其天赋以相应的掌声。作者在其人物身上投射自我。所以选角真是不能再糟。佩佩太帅蛋妞太高而托比太丑（sorry)以至一切都成故事。,1482105,3,2015-12-12,petitespot
312,电影院里喝着啤酒看3D版的希胖简直视觉冲击（嗯，并不享受）本片妙在前半部我希望计划出包后半部却希望丈夫得逞。本片启发了无数后来的悬疑或黑色电影。PS：以稳定环境为前提设计的完美犯罪，会被突发状况打得满身洞。真正的完美犯罪根本不需要这些多余动作，能找到一个确保法庭脱身的因素足矣。,1301231,5,2015-12-09,petitespot
313,很不喜欢小乔对基友抖露心事的那段。太白露。也没必要。但如果不这样就不是老头了。小乔上进，聪明，工作认真努力。但假如他没有泡上白富美，这些品质都是白搭。这才是这个社会的“运气”，俗称投胎术。做派是于连的做派，却不是个英雄种子。于是嘲讽味道更强。寡姐的角色后期转变真是硬上的。,1433577,4,2015-12-08,petitespot
314,各种蠢。剧情蠢台词蠢男女主角蠢得没边。剧中人物都有“盆骨不安症”。屈叔一走路，观众就爆笑。喜剧效果超一流。歌舞赞。40年前的青春片，教妹子们做个抽烟喝酒耍男票的好姑娘简直社会良心（认识我的都知道，这句话不是反讽，是说真的）詹宁姨的两首独唱即使放今天也很挑衅呵。,1300993,4,2015-12-07,petitespot
315,西部风情，欧洲现状，中东恐怖。居然就这么顺手揉一起毫无生硬痕迹。因为女儿跟极端份子私奔，一个家庭两代父子的生命轨迹从此改变。寻找的过程中，丢失了自己原来的社会和生活。托马斯编剧出身，影像出乎意料的考究。挺喜欢最后的结局。搭配最近的恐怖袭击事件服用，效果加倍。,26365913,4,2015-12-07,petitespot
316,能把一个（伪）兄弟相爱相杀的奇情故事拍成以前没有邦德烂梗的大集合也是一种能力吖。编剧连个段子都不高兴写，导演连场床戏都不愿拍。高科技就只有炫了八百年的车。直升机用手枪打下来也是够了。普京一脸想早点领便当回家热热吃的疲态。要Lea演这种角色也是难为她了。是不要又该换邦德了？,11620560,2,2015-12-06,petitespot
317,《冰河世纪》的相像力对折人物画面四折人物三折创意两折的恐龙化低幼版。故事老套。人物脸谱化。说教生硬。没有笑点。没有高潮。所有智能动物的行为都是人模式所有类智能生物的行径都是狗模式，这种套路我也真是受！够！了！然而最后分离的场景姐仍旧掉了两滴泪。果然我情感年龄只有五岁么？！,6875863,3,2015-11-30,petitespot
318,和原著一样，把战争最丑陋的一面给观众看。没有英雄式的死亡没有胜利者的荣光没有复仇者的快感。大家都不过是棋子，你死我活反目为仇只是成就了一场权利的交替。配合时局服用，效果更佳。跟其他青少年向电影比，这个系列在观点上真是良心得不能再良心了。整体节奏也回到轨道上了。,10047547,4,2015-11-29,petitespot
319,斯师傅的又一部申奥类型片。大时代小人物，真实的故事老道的明星。精雕细刻的剪技给镀了一层drama色彩，该有的小幽默都有。打开画的那一瞬情也煽了，回家的戏很好的收住余韵。这就是水平。但是，冷战背景下的美利坚主旋律唱得太热络，力道和重量上欠了味道。打动人情却不入人心。,25908051,4,2015-11-28,petitespot
320,梅姨的亲女儿？！这长相……不大协调啊。最后的皆大欢喜……也不知道应该说啥。分明这么大的阶级和人生观差异，硬是没制造出火星撞地球的戏剧性。不来塞啊。能拿出手的也就是梅姨而已。PS：“我有一个音乐梦想”然后一条黑路走到底的10成有9就是这么个结局。然而你们有我的敬佩。,25853129,3,2015-11-16,petitespot
321,就是蜘蛛侠的三观——能力越大责任越大。但表述方式上年代感明显。我不觉得妈妈有错。前准女婿的过失是偷情，他对不起的是女儿而非女工。探长全程上帝视角上帝脸末了居然还加了段上帝劝世演说。于是剧本设定就是上帝吧。我有点讨厌这个角色。女工其实用不同的人来演效果会好点。,25955491,4,2015-11-15,petitespot
322,三大法语区齐聚一堂过了一把帝国审美的瘾。铁塔都成双塔对称也真是够够的了。罗格朗对蒸汽机和交通工具到底是有什么执念？！这么丑的男女主角也是只有法国佬敢画了还找男女神配音。可能是动画片的关系，主题没怎么铺开。然而分明去看的都是成年人啊！最后大家鼓掌表示看得挺嗨森的。,25821673,4,2015-11-11,petitespot
323,放映结束后，坐在我身边的两位阿姨居然一本正经地开始讨论那个男孩到底是不是男主的亲儿子我真是……以个体（冷漠的）视角去展现集中营，特别是以前没有当过主角的特遣队，idea不错。但无休止的短焦镜头实在看得我烦躁。男主的人设也很让我烦躁。这片居然满座，我真是越来越佩服法国观众了！,26353881,4,2015-11-09,petitespot
324,#论一个妈宝的自我修养# 加一星给最后的creepy结局。我都差点以为会是皆大欢喜的cliche呢。文森特小哥演得扁平而且僵硬。但坚持穿内裤露两点给好评。嘉莲真是越看越美。连身材都这么好！姐姐嫁我！！！,26349410,4,2015-11-08,petitespot
325,第一次看这片儿的时候对Edith还没啥深厚感情，就最后的rien de rien看哭了。前两天看了60年Olympia的演唱会模唱后，又撸了一遍，当年非常吐槽的凌波微步式剪辑突然懂了。拍传记的为尊者讳和多余八卦这两个大坑就这样无声无息地绕过去了，是聪明的。马良那时真的是被附体了。,1898223,5,2015-11-07,petitespot
326,错过了开场……所以在巴黎到底发生了神马！每次看这种为了一颗星主厨搞得要自杀的片儿，都深深觉得自己的味觉对不起吃过的米其林。在这部情节发展一半靠快进的片儿里，人物之间的化学反应倒抓得很好，也是很神奇。Tony小甜心被亲了之后说“谢谢”那段苏炸了。我觉得他比库珀可口嘤嘤嘤,21263664,3,2015-11-07,petitespot
327,迪塞尔的声音永远是加分项。比伏地魔更弱鸡的大boss终于出现了（我都怀疑最后一场戏的时候没预算）。说好的黑魔法攻击呢！真是丢光了女巫的脸。,10440076,3,2015-11-02,petitespot
328,老头儿绝对是被石头妹的腿给迷住了。凤凰的肚腩好评。电影到了30分钟的时候才进入正轨这个前戏有点漫长。起了杀意之后才开始好玩。外国佬真是实诚。下毒这个事情我也想过，哪用得着山埃啊。后面的收尾又太仓促。暗黑感总差了口气，没玩尽兴。女主的人设真是想糊她一脸。PS：根本上升不到哲学吧这个设定,25881888,4,2015-11-01,petitespot
329,政治正确，选材有趣，卡司强劲。但全片都透着一股子尴尬无力感。除了主线戏剧张力弱，老头儿性格无聊，叙事散漫，主角没有化学反应，还有Holm演得瞎烂这些因素之外，他们住的房子用的办公室都特么太像样板房/旅馆了。看着就没人味儿。安妮又开时装秀，然而衣服搭配也不是太出彩。,10594965,2,2015-10-30,petitespot
330,除了猴子和大boss之外，其他角色的造型不是似曾相识就是乏善可陈。故事推进生硬桥段老套情节低幼，江流儿金手指开到外太空，反派智能低下，配乐胡加乱塞。直到变身之前，其实主角叫孙悟空还是黄飞鸿根本没分别。然而，在国产动画里看到“良心”两个字，观众不得不泪流满面。中国观众太不容易了啊,26277313,4,2015-10-28,petitespot
331,哈利波特改名叫彼得潘来到梦幻岛帮助虎克船长和虎莲打败黑胡子共谱风中奇缘的故事……这到底是什么鬼啦！特么的这种情节跟小飞侠有一毛钱关系。小男主演得那个叫一个苦大仇深。我一度以为虎克船长才是主角233333。,25772639,2,2015-10-25,petitespot
332,又名“火星上的贝爷”。设定是在外太空，却不以卖弄视线为主打，而是扎扎实实走科幻（学）的道路。描写人物时，不煽情不乱扯大旗拔高主题。叙述矛盾时，不预设立场不把意见不同一者设置为反派。咱就好好讲个生存故事，多难得！原著本身牛得一比，改编者和制作者也都是有诚意有能力。点赞。,25864085,5,2015-10-22,petitespot
333,这个故事讲得颇有我小学时代给隔壁家还在读幼儿园的小屁孩们信口开河的水平。Yallah Yallah也是洗脑神曲。“我是你爹”的梗表示已经被彻底玩坏。法国屎尿屁作为无脑消遣还是很好用的。,26602796,4,2015-10-20,petitespot
334,照理说吃饭时注意力都不太集中了，仍然get到了一百个槽点。这片儿跟鬼吹灯唯一的关系就是“鬼星人”吧……又是奥特曼打小妖兽又是xman大战外星人，编剧挂的陆川的大名，也就可以理解了。PS：这一堆人里居然是凤小岳演技最好！PSS：赵又廷脸肿成这样还敢演男主这自信（恋）心也是没sei了。,24827406,1,2015-10-19,petitespot
335,我的左眼见到鬼版丽蓓卡借巴斯克维尔猎犬还魂。脱喽就喜欢这种极度类型化的故事配强美术效果并无理由变态的反派。这片跟光和色拼了的节奏。柯南，雪莱和呼啸山庄的细节植入比服装还要好看惹。抖森适合角色到让人无法直视。杰西卡还是演得太露迹，神经病得欠点“内驱动力”。米娅有点浪费了。,23424586,4,2015-10-16,petitespot
336,呸，又走上低幼的路线了。我们成年人想看个好好的动画片真有这么难么？！跟另一位大盆友包场的感觉倒是不错的。,21327493,2,2015-10-13,petitespot
337,飞机观影系列之——我想掌导演和主演每人两个大巴掌。想要玩就玩出点size和style来，要cult却cut不出来那就叫做“卡到阴”好吧。刚开片就香港要扑街，扑街你妹啊。是不是还以为自己玩文字游戏好聪明呢？！谭耀文倒是谜之年轻……,25811357,2,2015-10-11,petitespot
338,飞机观影系列之——反派还是死于话多。而且反派的动机也很神奇（杀一个人而已，需要运用雇佣军犯境么？就不能等他放假回家？你si不si傻）军事迷们也许会喜欢？场面看得出是勒紧裤腰带拍的。吴师傅为了耍点帅也是拼了。马屁拍得太响导致三观有点走极端，对邻国赤果果的敌视，这样政治正确么？,24753810,3,2015-10-11,petitespot
339,这片的主题其实是安乐死么？自从馒头叔之后，真是无法直视“灵媒”这个题材。脑洞要不索性再开大点，要不然就还是科学地圆了好。这算什么吖。我霍爷爷怎么样的，居然去演个神棍。女主妹子某些方面神似力士版的Starling探员，绝逼是故意的。,3217142,3,2015-10-11,petitespot
340,能制服恶的只有更恶。叔特么的又演恶狼了……夜视那段效果让人以为是在看什么电竞实况。居然不是动作片我也是服气的。结果太特么压抑了。为毛每次这种故事里但凡出现战斗型女主都是被心理悲剧掉的干活。,25881247,4,2015-10-11,petitespot
341,本片坏就坏在明星太多。戏份分不均，重点也不清楚。要不你就把登珠峰的细节都说清楚了，要不就把所有重心都放在风暴那一段。现在出来的效果就是人物也不清晰，事故也不惊心。既没有纪录片的实况感，也没有励志片的肾上腺，悲剧也煽得不够尽，让人不知道以什么立场去看。也就是看看景吧。,22265299,3,2015-10-09,petitespot
342,在群嘲声中执意表白着自己天然纯情的坚持，在对于自身天赋能力的无知当中快乐幸福着。终需在真相前倒下的命运。观众从未为其热情与努力鼓掌过，却感动与其陨落。女主的人设是Jenkins，但故事的主体还是belle epoque。悲喜之间，各位主角演技大放送。Sylvain Dieuaide小哥，看好你哟。,26326703,5,2015-10-09,petitespot
343,就是找一群明星演了《中国大案录》的一集皮毛（那个系列里张子强那集绝逼比本片精彩多了，还不用花钱看）。“纯属虚构”后面接真实案件的视频，这个彩蛋是要咽死广电？刘劳模提携后辈的精神可佩。可惜警、匪、质三方角力的局没布起来，戏剧性和紧张感不够。王千源的一口整齐的大白牙太不敬业。,25798448,3,2015-10-01,petitespot
344,身为阿蒙的铁饭，对于这样七拼八凑依仗着观众的情怀明目张胆情节不够道具来凑的东东，也是很难叫出一个好字。亲，童年的竹蜻蜓摇动的除了爱之外还有想像力啊！想像力啊！想像力啊！,25769362,3,2015-09-30,petitespot
345,飞机上看的。因为是王晶，逻辑什么的一开始就已经不作追求了。没有期待也就没有伤害。各路明星靠着老本捞点过年的花销。各位观众念着老情面权当送红包了。也只好这么想。在21世纪看到这种原汤原汁的90年代屎尿屁，也是哭笑不得。王诗龄演技不错，脸也可爱。但看这身材……也只能当童星了。,25858785,2,2015-09-30,petitespot
346,大时代名人物曲折的人生奇突的性格，到了电影里这些都不见了，唯独绯闻情史。巨不见巨微不知微，两头不着落。萧红临死前说的那番话简直对本片的神吐槽。OS掉书袋也只掉落一地鸡皮。王志文老师最佳。冯绍峰则比汤唯演得像，至少人物能立住。身为戏魂的女主，这编排这塑造这演绎值得一大槽。,10545939,2,2015-09-30,petitespot
