,movie_comment,movie_id,movie_score,movie_time,user_id
517,黑色、压抑、刺激。从第一集就被吸引，不愧是大卫·芬奇，除去中间某集关于Francis的背景阐述以及Francis亲自出手杀人以外，全季的政治主线一直保持着高度紧凑，不仅是节奏控制的出色，气氛烘托的到位，史派西的表演也是精妙绝伦。只是最后纸已包不住火，不知道第二季，Francis该如何应对…★★★★☆,6037429,4,2013-02-16,airan712
518,若不是星爷的魔力，单看这该死的阵容和如此破烂特效的预告片，打死我都不会去看的。虽说不少场景与造型还是太过劣质，也让我觉得有些糟蹋《一生所爱》，但总的来说比预期要好不少，在贺岁档能使男女老少逗得乐不可支就是成功。那开头…是恐怖惊悚片吧？小孩不宜吧？猪肛裂为啥不是马里山来演？★★★☆,5308265,3,2013-02-16,airan712
519,充满了儿时回忆和感动，相比起那些高解析的画面，我还是喜欢那些小像素格呀。此片分这么高，可见玩家们都是心软的人啊！★★★★,6534248,4,2013-02-15,airan712
520,这算是变态佬的浪漫悲歌吧，真是好基友一辈子。引入戏中戏的概念，真假不透，剧情往哪个方向走都可以，天马行空，虚实之间让人回味。★★★★,6753166,4,2013-02-14,airan712
521,很久之前跟着店里客服一起看的，看的比较零散，有很多烂梗，搞笑电影拍出了搞笑无能的效果。在徐铮演绎的电影里，算是比较差的一部了。★★,10831449,2,2013-02-07,airan712
522,刨去三级片的外衣，这算是一部文艺片吧？居然还有社会问题的思考与朱自清《背影》的吐槽…还有那《倾城》是闹哪样？…靠！那么大的胸，实在是…接受无能呀。★★,10752040,2,2013-02-06,airan712
523,霍夫曼的演技早早见识过，这次同样了得。电影镜头演技配乐都极赞，但节奏略欠，有些冗长。那些闷骚沉闷隐晦迷幻的元素夹杂，似梦似真谁搞的清，根本无法说出看懂，但会始终在情绪里念念不忘。不过，这是在讽刺山达基吧？但好似太过温吞客气。★★★☆,6433905,3,2013-02-05,airan712
524,本以为是部灾难片，后来以为是爱情片，最后却成了一部俗套的自我救赎教育片，更可气的是这毫无铺垫来得如此生硬的转折也太突然了吧。★★★,6390832,3,2013-02-03,airan712
525,Love is a journey！欧，美好的诗！虽然通篇都是大尺度露点画面以及各式露骨直白台词，但仍旧让这部电影看上去像一部治愈系影片，干净温柔，丝毫不觉尴尬。而每次画面切换到神父，都使人忍俊不禁。不知为何我一度认为男主是史蒂夫·布西密…★★★★,6875420,4,2013-02-01,airan712
526,压在箱底好久了，以为寒冷的冬天可以看到一部温暖有爱的好电影。可是…这寡淡的故事，情感也没多少铺垫，打发时间还觉得时间略长，也就剩下真实发生的元素让人感觉世间存爱吧。★★★,3578925,3,2013-01-29,airan712
527,作为《魔戒》脑残粉的年度必看，整体感觉故事要较之差了一截，没有最初看预告片时那般激动，这个主题也使之格局不会有那么庞大。咕噜的那部分似乎有点多，但不晓得是不是魔戒的力量太强大，以至于它都开始卖萌了。另外…甘道夫和女王是怎么个回事？★★★★,1966182,4,2013-01-22,airan712
528,也许是后半部分实在拍的太精彩，以至于前面两小时的铺垫始终让人觉得有些拖沓。纵观《argo》与《拆弹部队》此片都去掉了那些小花活，冷静严谨的叙述，即使是已知的结局，也同样扣人心弦紧张专注。跟随杰西卡·查斯坦一起煎熬着9/11后的这几年，直至本·拉登被击杀依旧没能解脱… ★★★★,6430835,4,2013-01-22,airan712
529,这是一个拯救老妈子，最后却任务失败的故事。没有以往那般犀利的优雅与风流倜傥，只剩下单纯硬汉邦德，邦女郎的戏份也少，让人记住的只是极赞的片头与同样很棒的Adele。★★★,2363876,3,2013-01-21,airan712
530,黑镜精简版，创意佳。海报还有点法鲨的味道。当一切信息都变得不是阻碍，所见到的东西也都不必在乎是否存在，真正真实的只有思想了。★★★☆,11584413,3,2013-01-20,airan712
531,冗长，流水账，破碎，混沌。对所谓垮掉的一代的表现似乎停留在表象，活力四射又颓废不堪的肉欲生活变成了主角，明星阵容更让这失去了小说的精神内核的电影显得空洞。★★★,1907465,3,2013-01-20,airan712
532,故事实在太过熟悉，虽不及音乐剧，但作为电影而言已算不错。大量的特写的创新加入不仅考验演技，也是一种新的体验。Anne Hathaway戏份不多，却足够抢镜，那首《I dreamed a dream》十分动人，只是Russell Crowe的唱功就实在不敢恭维了。 ★★★★,6860160,4,2013-01-20,airan712
533,没有传的那么神，CCTV6播的普通话版有点影响，但仍不失为好片一部。儿子的角色演绎的不够立体，剧情设置有些刻意，但颜丙燕演的是真好，后劲十足，一个人撑了一部戏。最后那句“婊子养的”真到位…★★★☆,10537853,3,2013-01-17,airan712
534,“当生活在这一瞬间开始向你垂青，如果你不回应便是罪过。”俗套的剧情，从始至终标准美国套路，歇斯底里的碎碎念也是这类负负得正电影的标配。本以为治愈，其实又似乎没被感染到，于是就一切平平…只是，个人比较费解怎么就提名了那么多的奥斯卡…★★★,3094909,3,2013-01-17,airan712
535,“或许这就是我所期望的真爱，能够一起生活、一起死去，始终在彼此的怀中，这样谁也不必悲伤地孤独终老。”耐心不足，151分钟的电影花了几次断断续续的才看完，很多电影的影子。油画色彩的画面与时不时出现的三人乐队伴奏音乐都好喜欢。★★★☆,10355329,3,2013-01-16,airan712
536,看完《Lincoln》再看《Django》有种道不明的感觉…昆丁还是那个昆丁，个人化特点依旧那么明显，血浆飞舞，配乐混搭，只不过刚打了个酱油，于是…他就领便当了… ★★★★,6307447,4,2013-01-14,airan712
537,“如果你能看见时间的种子，并能分辨哪些能生长，哪些不能，那么请你告诉我。”虽不明，仍觉厉。缺乏对美国历史的深入了解，所以故事方面对我而言没有太多的吸引力与代入感，但传递的那股子主旋律精神我想都能深刻感受。目前看来，丹尼尔·戴-刘易斯倒是很有可能三度称帝。★★★★,1889242,4,2013-01-13,airan712
538,“我在最好的时候遇见你，是我的运气 。”功夫只是面子，里子依旧文艺王家卫。重要的不是招，是意。经典的台词，风格化的摄影，细腻的情感，随意的人物设定，标准的王家卫。相对于之前的2D版，3D重制剧情更加紧凑，节奏更快，叙事整体保持了线性，不再跳脱，却又少了一份回味。另，彩蛋可期。★★★★,3821067,4,2013-01-10,airan712
539,导演野心甚大。宏大的故事背景，华丽的多线叙事以及强大的化妆技术，六个独立不复杂的故事不断交错，始终由同一个有些老套的主旨贯穿其中。前1/3略有些云雾，坚持过后便是豁然开朗。世间百态不断呈现，让人回味不已。Everything is connected.★★★★,3530403,4,2013-01-02,airan712
540,“为什么人总是要爱上错的人？因为他们总要爱自己值得爱的人。”叙事怪怪的，不过美式青春电影该有的元素大致都包含了，关于青春痛痒的那些独白与好音乐营造的氛围很棒，这是一部很温暖的电影，重生的感动，青春理应如此。★★★☆,4847665,3,2012-12-29,airan712
541,“她从进这个门开始出了胆量什么都没有，而如今她实现了她的梦想，现在死去她也可以跟自己说，我做得还不错。”没有落入俗套地雨后见彩虹，这就是残酷的现实。★★★★,1309016,4,2012-12-27,airan712
542,每天跟着店里客服断断续续跳着看，蛮乐的。,7065177,2,2012-12-17,airan712
543,太可爱太好玩了！比起第一部来说，制作更加精良，节奏控制的更好，影院里笑声不断，全程无尿点，今年看过最好笑的电影了。虽然徐峥在预告里说过好的喜剧电影不应该是一直笑，应该留有空间，但是煽情的“空间”还是稍微多了一些。但是…导演，说好的人妖呢？★★★★,10574622,4,2012-12-12,airan712
544,一种非常的冷静的视角，冷静到冷峻。极简主义风格，宁静忧伤，一切都是在静静的注视着，镜头留下让人思考的空间。这种爱的沉重很难在一时半会里缓和，我想有一定经历的人都会有所感悟吧。★★★★,4798707,4,2012-12-01,airan712
545,,6011805,2,2012-11-29,airan712
546,“童话故事不是谎言，而是心灵的礼物。”永远拍不够的题材，女性的心灵鸡汤。各种角色各种瑞丽各种违和感和各种奇妙感。★★★,6738712,3,2012-11-29,airan712
547,粗暴直白低俗，从头到尾都没被逗笑过。一集弃。★,20381525,1,2012-11-28,airan712
548,满格正能量，男主角的笑容好治愈，温暖励志的电影。★★★☆,4798888,3,2012-11-27,airan712
549,颁奖季大热。节奏控制佳，气氛烘托佳，情节紧凑，从开场就能抓住观众眼球，使人轻易如戏。除了结尾处有部分自我煽情段落，基本保持冷静直白的阐述真实故事。现在真是越来越觉得，本·阿弗莱克的导演水平强于他的演技，尤其在本片里更甚，或许因为自导自演的关系，颇有些顾此失彼。★★★★,6549903,4,2012-11-25,airan712
550,创意佳，网络拟人化。可惜空有概念...布鲁斯威利是鬼。★★★,3732426,3,2012-11-24,airan712
551,因为包括外婆在内大多都是业余甚至第一次出演，显得格外真实朴素。很多场景很容易有代入感，仿佛回到童年。感触最深的是镇上那个小卖部里的婆婆对外婆说的话，语气那么平和，却又那么沉重。★★★★,1299361,4,2012-11-24,airan712
552,配乐棒，小女孩演技也出色，但粗糙晃动的镜头实在太让我难受了。自作多情的认为隐喻不少，命题很大，但却很难把情绪带入进去，始终游走在外面。★★★☆,7015714,3,2012-11-23,airan712
553,「人生就是不断地放下，然而痛心的是，我都没能好好的与他们道别。」Imax相当加分，这并非3D效果运用的最好的一部电影，但炫目而非炫技视觉效果， 与电影合二为一融为一体。美轮美奂的场景如一场梦与哲学，是信仰与理性的完美对话，孰真孰假其实并没有那么重要。★★★★☆,1929463,4,2012-11-22,airan712
554,有时候不免感慨，现在的广告商是越来越会营销了。八分多钟的微电影，尽管有明显的广告植入痕迹，但确能让人耐心的一直看完。其实幸福一直都在自己的身边，简单的幸福是两个相互吸引磁场的默契感应和积极共识，但很多人都选择擦身而过。★★★,20375279,3,2012-11-21,airan712
555,比预期要好，有不少欢乐桥段让人捧腹。企鹅们依旧那么逆天，而当《Firework》响起，伴随着炫目的马戏团表演，实在太美好啦。★★★☆,3178770,3,2012-11-21,airan712
556,“我虽说不是你的主打歌，但也是你B面第一首。”想讲的似乎很多，时间跨度稍大，但驾驭的并不好。也许悲怆才是生活的真谛吧。★★★,6829652,3,2012-11-21,airan712
557,电影很平淡，但感人至深。动物和人类的感情已经完全超越了故事本身。★★★★,3011091,4,2012-11-18,airan712
558,大选，一个党员的自我修养。能把这么一个枯燥乏味的主题拍得让人有兴致看完也已经算基本完成了任务。朱莉安·摩尔演技神还原，诠释佩林这个几乎对国际关系和经济形势一无所知的政客明星惟妙惟肖。★★★☆,6013489,3,2012-11-18,airan712
559,继《无间道》后十年来最好的香港警匪片，有点言过其实，但相信会成为某种意义上的经典。整体气氛营造出色，简单的故事被精致的层层包裹起来，逻辑清晰，环环相扣。前三十分颇有《蝙蝠侠》系列的调调，但其后的解密使之整体水准直线下降，为续集而续集也不够讨喜。末尾，彭于晏的那个眼神…哟。★★★☆,6890730,3,2012-11-08,airan712
560,总体来说算是不错的商业片，热热闹闹的。只是节奏过慢，故事冗长，故事有点交代得太过清楚。角色太多，单个发挥有限，李心洁一出场就一身Madam味，任达华牺牲颇大，最后只剩下全智贤始终瞩目，漂亮洒脱又兼具幽默。★★★,5502697,3,2012-11-06,airan712
561,且不说那些刺激血脉的剧情，单说让石油渗进了骨髓的Daniel的表演就充满了神圣与绝对，声嘶力竭得诠释着血、韧、钱。像从圣经里走出来的人物，足够享受。★★★★,1945780,4,2012-11-06,airan712
562,好小清新的故事，其实翻译过来并不需要这么文绉绉的片名。而能够将这么简单的小故事做得如此唯美，动画片的魅力也就在此。★★★☆,6313765,3,2012-11-01,airan712
563,总体来说相较前几部观感略有下降，但印记仍然明显，考虑到伍迪·艾伦一年一部的速度，能保证正常的水准已然足够。从巴塞罗那到巴黎再到罗马，跟着他每一座城市都美，每一个角落都有故事，每一对爱人都可爱。虽是轻松小品，但闲来一看就会特别想去疯狂一把，去浪漫一把。★★★☆,6128003,3,2012-10-30,airan712
564,缺少杰森·伯恩的谍影重重总会让人不免遗憾，但杰瑞米·雷纳的表现完全不输于马特·达蒙。而相对于前几部贯穿始终的高潮迭起，这一部由于前戏过于冗长而显得整体温吞，不过后20分钟的追击戏还是挺过瘾的。只是，没有了“身份”，就似乎很难归类到伯恩系列了，只能是一部单纯还是不错的动作片。★★★☆,3001077,3,2012-10-25,airan712
565,凯拉·奈特莉的气质和表现实在很难驾驭这种角色，而且那个下巴总让我出戏回想起她以前的各种剧。乔·怀特拍这类电影真是越来越上手，独特的舞台剧式的故事展现模式，各中细节的拿捏，华丽的镜头感，布景，服饰，音乐…只是整个影片却只停留于小说表面，悲剧色彩浮于表面，没有太多引发观众共鸣的东西。,6110546,3,2012-10-17,airan712
566,剧情简单，满屏的打打杀杀，甩白眼的余男，打酱油的李连杰，用不完的子弹和爆炸场面，从哪里看起都没问题。只是这群老家伙们，还真是看一次少一次。★★★,6040982,3,2012-10-09,airan712
567,我终于在最后一场看了今年最火得节目。★★★☆,11520120,3,2012-10-01,airan712
568,"“the path is a circle, around and around.”故事背景构造得还算有趣，思路很好，但是没有拍开，逻辑上有不小的混乱，思维没有铺开，导致后期剧情处理的太仓促，结尾比较潦草。不过，不管是囧瑟夫还是老威甚至是Summer Qing的妆容都有点不好接受。★★★☆",3179706,3,2012-09-28,airan712
569,“有时候，伟大属于渺小，创造必先毁灭。”背景铺垫得很充实，硬伤稍多，故事到了高潮部分明显感觉到乏力。★★★,3771562,3,2012-09-25,airan712
570,《了不起的狐狸爸爸》拍摄风格的延续，严肃的孩子气。复古精致，童话绘本般的电影。不管是小孩子们还是大牌配件们，每个角色都极其可爱。片尾的小彩蛋还能给人上堂音乐基础课。★★★★,5360889,4,2012-09-23,airan712
571,原著乃一纸渭河平原的磅礴史诗，书中形形色色的人物，展现着不同的性格、品性以及人生。而这部更适合拍成连续剧的电影，哪怕是220分钟的完整版，也不可能完全展现，更别说这院线版的两个半小时，几乎被剪得有些七零八碎。人物性格不鲜明，故事交代太匆忙，只剩下麦田与那些关中戏让人怀念。★★★,4718369,3,2012-09-17,airan712
572,“即使路上发生了好多事，可是终点只有一个。”故事依旧是日本电影最拿手的那些家常琐事，几近平常，平淡杂乱而又有序的生活。细水长流的温情，毫不做作，细节的把握，情感的累积。尤其树木希林的演绎，几乎无可挑剔。就算是后半段早已料到的情感高潮，仍止不住泪流满面。★★★★☆,5975206,4,2012-09-12,airan712
573,整体商业味颇重，噱头有点大，而整个故事又讲的不够好。前戏太过漫长，虽然气氛营造得不错，但又败在结尾太弱，于是乎…毫无亮点。★★★,3592853,3,2012-09-08,airan712
574,极度审美疲劳，几乎每一集都很雷同。剧情简直是弱爆，也没有任何悬念，每集的卖点就是耍帅与腐女们所谓的基情四射。★★★,3620686,3,2012-09-06,airan712
575,惊喜连连，各路妖孽齐聚，跳脱出了传统恐怖片的框架，倒像是披着恐怖外衣的黑色幽默喜剧，让人眼前一亮。又恶心又刺激，吐槽点无比多阿。这部带有自嘲暗喻的影片绝不是一部普普通通的恐怖电影。★★★★,3143676,4,2012-08-31,airan712
576,尽管艾伦·索金给我们呈现的美国新闻世界，不一定完全客观，也或许只是一个梦想。但起码它足够自由，而这恰恰是媒体敢于发声，让真相最大限度靠近受众群体的保证。虽称不上神剧，但有亮点、有幽默、有温情、有政治，如果没有狗血的男女关系，绝对值得满上五星。★★★★☆,6142597,4,2012-08-29,airan712
577,"电影稍有些冗长，主要是面布的太广，以至于不够紧凑以及那股特有的紧迫感。简化版的“文革”内容应该让人颇有印象，最后的反转也略显狗血。虽不及前两部震撼，但绝不失为一部不失水准的续作。一代传奇已然落幕，期待下一个传奇。btw,不看imax绝对是损失。★★★★",3395373,4,2012-08-27,airan712
578,典型的肾上腺素类型片，把几乎所有能打的人都叫上了。总而言之，言而总之，绿巨人秒杀一切。顺道感慨下，越是在忙碌压力大的时候，这种不需要思考的爆米花电影才越有杀伤力。★★★☆,1866479,3,2012-08-21,airan712
579,用鸡巴吐槽政治，足以让吾等俗人笑到癫。各种讽刺各种三俗，但是就是叫你从头笑到尾，爱上了这个萨拉丁，哈哈。而且还有诺顿的串场，我惊了！还是被中石化潜了！★★★☆,4845728,3,2012-08-08,airan712
580,这并不仅仅是一个人的故事和迷茫，而是当时时代背景下一群人的。疯狂之后的空虚，茫然写在两个人的脸上，结局看似胜利了，但等待着的前方又是什么呢？或许歌曲的经典程度已超越了影片本身？★★★★,1292271,4,2012-08-08,airan712
581,不能相信什么所谓的节目单。,11533321,3,2012-07-30,airan712
582,“铸兵利剑，暗夜无当；凝聚础石，长城屹立；腾焰熊熊，炽烈华光；耀耀破晓，璨以晨光；鸣无尽之号角，警外患之袭扰；锻坚钢之神盾，固王国之永宁。”堪称完美的布景和制作，霸气的誓词，交错而又清晰的脉络。第二季留下太多战略性悬念，只可惜带来的震撼不及上一季。★★★★,6558062,4,2012-07-29,airan712
583,花了十多个小时连续不断看完一季，有些欲罢不能的感觉。完整的架构了一个全新的世界，细节精致，人物性格丰满，场面宏大，情节紧凑且忠于原著。守夜人的誓词是大爱。★★★★☆,3016187,4,2012-07-25,airan712
584,在情绪低落的时候能感受到某种触点，但并不强烈。狗血的剧情好似在看弱智韩剧，好在配乐足够动听。如此精致的画面落在如此俗烂的故事中，没心，没骨。★★★,5262338,3,2012-07-14,airan712
585,无需价值判断。★★★★,1292260,4,2012-06-21,airan712
586,边吃西瓜边看烂片，不好意思，我只坚持到了32分钟。★,7155083,1,2012-06-18,airan712
587,"“我们都一样，都能感觉到苦痛，生活中都有混乱的部分，生活本身就使人相当困惑，我明白。”成长就是在各种不同缘由的经历中翻滚，是说不出的兴奋与迷茫。真正的“超脱”并不存在，只是命运让我们间歇性的喘息，至于之后又要陷入怎样的境地，则是另一个需要""超脱""的过程。★★★★☆",5322596,4,2012-06-17,airan712
588,满是槽点的一出黑色政治科幻电影，据说还是粉丝集资拍摄而成，又是导演处女作，能成这样已经很不错了，只是结尾处的正面教育就显得有些与电影气质不合啦。★★★,3103186,3,2012-05-31,airan712
589,一如往常的爆米花电影，整体延续以往的流畅轻松。只可惜60年代的神韵与boss的描绘都不够展开，但小桥段仍旧让人捧腹，3D效果也不赖，再加上一些十分local的字幕翻译，这部算得上十年磨一剑的续作，即便是那类文艺小青年也绝对值得去一回电影院。★★★☆,3642835,3,2012-05-25,airan712
590,当黑暗来临之前，那里有火花，遍布天际。也许是太过奇幻与不合逻辑，以至于很多煽情的部分没让人太入戏。不过要说剧情混乱拖沓吧，似乎每时每刻都会有新的故事发生，不至让人发腻，但这样的一个故事，完全可以精简，毫无必要拍摄成3个多小时的长片。★★★☆,1300374,3,2012-05-21,airan712
591,时代感与画面感都很强，尽管没有接触过那个风声鹤唳，无法看清前方的年代，但那些特有的场景、游戏、生活状态，对于我这种工厂子弟，甚至是仍住在家属楼的人来说都十分容易带入情感。几个小演员十分有灵性，虽故事偏弱，但想象空间丰富。只是这部电影算比较挑人看，有些人就会觉得十分无趣。★★★★,5044737,4,2012-05-19,airan712
592,这是一群不可驯服的野兽与文明的对抗。神使史诗巨制，但又缺乏那股韵气；线分得太细，内心戏也不够细腻，以致于面面俱到却又不得重点。但这么一部绝对有诚意，又有宏大叙事与场景，如此雄浑壮烈气息的电影，实在是华语电影久未出现过的。倒不觉像台湾版《勇敢的心》，却很《启示录》。★★★☆,10450409,4,2012-05-18,airan712
593,《十分钟年华老去·小号篇》其中十分喜欢的一个，被冯远征打动，干净利落的短片，没有废话。百花深处，年华已逝，满是哀伤。★★★☆,1291563,3,2012-05-08,airan712
594,让人惊艳的低成本科幻片，前半部分十分出色，导演作为一名85后，把年轻人心理的表现的十分自然，只是后半部分有些流水，主角的突然黑化也太过直率。看得出导演想挖掘出更深的东西，但是太多停留在了表面，没有直指人心。★★★☆,6053731,4,2012-05-07,airan712
595,简单俗烂的爱情故事，一切都是那么自然而又温暖。最后…那枚钻戒掉落的瞬间，心始终不由自主的咯噔了一下。★★★★,1295899,4,2012-04-21,airan712
596,似韩国版《跛豪》，完成度相当高，虽有不少细节漏洞，但胜在时代氛围营造浓厚，老奸巨猾的崔岷植与酷炫硬汉河正宇两人略带黑色幽默的演绎实在精道。结尾更是应验着因果相报的老传统。★★★★,5924362,4,2012-04-16,airan712
597,很典型的日本纯爱温情电影，干净甜美，温暖感伤，一段命中注定的缘分。也许，下雨的时候就特别容易想念吧，比如此刻⋯⋯★★★☆,1395080,3,2012-04-16,airan712
598,风格更加写实，没有奢华的特技、没有Rose&Jack的生死离别。卡梅隆版《泰坦尼克号》里所有情节人性的刻画基本都是沿用这部老版，几乎没有什么修改。这是一部纯粹的灾难影片，带给人们的只有悲怆的氛围和深深的遗憾。★★★★,1292890,4,2012-04-13,airan712
599,这么多年过去了，每每听到《我心永恒》，心里总不免会为之一颤。那时候的她还是风华正茂的少女，那时候的他还是意气风发一无所有的穷小子，一直记得那句“I've got you. I won't let go.”而其实，3D不过只是噱头罢了，真正的重点是那个“重映”二字。真正的感受绝非这140字能够言尽。★★★★★,5450891,5,2012-04-10,airan712
600,世界第一部科幻电影，意义极其深远，如此丰富的想象力着实让人惊叹与佩服，短短12分钟，已经阐释出电影的多种可能性。★★★★ ,1304310,4,2012-04-10,airan712
601,尽管先前就已知会有诸多裸露镜头，但却不知尺度如此之大，着实颠覆。从头到尾满满的肉欲充斥眼球，但实际停留在脑内的仍是内心活动。彷徨痛苦的性瘾者，压抑纠缠得让人悲伤难受却又欲罢不能。开放式的结局值得玩味，但不免有些太过拖沓，应该适时而止。★★★★,5360890,4,2012-04-07,airan712
