,movie_comment,movie_id,movie_score,movie_time,user_id
1450,电影没有什么花哨精巧的剪辑，有的只是质朴之中最撼动人心的真实。一个真实的故事一个真正的人间炼狱。当世界遗忘他们，国家陷入疯狂的时候，一个比辛德勒更加艰辛的男人在一个人人力求自保的环境下敞开了他的双臂。记住他的名字——保罗·卢斯萨巴基纳。★★★★☆,1291822,4,2010-12-19,airan712
1451,如果能和你永远在一起，为了你，我宁愿留在相片里。——完美的广告，撩动人心的配乐，打动人心的那份哀伤，五分钟能呈现的我想不能再多了。★★★★☆,4915107,4,2010-12-19,airan712
1452,其实并不是那么纯粹的一部女同片，“上了年纪”的周慧敏现在不仅漂亮还很可爱偶尔还感觉特别萌，几位配角也很出彩，几首配乐也十分对我口味。轻松略显散漫的小情调里，除了能找到姐弟恋、早恋、婚外恋、黄昏恋、异国恋以外，作为目前少数还在坚持拍港味电影的许鞍华带给我们的还有一份责任。★★★☆,4145476,4,2010-12-19,airan712
1453,此片里没有一个角色可称之为好人，各人之间冷酷直接，一部由始至终中规中矩但足够吸引人的影片。剧情并不那么跌宕起伏，血腥暴力也不及之前的作品，但依旧能见到北野武式的黑色幽默和只属于他的暴力美学。btw，加濑亮的装扮实在够颠覆。★★★★,3819939,4,2010-12-18,airan712
1454,很久没有出现一部我不想看完的电影了。故事衔接很差，剧情拖沓，男女主角也不够养眼，完全不知道导演想拍成什么样子。建议把电影名改为“恶意安排”。★★,4291258,2,2010-12-17,airan712
1455,画面足够唯美细腻，配乐也十分大气，但故事实在太单薄简单，依旧是英雄式的剧情。不过作为一部儿童动画也不能要求太多。多给半星送给片尾的小动画。★★★☆,3041281,4,2010-12-17,airan712
1456,新浪微博宣传广告——张静初在其中给我的感觉好似一个被刘若英附身的徐若瑄，林宥嘉则跑了个龙套。上下集感觉完全不在一个水平线上，下集简直是鸡肋一般的存在。剪辑和配乐很不错，但面对面还互发微博，这简直是为了广告而广告，这一点实在很让人无语。★★★,5374357,3,2010-12-16,airan712
1457,“走路不要太快，会扯着蛋。”这是一部溢满荷尔蒙的火药桶，这是一部会带来核动力反应的影片，震撼所有人，并且持续许久。130分钟的影片满是高潮，全场观众从头沸腾到结尾，不断的笑声、不断的掌声。无论哪个演员都表现的十分出彩，台词幽默精致，结构紧凑、首尾呼应，唯独缺少一丝控制。★★★★☆,3742360,4,2010-12-16,airan712
1458,“我爱你，小鸡。我爱你，小马。”一个奇怪的家庭组合，一段不惑之年的邂逅，一个关于爱与背叛，成长的故事。但如果不是拉拉家庭的这层包装，故事应该会平庸很多，结尾也略显草率不够分量。★★★,3569969,3,2010-12-16,airan712
1459,“我们的小缺点让我们找到对的人。”没有谁是完美的人，最亲密的人就是能够完美的接受对方的不完美。在那个年代，有许多这样的励志影片，或许现在回头看会觉得俗套说教，但精致的对白，动人的配乐，达蒙与罗宾的飚戏，始终会有抓住你的地方。生活有時候只是一种伪装，真正的声音源自我们内心。★★★★,1292656,4,2010-12-16,airan712
1460,“爱让悲伤终结。”或许不少人看过以后会觉得沉闷单调，但这却是一部需要你慢慢品读的电影。影片并没有多么吸引人的剧情冲突，也没有复杂至深的台词，但从始至终都弥散着淡淡的温情淡淡的哀伤，平静中饱含力量，细腻、真诚，配上拨动心弦的音乐，让人沉浸其中。★★★★,3641108,4,2010-12-15,airan712
1461,“很高兴不认识你，知道是爱就心满意足。”狗血的剧情经不起丝毫推敲，但是男女主角自然不造作外加各种笑点各种小暧昧实在是深得我心，也使得两个小时的影片让人一点也不觉得拖沓沉闷，开放式的结尾和好听的主题曲也给影片加分不少。★★★★,4903613,4,2010-12-14,airan712
1462,极其精致的画面、精彩的剧情、合适的配乐，同时尺度也大的惊人，剧中每个演员都表演的极其精彩，让人感觉这并不像一部电视剧，而像一部大手笔大制作的电影，称之为史诗级一点也不为过。作为马丁·斯科塞斯的粉丝作为一个怀旧控一个黑帮片迷，我只想静候第二季回归。★★★★★,3401355,5,2010-12-14,airan712
1463,这部电影评分是困难的，摄影、配乐极其让人称赞，野外做爱那段更是美好。影片也让人觉得像是意大利版的《查特莱夫人的情人》，但影片实在太过文艺，需要静下心来细细看，不然会觉得故事混乱而又不合常理，但最后五分钟却很震撼，同时也是电影的高潮与升华，演员的表演也都发挥到极致。★★★☆,3195101,4,2010-12-13,airan712
1464,只有无知的人才会去恐惧未知。人类的进步、科技的发展，往往会伴随着生命的牺牲。剪纸类型的电影并不是第一回看，但是如此精致剪纸艺术到确实是头一回欣赏。浪漫的画面、配乐，残酷的故事，结尾也特别有新意。★★★★,2141760,4,2010-12-12,airan712
1465,元彬的戏这是我看的第四部，越来越成熟；金赛纶的戏这是第二部，或许因为《旅行者》里实在演的太好了，而这次戏份也不多，所以感觉并没那么印象深刻。这部《大叔》节奏控制的十分好，表演和打斗场面也很精彩。但我认为这并不是韩版的《这个杀手不太冷》而是更加血腥暴力的《怒火救援》。★★★★,4249355,4,2010-12-12,airan712
1466,秘鲁版《人鬼情未了》+《断背山》。作为导演的处女作，无论是画面、故事还是配乐都美的让人心醉。一段难以启齿又复杂矛盾的爱情，一个自我否定到自我肯定的过程。结尾那一吻，心都碎了。★★★★,4270672,4,2010-12-09,airan712
1467,“被上帝抛弃了的上帝之城”一个除了偷窃，强奸、走私、贩毒、杀人、抢劫无处不在的城市，因为这里无需偷窃，而犯罪的几乎都是未成年的孩子，这里是真正的地狱和人性泯灭的地方。高超的剪辑、丰富的剧情、合适的配乐组成一部十分优秀的影片，更加让人震撼的是这部影片是根据真实故事改编。★★★★★,1292208,5,2010-12-08,airan712
1468,即便再卑鄙无耻的坏蛋终究还是斗不过天真顽皮可爱的孩子。今年的动画片无论从质量还是数量上来说，都能让观者感到幸福。但就剧情而言，还是老套空洞了一点，甚至让人感觉有些虎头蛇尾，不过好在那个黄色的不明生物让人眼前一亮，出周边是王道。★★★☆,3287562,4,2010-12-08,airan712
1469,很多时候我们就像怕怕一样，对周遭的人情事物都会有恐惧感。心里明明很向往别人的快乐，但是自己却不敢迈出那一步。非常温馨非常治愈的一部短片，而且还是来自于学生的创作，十分有潜力。但豆瓣十分的评分太言过其实了，不要一有个卖萌的动画短片，分就齐刷刷的往上涨。★★★☆,5392105,4,2010-12-08,airan712
1470,「有些人消极的死去，有些人却顽强的活着。」第一季终于完结了。刚开始的两集十分精彩，引人入胜，但是后面的几集逐渐趋于平淡走向僵尸片的老套路。整集下来感觉化妆很不错，但特技部分却有失水准。Btw，S106里Dale对Andrea说的那段话实在是让人感动不已。★★★☆,4067152,3,2010-12-07,airan712
1471,“我从未见过如此耀眼的你……”未来的你是否会让现在的你失望？一贯的恶搞无厘头，成人版的小新被各种马赛克遮脸，几首配乐都十分好听，顺带还吐槽了一下铁人28。对于未来……就按自己的规划好好活着吧。★★★☆,4907844,4,2010-12-06,airan712
1472,“生命总是苦涩的，但记忆总是定格在最美好的一刻。”这类电影很挑人看，要么看过会觉得如美好的诗词一般让人沉浸其中，要么就是觉得太过平淡无味。没有大起大落的故事情节，对白极少，影片也没有使用任何人工音乐，留下的只是来自大自然的声音和精致自然的画面。★★★☆,4221335,4,2010-12-04,airan712
1473,“人生若只如初见”一部十三分钟的民间版豆瓣使用手册。不可否认，绝大多数人使用豆瓣认识豆瓣就是被这些功能这种氛围所吸引。只不过……和最初的那个她相比，现在的她已然是面目全非了。,4917689,3,2010-12-03,airan712
1474,“我喜欢你，我做的一切都是为了你。”一部很纯情很清纯很阳光的泰式爱情电影，故事本身并不多出彩，甚至让人觉得狗血过头，但我相信这是一部让几乎观影的每一个人都能在电影里找到共鸣的影片。能够回忆起曾经自己初恋暗恋的那些小事，回忆起儿时朋友间玩闹的趣事。btw，“凤姐”蛮可爱的。★★★☆,4739952,3,2010-12-03,airan712
1475,我就是容易中这种电影的毒，我爱它温馨而又并不故作高深，我爱它简单纯真能勾得人会心一笑，爱它能让我突然感动得一塌糊涂。电影里每个主演配角都很讨我喜欢，配乐也恰到好处。Joey King不管捣蛋调皮还是开心幸福都让人感觉好萌；Selena Gomez也是越长越水灵。★★★★,3071517,4,2010-12-01,airan712
1476,"“I bless the day I found you.""有人或许会认为这种以独白为主和双角度的叙事表现方式会降低故事的感染力，但我却十分喜欢这种表现形式。故事虽然单薄，也很模式化，结尾也略显仓促，但看过以后是绝对不会想要给予低分的。Btw，字幕后那段钢琴曲太美妙了。★★★★☆",3319755,4,2010-11-30,airan712
1477,“别贸然踢烧尽的煤灰，你是否曾经……被燃烧成灰？”并不太复杂的故事被拍成两小时多，有些拖沓，有不少枝节其实可以适当砍掉，有些段落略显做作。电影整体比较讲究，很有诗意，尤其是片尾部分。是需要很用心的去体会的，不然会觉得平淡无味使人昏昏入睡。★★★☆,3212965,4,2010-11-29,airan712
1478,昨天看的时候不知道是因为一天下来太累的缘故还是因为电影本身，总之看得只想睡觉。总而言之，这种应景的节日动画，始终有炒冷饭的嫌疑。★★★,5323683,3,2010-11-28,airan712
1479,逃不出青春校园喜剧的框框，故事比较简单，但Emma Stone身材足够吸引你看完全片。来自布鲁克林依旧一脸傻像的Dan作为路人甲与花瓶的存在，好在有Patricia Clarkson这个黄金配角，每次出场开口说话，都能让人由心的开怀大笑。作为一部解闷片，电影已经做得不错了。★★★,3213173,3,2010-11-25,airan712
1480,“世界上最遥远的距离，不是生与死。而是我就站在你的面前，你却不知道我爱你。”Sarah Polley执导的首部长片，故事或多或少有点拖沓，但虽色调平素，电影本身却蕴含力量。即便爱已老去，却依旧动人，记忆，让曾经动人的爱情持续。用心去爱一个人，无论如何，都是美好的。★★★★,1874383,4,2010-11-25,airan712
1481,“心伤不是坏事，说明你曾经付出过。”更喜欢台版的译名《享受吧，一个人的旅行》。大多数人这一辈子总会有所改变有所失衡，但敢于承认且作出改变的人并不多。虽说电影被分成三段式，但两个半小时的长度还是多少需要再压缩。有人说这是一部无病呻吟的影片，但我觉得很多东西只有经历过才能明白。★★★,2033822,3,2010-11-24,airan712
1482,"""The truth can be adjusted。""我想，如果对乔治·克鲁尼无感的人看这部电影会觉得很累很闷。虽是打悬拟剧情牌，不过导演并没有成功的营造出多强的悬疑感。但影片中精妙的对白、独特的视角、引人入胜的冲突以及恰到好处的配乐使得电影给人感觉焕然一新。★★★★",1905790,4,2010-11-22,airan712
1483,“一有机会，我就开始找你。”通过一个诙谐荒诞的场景设置，以苦中作乐又悲中带喜的方式来追忆感人的往昔。导演十分注意细节部分的描述，好几处情节都能感受到父亲对于女儿的关爱，且那么自然不做作。影片结尾的处理更是让我十分喜欢。★★★★,4307349,4,2010-11-21,airan712
1484,"脱线说的几个故事不但精彩，更加让人分不清到底是真的还是在吹牛，天然呆的麦昆总是被弄得一愣一愣。不过我想，如果不在美国生活过或是很懂美国文化的还真笑不出来…… ★★★☆

",4068362,4,2010-11-21,airan712
1485,没看过原著的人可能会被不少人名弄混淆。色调是越来越暗，整个电影就是无尽的奔跑，除了中间部分略有拖沓，上下部分节奏控制得很好。电影中零星出现的笑点总是能逗得整个影院哄堂大笑，特别是哈里与赫敏在帐篷那段舞蹈尤为打动人。Btw，死亡圣器的那段童话故事的皮影戏个人觉得十分有意思。★★★★,2051007,4,2010-11-19,airan712
1486,仅前半部分可看。★★★,5349365,3,2010-11-17,airan712
1487,片中画外音、方言和口琴的这些声音运用是我十分喜欢的一个部分。平淡的情节发展，没有半点戏剧冲突，可就是这种真实才最具感染力和张力，但个人气息太过浓厚。★★★☆,3732800,4,2010-11-17,airan712
1488,彭胖子的电影总显得有些特立独行，这次是大玩cult。虽讲着香港楼市的故事，但实则故事和主题没多大关系。影片涵盖色情、血腥、暴力、恶心，各人死法也是千奇百怪，只可惜硬伤不少，节奏控制上也没有给人带来多大的冲击力。另外我想如果何超仪没出资的话，应该也没几个人会找她来当女主角吧★★★☆,3642866,4,2010-11-02,airan712
1489,一个盲女的内心白日梦。即便是眼睛看不见，但只要心里仍充满阳光，一样可以活得多姿多彩。画风简单但不粗糙，但这算是几米画风+吉卜力幻想+久石让式配乐么？★★★☆,5326589,4,2010-11-01,airan712
1490,除了55秒算是亮点，我不知道还可以写出点什么。★☆,5336877,2,2010-11-01,airan712
1491,“梦想这东西和经典一样，永远不会因为时间而褪色，反而更显珍贵。”也许我们的这一生会极其平凡，但我们终究不能忘掉那些当初的梦想。虽然是一部短片，但却能看得出很用心，一点都没有马虎。故事三星半，音乐五星。★★★★,5344178,4,2010-10-30,airan712
1492,"“Your're not an asshole,You just trying so hard to be one.”大卫·芬奇把一部传纪片拍的如此有张力，如此扣人心弦，还能让人偶尔感觉到笑点，OST也是恰到好处。facebook虽看起来很酷，却暗藏悲凉。★★★★",3205624,4,2010-10-30,airan712
1493,"莫洛指尖夹烟，用冷峻深邃的目光凝望镜头道出“Good Night, and Good Luck.”的镜头肯定会留在每个人的脑海里。没有跌宕起伏的剧情，没有夺人眼球的炫技，片中几首爵士歌曲曲动听，足以为影片加上一星。麦卡锡本身是个很不错的题材，但总感觉功力不够导致需要靠大量台词助力",1431617,4,2010-10-29,airan712
1494,影片从一开始就奠定了整个故事的基调，又冷又硬。故事题材选的不错，和《冰冻之河》有些许类似，在如今这个商业电影泛滥的年代是比较难得的，但不知是文化差异还是其他缘故，总感觉不够深刻。btw，叔叔泪珠的角色很讨我喜欢。★★★,3610676,3,2010-10-26,airan712
1495,电影史上第一部动画片，无尽的想象力。,1856043,4,2010-10-25,airan712
1496,“如果你感觉那是真爱，那就永远不会晚，你只需要勇气，去追随你的内心。”认识Amanda Seyfried是在《Mamma Mia!》，当时觉得这个女孩好灵。美妙的意大利风景，美妙的音乐，美好的爱情，让人沉浸其中。经常泡在这种浪漫爱情电影里会觉得视觉疲劳，但偶然一看绝对会无限向往。★★★,3346464,3,2010-10-25,airan712
1497,“虽然你行的是鸡鸣狗盗之事，但也不用摆出一副鸡鸣狗盗之相。”区区6000美元的成本，克里斯托弗·诺兰一人负责导演、编剧、摄影、剪辑，虽不及《美国丽人》、《肖申克的救赎》那样的经典处女作，但也绝对可称之为传奇，短小精干，非线性叙事的佳作。★★★★★,1397546,5,2010-10-24,airan712
1498,剧情紧凑，但感觉收的太紧。虽纳粹电影甚多，但这部算是比较小众而与其他大片大不一样，从不同的的角度展现犹太人对纳粹的理性抗争。在生存面前，并没有什么正确和错误，每一个人都有他自己的选择的理由。但作为奥斯卡最佳外语片，有些过誉。★★★★,2381810,4,2010-10-24,airan712
1499,纯正的港式爱情小品，虽情节老套却不失温馨浪漫，整场电影笑点不断，让人从头到尾笑得合不拢嘴，尤其是《笑呵呵，地铁有色魔》。另外就是周秀娜那个胸实在是太霸道了……★★★☆,4271832,4,2010-10-22,airan712
1500,三个小时长的剧场剪切版，彻头彻尾的cult片，荒诞、恶心、暴力、幽默、血腥，极具视觉冲击力。不用去管腿上的机枪怎么开启，不用去管留在农场当担保人的李最后怎么样了，只需要自己看着舒服过瘾就足够了。btw，为什么一到关键时刻就出现“影片遗失”阿，我去！哈哈哈~★★★★,1482090,4,2010-10-22,airan712
1501,“即使是一个命运悲惨的烂人，一生中也该得到一朵红花。”山田洋次再次带来十分出色的影片，有泪有笑，人物很生活，表演的都很自然。小百合的气质真是没有话说，弟弟临终前小百合那个侧面特写，完全被打动。只不过苍井优在众多老辈面前显得有些不足。★★★★,3395437,4,2010-10-21,airan712
1502,没有什么大的起伏，平白的讲述着几个不同国家，不同家庭，不同阶级的故事。有《巴别塔》的味道，剧情发展没有那么给人带来触动，但绝对不失为一部好电影，值得一看。btw，豆瓣评分略低。★★★★,2143921,4,2010-10-21,airan712
1503,不知道应该说电影的前2/3讲述的太慢，还是应该说影片时间应该再长上几十分钟，仓促的结尾让人感觉莫名其妙稀里糊涂，很多事情都没有交代清楚，便草草了事了。另外结尾的那段独白也让人摸不着头脑。btw，为什么Carey Mulligan的胸在这里面显得那么假呢？★★★,2034948,3,2010-10-21,airan712
1504,不知道到底是陈真还是叶问是霍元甲还是蜘蛛侠，总之都是一个套路。对于『精武英雄』这个剧名也感到莫名，影片里牵扯的并不多，故事东扯一点西扯一点毫无目的性。这种所谓的爱国电影泛滥最终的结果就是剧情没有任何厚度，民族精神没有任何深度，敌我双方决战没有任何力度。★★,3792816,2,2010-10-20,airan712
1505,,1790418,3,2010-10-20,airan712
1506,,1308451,3,2010-10-20,airan712
1507,,1303751,3,2010-10-20,airan712
1508,,1304900,3,2010-10-20,airan712
1509,故事讲得有些罗嗦，电影前面三分之二的内容有些枯燥沉闷，最后的复仇过程和真相揭晓又显得不够过瘾，不过影片的调调和配乐的选择很不错。btw，刘玉玲在这里面演得还是有一点小可爱的。★★★☆,1478582,4,2010-10-20,airan712
1510,认识柴崎幸是从《大逃杀》，其后看过几部她参演的影片，都不怎么喜欢她，觉得实在很恶，也不理解为什么这样子一部影片会让她担任女主角，但随着时间推移，却感觉十分合适。电影画面处理的有些童话有些奇幻，各色餐具，马赛克墙面，迷你菜单架，样样都很对味，能在这样的餐厅里吃饭简直是超级幸福。,4030411,4,2010-10-19,airan712
1511,这种有枪有爆炸有动作的，也别指望剧情能有多出彩，当然也不是冲着这个来的。如果说《敢死队》是主打动作，那么这部电影就完全是嘴巴上的功夫了。btw，豆瓣上又名夕阳红别动队还真是恰当其分，几个退休老干部悉数登场，Helen Mirren气质超好~★★★,3104794,3,2010-10-18,airan712
1512,故事一盘散沙，对华尔街的描述点到即止，剧情跳跃的十分厉害，感觉整部电影拍的支离破碎，不伦不类，结尾也十分牵强。Carey Mulligan片中那一段傻笑，完全被秒杀到。★★,3103683,2,2010-10-16,airan712
1513,座头鲸和座头牛太扯蛋了，笑死个人。但二维动画和三维动画搅合在一起那种违和感好强烈，突然觉得二维动画好可爱好好看~★★★,5325354,3,2010-10-16,airan712
1514,很深刻也很犀利同时亦令人绝望，并不会太想再看一遍。希望永远都只会是失望，因为这世界一切都那么烂，那么烂，或许当她死后得以重生，才能见到美好。btw，女主有不少时候让我觉得超像Carey Mulligan。★★★★,1298973,4,2010-10-15,airan712
1515,XOXO gossip gay,5308264,,2010-10-14,airan712
1516,节奏慢是有它慢的道理的，用心体会就能发现它相当唯美，意味深长。没有激烈枪战，取而代之的是细腻优美的画面，印象最深的是那片微风中枯黄的田野。人物内心感受也把握的很准确，恐惧、犹豫、怀疑。btw，佐伊果然是跑了个龙套啊~★★★★,1482099,4,2010-10-14,airan712
1517,朴实下来到底是比上集那个《金鱼小姐》好太多了，Arms and Legs 的let go也很赞。生命没有投机，平凡也能创造奇迹。★★★☆,5265166,4,2010-10-13,airan712
1518,故事虽然简单，但却是一部超过预期的武侠影片。节奏控制得很好，武打场面行云流水十分精彩，不过十分不明白为什么会让大S参演，真是败笔。ps，敢不在片尾打出“吴宇森作品”么？★★★,3813779,3,2010-10-13,airan712
1519,只能说，柯南依然是一种习惯，到了现在这个份上看的已经不是片子的好坏而是一种感情的寄托。这集整体节奏到不再是之前那样松散了，但这也是牺牲悬念换来的，柯南已然成为了一名特工。另外，这部片子是给腐女们看的吧……囧。★★☆,5153329,3,2010-10-13,airan712
1520,对比第一部，差了很远。,3836722,3,2010-10-12,airan712
1521,不管一还是二都是搞笑喜剧。,4091908,3,2010-10-12,airan712
1522,不管一还是二都是搞笑喜剧。,3837495,3,2010-10-12,airan712
1523,佐伊给我的感觉总是非常真实而又美丽，每次看到她在电影里，都会被深深吸引。故事前半部分表现空虚迷茫时有些刻意做作，后段的感情戏平淡而又舒服。配乐值得多加一星，十分对味，曲曲动听。★★★☆,1758389,4,2010-10-12,airan712
1524,餐厅好似一个神奇的地方，在这里的人可以逃离现实，可以和家人朋友聚餐，当然也可以失恋以后再次找到恋爱。不同的眼光去对待它，或许就会慢慢发现不一样的风景。不一样的阿金，却依旧动人心弦。★★★☆,3104216,4,2010-10-11,airan712
1525,也许里面很多理论不是那么浅显易懂，但这并不是在危言耸听。所有的事情都在发生，也会持续性的发生，而罪魁祸首就是我们自己。★★★☆,1945781,4,2010-10-11,airan712
1526,同样是斯蒂芬·金的作品，秘窗明显要弱于闪灵和危情十日。影片气氛渲染的一般，叙述手法也有些直接，但约翰尼·德普的演技却毋庸置疑。★★★,1309171,3,2010-10-10,airan712
1527,,3041294,3,2010-10-09,airan712
1528,,2269893,2,2010-10-07,airan712
1529,虽然世态炎凉，但人间自有真情在。一个纯朴的故事，朱老爷子的表演可谓炉火纯青。也只有那种年代才能感受得到国内电影人的诚意，是在用心创作，而不似现在这般。★★★★,1293237,4,2010-10-06,airan712
1530,如诗如画的电影里处处透出一缕缕温情。美好的生活不在于有多么绚烂多么激情，而在于平和平静。当人已老去，只有大河依然为伴，沉淀下已逝的美好。★★★★,1292718,4,2010-10-06,airan712
1531,虽然没有皮克斯那么有深度，故事情节也略显老套，但是好的电影就是能让观众沉浸其中，不管是用画面用音乐还是用其他的。错过档期没去电影院看3D只能说是一种遗憾，还好720p的效果也十分的赞，这应该是我今年到目前看过最好的一部动画片。★★★★☆,2353023,4,2010-10-05,airan712
1532,和《美国田园下的罪恶》很类似，让人看后极其压抑。这类影片最大的优势是其剧本本身就很具有煽动性，很容易带出人们的怜悯和同情，但这并不代表演员的表现不够出色，而恰恰相反，正是通过小女孩出色的的演出使我们能够切实的感觉到自己的对她心生怜悯的同时又愤怒至极。不过，对最后那封信有些许不理解,1794360,4,2010-10-04,airan712
